;kurz;source_domain;title;match;match_long;type
86074;boesenBuben;lex-barker.eu;Lex Barker - On Location - Kamera ab;lbart als bösen Buben. Übrigens;el Return Of The Badmen (Der Schrecken von Texas, 1948) zeigt Lex Barker mit Vollbart als bösen Buben. Übrigens: Wer glaubt, Johnny Weissmullers Auftritt in Tarzan's Desert Mystery (Tarzan, B;Redewendung
51183;boesenBuben;weorterworte.jimdofree.com;Blasphemie - weorterwortes Webseite!;len - die bösen Buben unter den;t-Sottisen der Satire-Zeitschrift “Titanic” bestätigen die Regel. Die Evangelikalen - die bösen Buben unter den Christen - mucken zwar hin und wieder auf, müssen aber zugeben, dass sie genaus;Redewendung
41366;boesenBuben;digitalmall.alstertal-einkaufszentrum.de;Das große farbige Wilhelm Busch Album | Alstertal-Einkaufszentrum, Hamburg;lene, die bösen Buben Max und M;isten Deutschlands wurde. Wer kennt sie nicht: die leider gar nicht so fromme Helene, die bösen Buben Max und Moritz, den likörliebenden Raben Hans Huckebein und all die anderen unsterblichen;meta
58125;boesenBuben;www.arsmundi.de;Bisky, Norbert bei ars mundi - Die Welt der Kunst;ler seine bösen Buben in Öl aus;"Albträume auf Leinwand gebannt
""Auf dem internationalen Kunstmarkt werden dem Maler seine bösen Buben in Öl aus der Hand gerissen, in Deutschland begegnet man ihm zurückhaltender und kritisch";Redewendung
170846;boesenBuben;www.aschendorff-buchverlag.de;Spaß mit Latein | für Groß und Klein. Spiel-, Tanz- und Bewegungslieder, Frage- und Ratespiele, Würfelspiel und szenisches Spiel zur Unterrichtsgestaltung Latein | Franz Schlosser | Aschendorff Verlag Online-Shop - Bücher & Fachzeitschriften;lm Buschs bösen Buben Max und M;e Gestaltung eines lateinischen Steckbriefs, ein Sketch im Beichtstuhl mit Wilhelm Buschs bösen Buben Max und Moritz als reuigen Sündern, ein fächerübergreifendes (Latein, Englisch) szenische;meta
22763;boesenBuben;www.lokalkompass.de;"Begriff ""Alternativlos"" stößt auf heftige Kritik: Bürgerforum Gladbeck fordert SPD-Hübner heraus - Gladbeck";"ls einen ""bösen Buben"" ausfindi";"hrliche Diskussion geben müsse.
In Michael Hübner hat das ""Bürgerforum"" jedenfalls einen ""bösen Buben"" ausfindig gemacht. Matthias Raith: ""Ein Politiker, der in mehreren ausgeübten und angest";Redewendung
18874;boesenBuben;musicpubexpress.de;Die sechs erfolgreichsten deutschen Rock- und Metal-Bands - musicpubexpress.de;lt zu den bösen Buben unter den;"uropa in den Charts.
Brachial, provokativ und verstörend: Die Band Rammstein zählt zu den bösen Buben unter den deutschen Metal-Acts. Auch neben zahlreicher Nebenprojekte der Bandmitglieder s";Redewendung
54881;boesenBuben;heimatlobby.com;Wahnsinn – heimatlobby;läuterten bösen Buben, als Must;"e, die unser Gemeinwesen verachten
Die deutschen Medien feierten Bu-shido als geläuterten bösen Buben, als Musterbeispiel für Integration, und sonnten sich dabei in ihrer angeblichen Toleranz";Redewendung
35723;boesenBuben;kirchheim.forum2030.de;Hans Dörr | Kirchheim. Forum 2030;mage des „bösen Buben“. Nebenbe;chen Karriere von ganz links nach ganz rechts gedriftet und kokettiert mit dem Image des „bösen Buben“. Nebenbei arbeitet Elsässer emsig an einer paneuropäischen Allianz der Rechten. Er ist i;Redewendung
79325;boesenBuben;www.reichskolonialamt.de;Struwwelpetriade „Schwellkopf Wilhelm“;mahnt die bösen Buben. Sie wäre;den englischen Struwwelpeter-Versionen den dort unbekannten Nikolaus ersetzt) ermahnt die bösen Buben. Sie wären nicht dazu gemacht, die Sonne zu fühlen. Ein Kampf mit dem Briten würde nur zu;Redewendung
9999;boesenBuben;www.thg.hn.bw.schule.de;Wandel und Kontinuität - 380 Jahre Gymnasium;man einen bösen Buben nennt. Gl;en können. Ich war wohl ein guter Schüler, aber kaum bezweifelbar auch das, was man einen bösen Buben nennt. Gleich zweimal innerhalb von dreier Wochen saß ich oben im Karzer, der einen vergi;Redewendung
103798;boesenBuben;www.lonnysfilme.de;Lonnys Filme;meintlich bösen Buben, dem man ;"bernommen.
Kommentar zur TV-Miniserie:
Natürlich gibt es wieder einmal einen vermeintlich bösen Buben, dem man aber sofort glaubt, dass es die ganze Welt schlecht mit ihm meint und er nur daf";Redewendung
149719;boesenBuben;at.goontravel.club;Indonesien - detaillierte Länderinformationen - Länder;"mend von ""bösen Buben"" der russ";"ählt, die als die besten der Welt gelten. In den letzten Jahren wurden sie zunehmend von ""bösen Buben"" der russischen Bürokratie und des Öl- und Gassektors mit ihren langbeinigen Freunden sow";Redewendung
140328;boesenBuben;www.sackstark.info;Sackstark! | Armutsschere: Schweiz einsame Spitze;"mer 1 der bösen Buben.
Island r";"achen Kriminalität bereits im letzten Jahrhundert überholt und ist heute die Nummer 1 der bösen Buben.
Island rettete als einziges Land Bürger statt Banken
SRF sendet nur, was Sie wissen dürf";Redewendung
152184;boesenBuben;www.abendblatt.de;Nach dem Konzert der Rolling Stones flogen die Steine - Hamburger Abendblatt;n auf die bösen Buben ab. Der V;"ders Anthony Burgess.
Die Idee passte voll in die Zeit, auch deutsche Fans fuhren auf die bösen Buben ab. Der Vorverkauf lief so gut, dass schon in Münster aus dem geplanten Konzert flugs zwe";Redewendung
123362;boesenBuben;www.tele.at;"""Miller's Crossing"" - Film - Gangsterfilm - OnDemand - tele.at";n der die bösen Buben der Stadt;Miller's Crossing – so heißt die beschauliche Waldlichtung unweit von Chicago, in der die bösen Buben der Stadt ihren menschlichen Sondermüll zu entsorgen pflegen. Liebe, Hiebe, dunkle Triebe;Redewendung
215586;boesenBuben;hoerfilm.tvbutler.at;In memoriam Ute Bock | TV-News Archiv | TVButler.at;n für die bösen Buben“ am Samst;" Bock zu Gast bei Elisabeth Scharang war.
„Ö1-Hörbilder: Mama General – Ein Leben für die bösen Buben“ am Samstag, 20. Jänner, 9.05 Uhr, Ö1
Frau Bock ist 57. Sie hat eine angenehme Stimme. We";Redewendung
70423;boesenBuben;ford-usa.ch;wohliges Röhren. Zeitgleich beschleunigt der Riese auf vier Rädern als wäre er leicht wie eine Feder. Jeep Grand Cherokee;n ihn zum bösen Buben. Wem das ;in Spoiler angebracht. Die Fünfspeichen-Leicht-metallräder mit Breitreifen machen ihn zum bösen Buben. Wem das Aussehen zwar wichtig ist, aber doch etwas mehr Understatement bevorzugt, soll s;Redewendung
13497;boesenBuben;frblog.de;Das Schweigen der Frau Merkel | Bronski - das FR-Blog Das Schweigen der Frau Merkel – Bronski – das FR-Blog;n mit den bösen Buben vom IS (o;"e; wir haben uns zu fügen, weil es sonst vielleicht zu einem kleinen Attentätchen mit den bösen Buben vom IS (oder Sonstigen) kommen könnte. Könnten ja von denen auch welche auf der Gehaltsli";Redewendung
104867;boesenBuben;phantastiknews.de;Comic-News;n sie den bösen Buben auf der S;und Micky Maus, ihres Zeichens brillante Ermittler, keine Hinweise und so bleiben sie den bösen Buben auf der Spur. Freuen Sie sich auf einen ganzen Aktenschrank voller abenteuerlicher Krimis;Redewendung
65990;boesenBuben;www.baf-berlin.de;Filmkritiken zu Kinostarts im Februar 2020, Teil 1 | Berliner Arbeitskreis Film e.V.;n sie den bösen Buben den Garau;ey“ lebt von seiner starken Frauenpower. In waghalsigen Kampfchoreografien machen sie den bösen Buben den Garaus. Die bonbonbunte Actionkomödie lässt so manchen Actionhelden blass aussehen. F;Redewendung
73971;boesenBuben;blogactiv.eu;Der Euro ist kein Problem der Hedgefonds – EU opinion & policy debates – across languages | BlogActiv.eu;n und die bösen Buben der Hedge;"e laufende Diskussion nicht sehr vertrauenserweckend.
Die sogenannten Spekulanten und die bösen Buben der Hedgefonds haben also nur die Finger in die Wunden des Euros und der massiv überschul";Redewendung
101749;boesenBuben;www.gbase.ch;All Points Bulletin - Reloaded Review/Test : Eine neue Stadt erhebt sich : PC : (1/3) - auf GBase.ch;n was die bösen Buben anstellen;ge nur dazu, die beiden Parteien in ausgiebige Schusswechsel zu verstricken. Denn was die bösen Buben anstellen müssen, das müssen die guten Jungs natürlich verhindern. Maximal 100 Spieler kö;Redewendung
23643;boesenBuben;www.migrosmagazin.ch;Archiv - Flüchtlingshilfe | Migros-Magazin;n wir die bösen Buben und Profi;"dividualität.
Haben Sie so das Chaos im Lager gelöst?
Ja, mit viel Dialog konnten wir die bösen Buben und Profiteure isolieren. Als sie zu Demonstrationen aufriefen, folgte ihnen niemand mehr";Redewendung
100836;boesenBuben;batmanprojekt.com;Ra’s al Ghul | Das Batman-Projekt;n, um die bösen Buben auszuscha; Noch-nicht-Robin Tim Drake springt auf den Riesenpenny und bringt ihn zum Rollen, um die bösen Buben auszuschalten. Dazu gibt es leichtbekleidete Frauen und einen sehr luftig gekleideten Ra’;Redewendung
94991;boesenBuben;www.unterrichtsmaterial.ch;Arbeitsblatt: Musikgeschichte - Musik - Musikgschichte;name, die bösen Buben. Mit der ;aliger wollte die Stones als böse Version der Beatles aufbauen, so auch ihr Übername, die bösen Buben. Mit der Zeit entwickelten sie einen eigenen gitarrengeprägten Rockstil, den sie mit vers;Redewendung
187536;boesenBuben;www.googlewatchblog.de;Chrome-Passwörter auslesen: Mit dieser kostenlosen App könnt ihr alle Passwörter auslesen & exportieren - Seite 1 - GoogleWatchBlog;nden die „bösen Buben“ auch ohn;"ieser Stelle nicht vorzustellen. Vielleicht gibt es Mittel und Wege, aber die finden die „bösen Buben“ auch ohne ein solches Tool.
Für mich ist die App ein praktisches Werkzeug, das man immer";Redewendung
88920;boesenBuben;www.neues-deutschland.de;Bedeutungslose WTO (neues-deutschland.de);ndien als bösen Buben hinzustel;"latzen lassen, auf das sich die WTO-Mitgliedstaaten Ende 2013 geeinigt hatten.
Indien als bösen Buben hinzustellen, ist freilich falsch. Sicher, das Bali-Abkommen sollte bürokratische Handels";Redewendung
199743;boesenBuben;www.morgenpost.de;Was wäre, wenn der Republikaner Donald Trump die US-Wahl gewinnt? - Berliner Morgenpost;nen. Als „bösen Buben“ hat Trum;at, müssen mit Strafzöllen bis zu 35 Prozent bei der Einfuhr ihrer Produkte rechnen. Als „bösen Buben“ hat Trump in jeder Hinsicht China ausgemacht. Er nennt die Großmacht einen „Währungsbetr;Redewendung
4851;boesenBuben;www.linke-buecher.de;Weil nicht sein kann, was nicht sein darf. Über Michael Heinrichs Versuch, die Marxsche Krisentheorie unschädlich zu machen -- Norbert Trenkle;ngels zum bösen Buben abgestemp;lig sinnverdrehende Interpretation nach. Zunächst einmal wird wieder Friedrich Engels zum bösen Buben abgestempelt, der erst durch einen Einschub in seiner Edition der Marxschen Textes eine z;Redewendung
125243;boesenBuben;www.welt.de;Putin sei Dank - WELT;"ngen den ""bösen Buben"" aus der ";" unter Beweis und gibt auf einem entscheidenden Feld der internationalen Beziehungen den ""bösen Buben"" aus der Hand. Und erreicht das, ohne eigentlich viel aufzugeben. Denn die Verringerung s";Redewendung
68009;boesenBuben;m.bpb.de;Funktionen von Verbänden in der modernen Gesellschaft | APuZ;nicht die bösen Buben sein. Lob;"
Vgl. dazu Weber (Anm. 10), S. 393.
Siehe dazu Markus Feldenkirchen, Sie wollen nicht die bösen Buben sein. Lobbyismus in Berlin, in: Das Parlament Nr. 1 - 2/2003, S. 9.
Vgl. dazu M Sebaldt/A";Redewendung
68498;boesenBuben;www.aerzteblatt.de;Börsebius: Achtung, Insider!;niert mit bösen Buben, die ande;"ufzusuchen, findet blühenden Unsinn allerorten; darüber hinaus ist die Szene garniert mit bösen Buben, die andere Leute mit windigen Empfehlungen aufs Kreuz legen wollen. Wer glaubt, in solch";Redewendung
85383;boesenBuben;www.online-spielautomaten.de;John Wayne Spielautomaten - Online Casino Ratgeber;nn es den bösen Buben mal wiede;se einzigartige Welt abtauchen und können John Wayne tapfer zur Seite stehen, wenn es den bösen Buben mal wieder an den Kragen gehen sollte. Damit Sie erste Erfahrungen mit dem Slot-Game samm;Redewendung
184173;boesenBuben;blog.trendmicro.de;Cyberkriminelle Scharfschützen: Scammer aus Nigeria nutzen HawkEye für Angriffe auf kleine Unternehmen - blog.trendmicro.de;nsten der bösen Buben ausfällt.;"hre Netzwerke meistern müssen, führen zu einem Bedrohungsszenario, das klar zugunsten der bösen Buben ausfällt.
Die vollständige Dokumentation der kriminellen Aktivitäten von Uche und Okiki s";Redewendung
39942;boesenBuben;schattenblick.net;SCHATTENBLICK - BERICHT/201: FR - und kein Ende? (NG/FH);nur einen bösen Buben, der fast;"nn sehr zufrieden sein, denn sie hat die FR gerettet.
In diesem Märchen gibt es nur einen bösen Buben, der fast alles ruiniert hätte. Zitat: ""Tatsächlich lag der Fehler wohl darin, dass ihn (";Redewendung
211469;boesenBuben;www.volldaneben.ch;Klima | voll daneben;o als die bösen Buben traktiert; der grünen Gentechnologie machten und einer aus dem Publikum Trump und Bolsonaro als die bösen Buben traktierte, sagte ich, es sei natürlich leicht, im Publikum durch Kritik an der Politik v;Redewendung
53489;boesenBuben;www.kues-magazin.de;Auto – KÜS magazin;o manchem bösen Buben, die letz;nnie and Clyde in Chicago in den 30er-Jahren mächtig um sich geballert hat und so manchem bösen Buben, die letzte (Zünd-)Kerze ausgeblasen hat, dürfte nach gut sieben Jahrzehnten wohl von nie;Redewendung
134593;boesenBuben;www.reisetravel.eu;Reben und Wein;och einen bösen Buben, der im 1;eute noch gibt. Für das Drachenloch ist die Stocherstange zu kurz. Dann gab es noch einen bösen Buben, der im 18. Jahrhundert in Vaihingen an der Enz geschnappt wurde. Der berühmte Verbrecher;Redewendung
119858;boesenBuben;gesamtschule-warendorf.de;Schülerinnen absolvieren einen Selbstbehauptungskurs;"olle des ""bösen Buben"" und vers";"iele vorzubereiten“, erklärt Marcus Kleinhofer. Dafür wechselte er auch in die Rolle des ""bösen Buben"" und versperrte den einzelnen Mädchen provokativ den Weg. „Das war einerseits unangenehm,";Redewendung
128848;boesenBuben;www.migazin.de;MiGAZIN - Migration und Integration in Deutschland;olle des „bösen Buben“ zugeteil;am wenigstens im Laufe der Sendung klar, dass ihm wohl seitens des Senders die Rolle des „bösen Buben“ zugeteilt wurde. Anders war das sicherlich auch nicht gedacht. Neben Lamya Kaddor, die s;Redewendung
214358;boesenBuben;de.girlsuggs.com;10 Zeichen, dass Sie zur Verbindung bereit sind - 2020;on seinen bösen Buben geheilt w;rreden ihre Partner, zu heiraten, und sie hoffen, dass er auf wundersame Weise von seinen bösen Buben geheilt wird, wenn er diesen Ehering auf seinen Finger legt. Schade, dass das Leben nicht;Redewendung
79252;boesenBuben;jungle.world;jungle.world - Ellis im La La Land;ornte den bösen Buben in mir an;"che Einsicht steht, dass der Tweet nicht die beste aller Formen ist: »Twitter spornte den bösen Buben in mir an.«
Das klingt wie ein Versprechen.
Bret Easton Ellis: Weiß. Aus dem amerikanisch";Redewendung
194900;boesenBuben;www.globi.ch;Globi USB und die Pirateninsel | Globi Verlag – Orell Füssli;otzen den bösen Buben und ihrem;"ten. Mit Hilfe einiger anderer Tiere finden die beiden am Ende den Schatz und trotzen den bösen Buben und ihrem Anführer Flint.
Ende gut, alles gut: Globi hat nicht nur viele neue Freunde gew";Redewendung
71262;boesenBuben;www.egmont-manga.de;Detektiv Conan 98 von Gosho Aoyama | Egmont Manga;"oyama
Die bösen Buben gucken ge";"Aus der Reihe Detektiv Conan Band 98	von Gosho Aoyama
Die bösen Buben gucken gewöhnlich in die Röhre, wenn der kleine Conan den Tatort betritt. Und seit dieser";Redewendung
77137;boesenBuben;natur-foto-technik.de;Das Leben am Insektenhaus und wie man es fotografiert;pen, den »bösen Buben«, gibt es;" Niströhre
Eine neue Wespe schlüpft
Wildbienen – alles außer Honig
Neben den Wespen, den »bösen Buben«, gibt es aber noch ihre netten Schwestern – die Bienen. Die fleißigen Honig­lieferanten ";Redewendung
193241;boesenBuben;www.imi-online.de;» Verschwörungstheorien oder strukturelle Analyse: der 11. September – Teil 1: | Informationsstelle Militarisierung (IMI) | Druckversion;plott von bösen Buben – viellei;ugnissen der Unterwerfung von Medien unter die Macht Ausschau und findet ein Komplott von bösen Buben – vielleicht Konzernen, vielleicht religiösen Organisationen, vielleicht der Bundesregier;Redewendung
9579;boesenBuben;www.tunesienforum.com;Reisebericht Tunesien Dezember 2016 - Das Tunesien Forum - Informationen aus und über Tunesien;r anderen bösen Buben. Denn auc;iner Freiheit beeinträchtigt, als von irgendwelchen Terroristen, Schmugglern oder anderen bösen Buben. Denn auch das ist klar - als Tourist macht man sich schon seine Gedanken, wo man hergehe;Redewendung
209901;boesenBuben;www.masters-sport.de;Info08;r auf die bösen Buben zeigen - ;"en sollen. Die Erwischten werden sofort isoliert, man kann mit dem nackten Finger auf die bösen Buben zeigen - und der Rest macht weiter wie bisher. Business as usual"", kritisiert Pagel. Der ";Redewendung
183610;boesenBuben;worlds-of-music.de;Worlds of Music - Holender,Ioan;r für die bösen Buben des „deut;"r des Hauses, seit 1991 und noch bis 2007 im Amt, interessiere sich mehr und mehr für die bösen Buben des „deutschen“ Regietheaters.
Aufbruchsstimmung beim Enescu-Festival (2) Deutschlandfunk";Redewendung
76752;boesenBuben;www.publik-forum.de;Satansgrüße im Kreuzfeuer - Publik-Forum.de - Religion & Kirchen;r und die bösen Buben um Mick J;iten, in denen die zum exzessiven Drogengenuss neigenden Pink Floyd zum Klassiker und die bösen Buben um Mick Jagger zum generationenübergreifenden Mainstream mutiert sind, muss Provokation h;Redewendung
148942;boesenBuben;quabain.us;QUABAIN;"rge?
Die “bösen Buben” der Phar";"n
Die Strategien der Pharmafirmen: Scheininnovationen zur Sicherung der Gewinnmarge?
Die “bösen Buben” der Pharmaindustrie beim Schummeln erwischt
Pfizer verweigert Studienergebnisse
Schulmed";Redewendung
149654;boesenBuben;www.slam-zine.de;Comic-Review: Kick-Ass 1 & 2 (Panini) - SLAM;ringt den bösen Buben jedoch nu;aler und seiner Bande in seiner Wohnung gegenüber. Seine lächerliche Aufmachung ringt den bösen Buben jedoch nur ein Lächeln ab. Plötzlich springt ein junges Mädchen mit einem Katana bewaffne;Redewendung
177695;boesenBuben;www.buecher.de;The Sleepwalkers von Christopher Clark - Fachbuch - bücher.de;runde die bösen Buben dieser Vo;rben mit ihrer schon damals ungeheuren Brutalität und Grausamkeit sind also im Grunde die bösen Buben dieser Vorkriegszeit, und Österreich-Ungarn hatte alles Recht, sich gegen sie zu wehren. ;Redewendung
30929;boesenBuben;blogblick.de;Freeware, Internetzensur, EU - Bestimmungen zu Internetzensur, Internetüberwachung, Verschlüsselung;"s
Was die bösen Buben können...";"z einfach in das Netz stellen kann. Hier gehts weiter........Klaus Martell, Paris
Was die bösen Buben können.................18.4.2014 / 14:00
ist auch für Sie keine Schwierigkeit.
Mit einem ";Redewendung
75624;boesenBuben;de.m.wikipedia.org;König Lear – Wikipedia;s Fliegen bösen Buben sind, sin;"ichtung Dover durch die stürmische Nacht. Gloucester beklagt sein Schicksal (""Was Fliegen bösen Buben sind, sind wir den Göttern. Sie töten uns aus Spaß.""),[52] dann treffen sie auf Edgar, de";Redewendung
28752;boesenBuben;www.dreamoutloudmagazin.de;dreamoutloudmagazin - The Rolling Stones;s auf die bösen Buben des Rock ;. So erlebte Stanley Booth hautnah die Faszination mit, die morbide Themen damals auf die bösen Buben des Rock ausübten. Ihre Sympathy With The Devil war mehr als bloß Koketterie, sie nahm sc;Redewendung
200662;boesenBuben;radical-mag.com;Seltene Corvette | radicalmag;s für die bösen Buben. Und wohl;in Radio, eine Klimaanlage oder eine Servolenkung zu bestellen, er war also etwas für die bösen Buben. Und wohl deshalb gab es auch nur gerade zwei offene Exemplare, von denen wir hier eines ;Redewendung
8256;boesenBuben;www.claudio.de;Wer Sorgen hat, hat auch Likör ... | Wilhelm Busch | Claudio.de;s und die bösen Buben von Korin;" Dies zeigt sich wunderbar an Klassikern wie ""Das Bad am Samstagabend"", ""Diogenes und die bösen Buben von Korinth"" oder ""Die fromme Helene"". Sie alle (und noch vielmehr) sind auf diesem Hörbu";meta
176193;boesenBuben;www.schultreff.de;Busch, Wilhelm;s und die bösen Buben von Korin;"- Die Rache des Elefanten
- Die Rutschpartie
- Die Strafe der Faulheit
- Diogenes und die bösen Buben von Korinth
- Ein Abenteurer in der Neujahrsnacht
- Fipps, der Affe
- Hans Huckebein
- Ma";fail
122291;boesenBuben;www.adventure-treff.de;﻿ Memento Mori - Adventure-Treff;s, um die bösen Buben zu erwisc;"schickt er seine besten Leute, Maxime „Max“ Durand und Larisa „Lara“ Svetlova los, um die bösen Buben zu erwischen.
Lara ist eine ehrgeizige Polizistin und Expertin für Kunstraub, die ihre Ka";Redewendung
49500;boesenBuben;www.pharmazeutische-zeitung.de;FIP-Kongress: Die Welt braucht neue Arzneimittel | PZ – Pharmazeutische Zeitung;sehen vom bösen Buben Johannisk; pflanzliche Arzneimittel generell interaktionsträchtig sind, liegt falsch. Abgesehen vom bösen Buben Johanniskraut sind...;Redewendung
36966;boesenBuben;www.webbaecker.de;9. Dezember 2019 – WebBaecker.Net;sein. Die bösen Buben dieser We; Das Betriebssystem wird dann umgehend ein bevorzugtes Ziel von Hackerangriffen sein. Die bösen Buben dieser Welt wissen genau: Wer zum Stichtag seine digitale Infrastruktur...;Redewendung
75530;boesenBuben;netzwerk-verdingt.ch;netzwerk-verdingt - News;sogenannt bösen Buben eingesper;n, wo ich aufgewachsen bin, liegt Aarburg mit der alten Festung. Dort waren die sogenannt bösen Buben eingesperrt. Zweimal bin ich bei Bauern Verdingkindern begegnet. Ich musste jeweils um Vi;Redewendung
41633;boesenBuben;brf.be;Drei Wochen Tour de France und Tour de Farce – Ein Kommentar;ssen. Die bösen Buben der Tour ;"Reul.
Patrick Sinkewitz, Alexander Vinokourov, Christian Moreni und Mikael Rasmussen. Die bösen Buben der Tour de France 2007. Gedopt und gelogen haben sie.
Zu einem Zeitpunkt der schlechter ";Redewendung
73715;boesenBuben;kbv-verlag.de;Um unsere Webseite für Sie optimal darzustellen und fortlaufend verbessern zu können, verwenden wir Cookies. Durch die weitere Nutzung der Webseite stimmen Sie der Verwendung von Cookies zu.;ssten die bösen Buben nach dem ;klimper in ihrem Geldbeutel für das Geräusch von Goldmünzen hielten. Erstaunt mussten die bösen Buben nach dem feigen Mord feststellen, dass sie statt eines Schatzes lediglich einen Haufen we;Redewendung
74867;boesenBuben;www.madication.eu;3 Platten – madication.eu;st-of der bösen Buben um MM han;an mag an manchen Stellen der Meinung sein, es könnte sich einfach nur um ein Best-of der bösen Buben um MM handeln. Der Gesamteindruck besagt: Marilyn Manson klang lange nicht so frisch wie ;Redewendung
25798;boesenBuben;www.jeeg.ch;Detektiv Conan Nr. 96;"stery
Die bösen Buben gucken ge";"Von Aoyama / Egmont Manga / Mystery
Die bösen Buben gucken gewöhnlich in die Röhre, wenn der kleine Conan den Tatort betritt. Und seit dieser";Redewendung
64417;boesenBuben;www.zwischengas.com;Citroën 2 CV 007 - wie James Bond die Ente adelte (Fahrzeugberichte) | Zwischengas;sucht den bösen Buben, die in z;ck immer 100 Meter hinter die Kamera zu zielen scheint - sitzt am Steuer und versucht den bösen Buben, die in zwei Peugeot 504 sitzen, zu entkommen. Bereits weist der 2 CV 6 eine Reihe von Ei;Redewendung
49405;boesenBuben;www.krimi-forum.net;Die Löwengrube;sämtliche bösen Buben zur Strec;"t das Problem lösen muss, wie sie ihren Sohn am schnellsten abstillt, bevor sie sämtliche bösen Buben zur Strecke bringt - wer sollte das lesen wollen?
Nun, jeder, der Spaß hat an gut gemacht";Redewendung
194898;boesenBuben;www.sprachcenter-kassel.de;Buchangebote 3 - booklooker Buchangebote;"t bei den bösen Buben"" liegt, s";"piel dienen. Erwachsene sollten sich fragen, ob der Fehler meist vielleicht nicht bei den bösen Buben"" liegt, sondern bei der Gesellschaft. Das ist für die Kinder keine Entschuldigung, aber e";Redewendung
162210;boesenBuben;www.demokratisch-links.de;DEMOKRATISCH – LINKS » 2020 » Januar;t mit den bösen Buben aus der I;"t sinken sollte, sondern auch, weil es so schien, als wolle sich Berlin ernsthaft mit den bösen Buben aus der Immobilienbranche anlegen.
Es kommen nicht genügend Särge bei den Brandstiftern d";Redewendung
215314;boesenBuben;www.spiegel.de;Mietendeckel: Berlin lässt die Mieter im Stich - DER SPIEGEL;t mit den bösen Buben aus der I;"t sinken sollte, sondern auch, weil es so schien, als wolle sich Berlin ernsthaft mit den bösen Buben aus der Immobilienbranche anlegen.
In einer Stadt, in der die durchschnittlichen Mieten s";Redewendung
129658;boesenBuben;www.kino.de;Clint Eastwoods „The Rookie“ erscheint in Deutschland ungeschnitten auf Blu-ray · KINO.de;t scheut, bösen Buben seine Mag; spielt Clint Eastwood einmal mehr den kompromisslosen Cop, der keine Gelegenheit scheut, bösen Buben seine Magnum ins Gesicht zu halten. Der einzige Unterschied ist, dass er diesmal nicht nu;Redewendung
195660;boesenBuben;www.turn-on.de;"Explosiver Trailer zu Michael Bays ""6 Underground"" mit Ryan Reynolds";t sie den bösen Buben der Welt ;telpunkt stehen sechs Milliardäre, die ihren Tod vorgetäuscht haben. Wieso? Damit sie den bösen Buben der Welt ungestraft das Handwerk legen können. Anführer ist der mysteriöse One (Reynolds);Redewendung
9807;boesenBuben;www.nachdenkseiten.de;Drogen;t und die bösen Buben – in dies; Jahren wird das Thema jährlich aufgerollt. Die neuesten UN-Zahlen werden genannt und die bösen Buben – in diesem Fall wie gewohnt die Taliban – für das Dilemma verantwortlich gemacht. Wer da;Redewendung
