;kurz;source_domain;title;match;match_long;type
3844;boesenBuben;www.kvnl.de;KVNL - Geschichte;club „Die bösen Buben“ sorgte i;". Einige Jahre hindurch fungierte der „kleine Chor“ auch als Elferrat.
Der Kegelclub „Die bösen Buben“ sorgte in all den Jahren für Überraschungen im Programm und als Büttenrednerin skizziert";Redewendung
52072;boesenBuben;www.kuselit.de;:: Kuselit Verlag :: Rezensionen;d als die bösen Buben mit den t;"rzer Mohr.
Die Sonne schien ihm aufs Gehirn,
Da nahm er seinen Sonnenschirm.“
Und als die bösen Buben mit den typisch bayrischen Symbolen, der flinke Ludwig mit dem Fähnchen, der dicke Kaspar";Redewendung
164725;boesenBuben;de.girlsuggs.com;www.therichest.com - 2020;d seinen „bösen Buben“ zu verda;d zur Welt bringen, ist von einer großen dunklen Wolke überzogen, die Tristan und seinen „bösen Buben“ zu verdanken ist. Es war schrecklich genug, dass der Vorfall passierte, geschweige denn,;Redewendung
176571;boesenBuben;quabain.us;QUABAIN;"dale
Die “bösen Buben” der Phar";"ibe…
Mehr dazu in den Beiträgen:
Medikamente – Nebenwirkung TOD
Medikamentenskandale
Die “bösen Buben” der Pharmaindustrie beim Schummeln erwischt
Weitere Beiträge finden Sie in diesem Blog i";Redewendung
90457;boesenBuben;www.mylittlehomepage.de;Druckansicht Weblog;dass die “bösen Buben (und Mäde;gkennung reisten. Es wird ausgiebig über diese Flüge spekuliert und angenommen, dass die “bösen Buben (und Mädels)“ höchster politischer und gesellschaftlicher Ränge noch vor Jahresfrist eink;Redewendung
47841;boesenBuben;volksbetrugpunktnet.wordpress.com;Systemkrise | volksbetrug.net;dass die “bösen Buben (und Mäde;"kennung) reisten.
Es wird ausgiebig über diese Flüge spekuliert und angenommen, dass die “bösen Buben (und Mädels)“ höchster politischer und gesellschaftlicher Ränge noch vor Jahresfrist eink";Redewendung
22434;boesenBuben;www.suedwestfalen-nachrichten.de;Aktuelles zum Thema Mädchen | Südwestfalen Nachrichten;dchen und bösen Buben: Theatera;"ernen und an coolen…
Despina Tagkalidou 20. Mai 2016
Iserlohn – Von garstigen Mädchen und bösen Buben: Theaterabend in Barendorf
Iserlohn - Im Rahmen der Veranstaltungsreihe „Die optimierte F";Redewendung
206975;boesenBuben;www.austrianposters.at;Die Linie unserer Zeit – Julius Klinger als Buchgestalter und Buchillustrator – Austrian Posters;der eines bösen Buben”23 unter ;"rodie “Die Kunst im Leben des Kindes”22 und die Illustrationen zu Bernauers “Lieder eines bösen Buben”23 unter Beweis.
Der italienische Kunstexperte Giovanni Fanelli analysierte Klingers Entw";Redewendung
3478;boesenBuben;zettelsraum.blogspot.com;Zettels Raum: Der Fall Kemmerich(s) oder: Von der grenzenlosen Torheit des politisch-medialen Mainstreams;durch die bösen Buben (und Mädc;Doch nicht nur, weil man sich selbst blockiert, wenn man jegliche Unterstützung durch die bösen Buben (und Mädchen) dem Anathema anheimstellt, oder aber weil man unglaubwürdig auftritt, wenn ;Redewendung
98436;boesenBuben;02mydafsoup-01.soup.io;offene Ablage: nothing to hide;dwo einen bösen Buben gibt, geg;s als Kriegsgegner erklärt, ist dieser Krieg ja nie zu Ende, weil es immer irgendwo einen bösen Buben gibt, gegen den man sich wehren muss. So hat sich eine Hysterie breitgemacht, die sich in;Redewendung
127847;boesenBuben;www.stromauskunft.de;Verbraucher – Seite 2;e ehemals bösen Buben auf dem S;"r 2018 By Björn Katz Kommentar verfassen
Vorkasse, Paket, Kaution – so hießen die ehemals bösen Buben auf dem Strommarkt. Stromtarife, die Kunden mit Dumpingpreisen in hohe Risiken lockten un";Redewendung
204590;boesenBuben;deutschelobby.com;03/04/2014 – deutschelobby;e ich den bösen Buben und ziert;"olitische Naivität.
Später, mit 40 Jahren und immer noch in der Pubertät, spielte ich den bösen Buben und zierte mein Gesicht mit einem Piratentuch. Sah albern aus, fanden meine Freunde. Ich ";Redewendung
84849;boesenBuben;blog.hellobank.at;Hüfner’s Marktkommentar: Die zwei Leben des Euro | Hello bank!;e ist zum bösen Buben für alle ;gemeinsame Währung wird von vielen inzwischen erheblich kritischer beurteilt. Sie ist zum bösen Buben für alle anstehenden Probleme geworden: die Arbeitslosigkeit, das schwache Wachstum, die ;Redewendung
6642;boesenBuben;www.blaetter.de;Kein Frieden ohne Interessenausgleich | Blätter für deutsche und internationale Politik;e man den bösen Buben Wladimir ;l den Gedenkfeiern kaum vor. Bei Protokollanweisungen wusste man lange nicht, wie man den bösen Buben Wladimir Putin platzieren, wie ihn ins Bild setzen soll. Doch beim letzten G20-Gipfel in ;Redewendung
91509;boesenBuben;www.ohle-dorf.de;Die Hünenburg am Sundern;e man die bösen Buben früh genu;"lauben . . .
Ewald Baberg
Der Blick vom Sundern ins Lennetal.
von der Burg konnte man die bösen Buben früh genug sehen.
Der Ursprung des Dorfes Ohle liegt ab ca. 800 n.Chr. auf dem Sundern.
A";Redewendung
35393;boesenBuben;nhz24.de;Gedenkstein für einen ermordeten Fuhrmann · nhz24.de;e man for bösen Buben fällt. 2.;"bst sind die Worte zu lesen: Er ist gefallen bey diesem H. (vermutlich Hügel) wie man for bösen Buben fällt. 2. Buch Samuelis 3. Capit. v. 34. 25. August 1674.“
Titelbild: Südseite des Jörg-H";Redewendung
118300;boesenBuben;www.filmstarts.de;"Mel Gibson auf den Spuren von Liam Neeson: Hauptrolle in ""Blood Father"", einer Action-Sause im Stil von ""96 Hours"" - Kino News - FILMSTARTS.de";e man mit bösen Buben umzusprin;" ein paar Drogendealern, die sie umbringen wollen. Doch zum Glück weiß Daddy, wie man mit bösen Buben umzuspringen hat. Schließlich war er selbst mal einer.
Laut des Branchenmagazins Deadline";Redewendung
39557;boesenBuben;sehepunkte.de;SEHEPUNKTE - Rezension von: Die Diktatoren - Ausgabe 6 (2006), Nr. 1;e mit den bösen Buben in der La;"1938"" (834). Meint der Autor wirklich, der gute, aber gestrenge Onkel Stalin habe mit den bösen Buben in der Lagerverwaltung aufgeräumt, um den Strafvollzug zu humanisieren? Es hat ganz den A";Redewendung
87271;boesenBuben;www.chronische-heilung.de;Sekundäre Pflanzenstoffe | Polyphenole für die Darmflora - Nutraceuticals;e von den bösen Buben als Nahru;aride werden überwiegend von unseren nützlichen Darmbakterien aber auch teilweise von den bösen Buben als Nahrung verwertet (alles hier nachzulesen: Präbiotika). Zweit genannte Stoffgruppe, d;Redewendung
100019;boesenBuben;fantasyguide.de;MacGyver - Staffel 3 (DVD) - Fantasyguide;e, um die bösen Buben auszuscha;"s normalen Haushaltsmitteln und primitiven Werkzeugen Waffen oder Fallen bastelte, um die bösen Buben auszuschalten oder sich aus seinem Gefängnis zu befreien.
Paramont präsentiert auch die d";Redewendung
86658;boesenBuben;cinemaforever.net;"""Ghost Rider: Spirit of Vengeance"" (USA, AE 2011) Kritik – Der Rider ist zurück! | CinemaForever";eelen von bösen Buben in die Un; Teufel, der ihn daraufhin zum Ghost Rider machte, einem Seelenfänger, der die Seelen von bösen Buben in die Unterwelt befördern sollte. Inzwischen ist Johnny zwar nicht mehr dem Teufel verpf;Redewendung
434;boesenBuben;www.rubikon.news;Rubikon - Magazin für die kritische Masse;eführten „bösen Buben“ ist weit;"ich persönlich über dieses Thema gesprochen?“
Die Liste der von Donald Trump angeführten „bösen Buben“ ist weitaus länger. Nicolas Maduro, der Präsident Venezuelas, hat seinen Platz auf diese";Redewendung
145224;boesenBuben;erzgebirgisches-sonntagsblatt.de;Aus der Geschichte von Herold. - Illustriertes Erzgebirgisches Sonntagsblatt;egen euch bösen Buben und Kanai;"en die Nachzügler gehörig durchgebläut, so machte er erst Vorwürfe, wie z. B. ""wegen euch bösen Buben und Kanaillen (damit waren die Mädchen gemeint!) muß ich den weiten Weg machen hierher, i";Redewendung
65367;boesenBuben;www.ebay.de;Bad Boys II [DVD] | eBay;ehmen die bösen Buben vom Spezi;f andere Gedanken. Als Tapia dann noch den Fehler begeht, Sydney zu entführen, nehmen die bösen Buben vom Spezialkommando ihren Job höchst persönlich. Violent Fun ist die Message und Kopfschu;Redewendung
28379;boesenBuben;www.abendblatt.de;Der Mutant auf meinem Teller - Hamburger Abendblatt;eich als ‚bösen Buben‘ gebrandm;"-Sprecherin auf Anfrage bestätigt.
„Die Politik hat die Gentechnik in diesem Bereich als ‚bösen Buben‘ gebrandmarkt, der am übermäßigen Einsatz von Pestiziden Schuld ist“, kritisiert Metzlaff";Redewendung
14478;boesenBuben;www.abendblatt.de;Wie gefährlich ist genmanipulierte Nahrung auf dem Teller? - Hamburger Abendblatt;eich als ‚bösen Buben‘ gebrandm;"ken zu Unkrautvernichter Glyphosat
„Die Politik hat die Gentechnik in diesem Bereich als ‚bösen Buben‘ gebrandmarkt, der am übermäßigen Einsatz von Pestiziden Schuld ist“, kritisiert Metzlaff";double
127040;boesenBuben;www.scribd.com;Der neidische Handwerksbursch by Wilhelm Busch - Book - Read Online;eiche der bösen Buben Max und M;"strierte Ausgabe): Eines der beliebtesten Kinderbücher Deutschlands: Gemeine Streiche der bösen Buben Max und Moritz
Die lustigsten Geschichten von Wilhelm Busch für Kinder: 8 Klassiker der K";meta
66939;boesenBuben;www.scribd.com;Der vergebliche Versuch by Wilhelm Busch - Book - Read Online;eiche der bösen Buben Max und M;"strierte Ausgabe): Eines der beliebtesten Kinderbücher Deutschlands: Gemeine Streiche der bösen Buben Max und Moritz
Max und Moritz - ungekürzte Fassung: Der Bilderbuch Klassiker von Wilhelm ";double
214667;boesenBuben;www.buecher-thoene.de;Max und Moritz - Eine Bubengeschichte in sieben Streichen, Jubiläumsausgabe;eiche der bösen Buben zu den Me; noch keiner die Erfolgsgeschichte des Bilderbuchs. Heute gehören die sieben Streiche der bösen Buben zu den Meisterwerken von Wilhelm Busch. Wer erinnert sich nicht an die haarsträubenden Ge;meta
53288;boesenBuben;p-t-m.eu;Kalenderblatt Donnerstag 9.1.20 » KlickTipps rund um Medien und Events Pressetermine in München » Presse Termin München;eiche der bösen Buben „Max und ;ns Huckebein, der Unglücksrabe“ oder die sicher den meisten Lesern bekannten Streiche der bösen Buben „Max und Moritz“. Als Zeichner und Autor von vorwiegend satirisch-witzigen Bildergeschich;meta
111448;boesenBuben;stadtteilzeitung.nbhs.de;Nachruf: Nachbarschaftsheim Schöneberg e. V;einst die bösen Buben von der S;u erzählen, dass vor Ort die Gerüchte darüber nicht verstummen wollten, dass es einst die bösen Buben von der Sozialdemokratie gewesen seien, die den zu Ehren des Reichsgründungs-Kaisers gepf;Redewendung
137168;boesenBuben;www.tattooguide24.com;FAQ;eintlich „bösen Buben“ der Musi;it dem „Böse-Buben-Image“ und den Fans gefällt es. Leider ist vielen dieser vermeintlich „bösen Buben“ der Musikszene wohl nicht bewusst, dass sie sich mit den „Accessoires“ von gefährlichen ;Redewendung
8007;boesenBuben;www.filmstarts.de;Whistleblower - In gefährlicher Mission - Die Filmstarts-Kritik auf FILMSTARTS.de;eiter die bösen Buben von der S;"end unbeleuchtet.
So geben William Hope und David Hewlett als korrupte UN-Mitarbeiter die bösen Buben von der Stange. Auf der Gegenseite positionieren sich Vanessa Redgrave und David Strathai";Redewendung
39704;boesenBuben;www.scifinet.org;GOLEM & PALADIN - FanZines & Magazine - SF-Netzwerk;elbst die bösen Buben kommen mi;gut. Weder dem Einhorn noch der freundlichen Nonne passiert irgendein Leid und selbst die bösen Buben kommen mit der Strafe des „auf ewig alle Ställe im Kloster ausmisten müssen“ davon. Kekse;Redewendung
28558;boesenBuben;mag.euroshop.de;Cyber-Kriminelle: Die bösen Buben der Online-Welt | EuroShop.mag;elle: Die bösen Buben der Onlin;"Cyber-Kriminelle: Die bösen Buben der Online-Welt
5. Oktober 2018 | Retail Technology, What´s new in Retail
Online attackie";Redewendung
154451;boesenBuben;wbs-wissen.de;Veranstaltungen;en beiden bösen Buben, indem er;er diesen Fang und drehte den Spieß nun um. Somit verübte er den 7. Streich an den beiden bösen Buben, indem er sie als Weihnachtsbaum schmücken ließ. Abschließend rundete das Lied „Stille Na;Redewendung
108699;boesenBuben;svmods.com;Ein Leitfaden für Anfänger zur Optimierung von Websites September 2019;en dieser bösen Buben auf Ihrer;"ite-Optimierung vollständig wäre, ohne sie zu erwähnen. Es ist unerlässlich, einen dieser bösen Buben auf Ihrer Website zu haben, wenn Sie vorhaben, ein weltweites Publikum zu haben.
Einige b";Redewendung
109341;boesenBuben;civaka-azad.org;Mittlerer Osten – Seite 6 – Civaka Azad;"en …
Die »bösen Buben« in strat";"er Iran Regimekräfte in Ostkurdistan in der Stadt Sinê und Umgebung aufmarschieren …
Die »bösen Buben« in strategischen Untiefen
Über die Hintergründe der aktuellen türkischen Außenpolitik
Mu";Redewendung
171301;boesenBuben;drehpunktkultur.at;„Ein Opfer politischer Willkür“;"en.
Einen bösen Buben hat der D";"f die „kulturelle Vielfalt“. Solches schien die Budget-Verhandler wenig zu scheren.
Einen bösen Buben hat der Dachverband ausgemacht, und er dürfte so falsch nicht liegen. „Als Mastermind der";Redewendung
1724;boesenBuben;apolach.cz;Capua – Antonín Polách;"en. Diese bösen Buben!
Die zwei";"h der zweiten waren das Soldaten der Armee Napoleons. In jedem Fall aber Franzosen. Diese bösen Buben!
Die zwei erhaltenen Köpfe durfte ich im „Museo provincionale Capuano“ bewundern. Ein bez";Redewendung
82152;boesenBuben;www.filmfutter.com;"""London Has Fallen"": Explosive TV-Spots und Clips zum Action-Sequel";enlos die bösen Buben absticht ;" Insbesondere der oberste Spot ist wirklich einen Blick wert, in dem Butler gnadenlos die bösen Buben absticht und dann offenbar wirklich großen Durst hat. Schaut selbst:
Unten findet Ihr auß";Redewendung
11432;boesenBuben;naturheilt.com;Schulmedizin Archives - Seite 4 von 4 - NaturHeilt.com Blog;"ente
Die „bösen Buben“ der Phar";"er, dass alte Menschen häufiger und schwerer an Krankheiten...
Allgemein/Medikamente
Die „bösen Buben“ der Pharmaindustrie beim Schummeln erwischt
Wir alle wissen und glauben ganz fest, dass ";Redewendung
45604;boesenBuben;konditoren.de;DAS KONDITORENHANDWERK. Presse;er beiden bösen Buben von Wilhe;"e, sperren sie die Krabbeltiere......
Wer kennt ihn nicht, den fünften Streich der beiden bösen Buben von Wilhelm Busch. Hier spielt Melolonthinae - der Maikäfer - die Hauptrolle in einem Stü";Redewendung
152367;boesenBuben;www.jewiki.net;Martin Luther und die Juden – Jewiki;er losen, bösen Buben, aus alle;che, langfristig wirksame Verschwörungstheorie: Juden seien eine „Grundsuppe aller losen, bösen Buben, aus aller Welt zusammengeflossen“ und hätten sich „wie die Tattern und Zigeuner“ (Tatare;Redewendung
44159;boesenBuben;katholisches.info;﻿ Das „Wunder des roten Fadens“ – Katholisches;er losen, bösen Buben, aus alle;deten die Juden zusammen mit Papisten, Tataren und Zigeunern die „Grundsuppe aller losen, bösen Buben, aus aller Welt zusammengeflossen“, die sich zusammengerottet hätten, um die christlichen;Redewendung
114501;boesenBuben;www.lifestrom.de;Wie Unternehmen die Energiewende beschleunigen können – lifestrom;er se die bösen Buben im Ringen;"um in der Bevölkerung mit dem falschen Vorurteil aufzuräumen, dass Unternehmen per se die bösen Buben im Ringen um die Energiewende sind.
Stromsparen durch Steckerziehen";Redewendung
66340;boesenBuben;www.womenshealth.de;Diese Männer brechen am ehesten Herzen | Women's Health;erden von bösen Buben angezogen;" einer akuten Verliebtheit vielleicht etwas ganz anderes steckt.
Manche Frauen werden von bösen Buben angezogen wie Motten vom Licht. Was dahinter steckt, wenn es immer wieder passiert, ist ä";Redewendung
97077;boesenBuben;www.mittelstand-nachrichten.de;Moderates globales Wachstum 2016: Probleme in China werden überbewertet | Mittelstand Nachrichten;ert, die „bösen Buben“ von gest;Exporte innerhalb der Euro-Zone. „Das Exportminus wird innerhalb der EU kompensiert, die „bösen Buben“ von gestern profitieren dabei am meisten“, erläutert Christian Nemeth, Vorstandsmitglied;Redewendung
127846;boesenBuben;gruene-unabhaengige-rt.de;Regionalstadtbahn;erung den bösen Buben sieht, de;"m?"" Es ist schon Wahlkampf, wenn Landrat Reumann ausgerechnet bei der Landesregierung den bösen Buben sieht, der die Stadtbahn nicht wolle. Selbst hingegen will er die Co-Finanzierung des Mod";Redewendung
120903;boesenBuben;politonline.ch;politonline.ch;es ewigen bösen Buben beschränk; des »Panafrikanismus«. Er wollte sich auch nicht länger auf die globale Rolle des ewigen bösen Buben beschränken, sondern begann, das große geostrategische Spiel zu spielen. Das wirtschaftli;Redewendung
27198;boesenBuben;www.kino.de;Vier Fäuste erobern Deutschland · KINO.de;esten die bösen Buben treffsich;"r ...
Terence Hill und Bud Spencer boten beste Unterhaltung, als sie im Wilden Westen die bösen Buben treffsicher und mit coolen Sprüchen vermöbelten.";Redewendung
191615;boesenBuben;www.misesde.org;Infinus und der Staat – Ludwig von Mises Institut Deutschland;gegen den bösen Buben – den fin;de Held mit dem weißen Hut – mit viel Mut und der ganzen Autorität seines Amtes gegen den bösen Buben – den finster dreinblickenden Betrüger mit dem schwarzen Hut – vorgegangen und hat von se;Redewendung
113079;boesenBuben;digitaleweltmagazin.de;Besteuerung der Digitalwirtschaft – (bald) kein Neuland mehr! - DIGITALE WELT | Das Wirtschaftsmagazin zur Digitalisierung;gegen die bösen Buben der (US-);rekte Besteuerung der multinationalen Unternehmen. Der steuerpolitische Vorwurf gegen die bösen Buben der (US-)Digitalwirtschaft ist zweifach: Die EU (Kommission und Parlament) geht unter Ber;Redewendung
95568;boesenBuben;www.slam-zine.de;Morgan & Bailey 11 - SLAM;gegen die bösen Buben dieser Fo;ner Vorliebe für harte amerikanische Thriller. Eher farblos präsentieren sich dagegen die bösen Buben dieser Folge. Jens Wendland, Detlef Tams und Patrick Steiner bleiben bei der Verkörperung;Redewendung
183433;boesenBuben;www.esanum.de;Aus dem Takt geraten: Vorhofflimmern;gnis. Die bösen Buben sind dann;"dadurch der Weg abgeschnitten. ""Mit den Narben bauen wir eine Mauer um das Gefängnis. Die bösen Buben sind dann eingesperrt"", sagt Andresen mit Blick auf die Signale.
""Für mich ist die Welt w";Redewendung
212123;boesenBuben;www.sueddeutsche.de;Großes Theater - Mit Kater und Courage - Landkreis München - SZ.de;"griff des bösen Buben mit Herz;";"akob Krakel, der Irrwitzers unheiliges Pendant, ausspionieren soll, ist der Inbegriff des bösen Buben mit Herz; Luis Staiger, der eine Doppelrolle als Maledictus Made und Sankt Silvester über";Redewendung
175812;boesenBuben;hans-juergen-gaebel.de;Weblog - 111 -;h, um die bösen Buben machtvoll;"sser aussehen lässt.
Bolton hält Amerikas Engagement in der Welt für unerlässlich, um die bösen Buben machtvoll in Schach zu halten, und er weiß, dass die USA sich dabei auch auf Allianzen st";Redewendung
119708;boesenBuben;www.tecchannel.de;Gimmiv nutzt neue Microsoft-Lücke: F-Secures Analyse zum neuesten Windows-Trojaner - TecChannel Workshop;haben die bösen Buben ebenfalls; Proof-of-Concept-Code vor, der allerdings nicht öffentlich zugänglich war. Nun haben die bösen Buben ebenfalls einen Schadcode geschrieben, der die Lücke MS08-67 ausnutzt. Laut F-Secure ist ;Redewendung
12472;boesenBuben;crimealleyblog.wordpress.com;Noir | crimealley | Seite 2;hagel die bösen Buben ins Nirva;st er düsterer Schatten und Rückendeckung zugleich, wenn es darum geht, im Kugelhagel die bösen Buben ins Nirvana zu befördern. Seine stoische Ruhe und Gelassenheit bildet einen scharfen Kont;Redewendung
121405;boesenBuben;earlycinema.dch.phil-fak.uni-koeln.de;The German Early Cinema Database: Film Supply 1895-1920: Films;hen unter bösen Buben (Dänemark;"es Dreimasters (Dänemark 1915)
6. Kleider machen Leute (Dänemark 1915)
7. Knoppchen unter bösen Buben (Dänemark 1915)
8. Millionäre unter Räubern (Dänemark 1915)
9. Nerven von Stahl (Dänemark";Name
140027;boesenBuben;earlycinema.dch.phil-fak.uni-koeln.de;The German Early Cinema Database: Film Supply 1895-1920: Films;hen unter bösen Buben (Dänemark;"es Dreimasters (Dänemark 1915)
8. Kleider machen Leute (Dänemark 1915)
9. Knoppchen unter bösen Buben (Dänemark 1915)
10. Die Leuchtturmkatastrophe (Dänemark 1915)
11. Die Liebe eines Künstle";double
79368;boesenBuben;fahrzeugtechnik.fh-joanneum.at;Institut für Fahrzeugtechnik / Automotive Engineering;hoden der bösen Buben und wie m;uchte einige davon von Austria bis Argentinien. Er wirft einen Blick auf die Methoden der bösen Buben und wie man sich vor ihnen schützen kann. Er erzählt Beispiele aus dem Alltag von Versich;Redewendung
76217;boesenBuben;www.online-spielautomaten.de;Elektra Spielautomaten - Online Casino Ratgeber;ht es den bösen Buben ganz schö;ch bekannt sein. Unter dem Namen Elektra sorgt Sie für Recht und Ordnung und macht es den bösen Buben ganz schön schwer. Der gleichnamige Film war ein voller Erfolg und knüpfte an den Siegesz;Redewendung
164400;boesenBuben;www.schiller33-ka.de;Schiller 33 - Selbstverständnis;iater die bösen Buben sind, ist; wohin können sie sich wenden? Mit einer antipsychiatrischen Haltung, dass Psychiater die bösen Buben sind, ist nicht weit zu kommen. Ich sehe ab von Schuldzuweisungen und suche selbst, meine;Redewendung
145953;boesenBuben;www.erlangen.de;Streich auf Streich - Sonderausstellungen - Erlangen - Portal der Stadt Erlangen;ich diese bösen Buben, deren St;"thäterei!!«
Wilhelm Buschs »Max und Moritz« Lesung und Gespräch
Wer sind eigentlich diese bösen Buben, deren Streiche schon Generationen von Pädagogen empörten?
Gudrun Schury, Autorin der Wil";meta
133955;boesenBuben;glotzgutachter.de;Scarface CIC VHS Neuauflage Vergleich FSK 16 FSK 18;ichte von bösen Buben zu erzähl;lder und klischeehafte Figuren waren die weit verbreitetsten Mittel um die Geschichte von bösen Buben zu erzählen. Doch 1983 betrat Tony Montana die Bühne. Er führt uns in eine bunte, laute W;Redewendung
50449;boesenBuben;quabain.us;QUABAIN;"ien; Die “bösen Buben” der Phar";"ne Beiträge dazu gelesen hätte, ( Man glaubt es kaum: Erfundene Arzneimittelstudien; Die “bösen Buben” der Pharmaindustrie beim Schummeln erwischt und so weiter) vor allem auch den Wissenscha";Redewendung
73934;boesenBuben;www.frank-bokelmann.de;Hohnhorst;iert. Die bösen Buben des WVC w;t einem Zwangsgeld (und dem Hinweis auf die Umwandlung in Ersatzzwangshaft) garniert. Die bösen Buben des WVC wollten den wackeren Kämpfer gegen das öffentliche Wasser offenbar bei (öffentlic;Redewendung
160375;boesenBuben;m.topstreaming.de;Top Streaming - Unbegrenzt Zugang auf Ihrem Handy!;ihnen die bösen Buben nachreise;"n New York Gangster auf den Fersen sind und sie dort nicht mehr sicher ist. Als ihnen die bösen Buben nachreisen, kann Mick seinen Heimvorteil voll auspielen…
Wenn der Polizist Dennis Meechum";Redewendung
7487;boesenBuben;www.giga.de;Dwayne Johnson: Was wird aus The Rock?;immt alle bösen Buben einfach i;"ßt. Markenzeichen von Dwayne John wird sein Verzicht, eine Waffe zu tragen. Er nimmt alle bösen Buben einfach in den Schwitzkasten.
Nun seid ihr an der Reihe: Welche der 10 Szenarien gefallen";Redewendung
125451;boesenBuben;magazin.audible.de;Erotische Literatur gestern und heute | Audible Magazin;in einen “bösen Buben”, der sie;dds After-Serie. In allen verliebt sich eine mehr oder weniger naive junge Frau in einen “bösen Buben”, der sie in die etwas anders geartete Kunst der Liebe einführt. Oft als “Mommy Porn” tit;Redewendung
154317;boesenBuben;www.kyffhaeuser-nachrichten.de;Von Keyboard-Cowboys und digitalem Vieh : 11.02.2020, 08.00 Uhr;ind? Die „bösen Buben“ ausfindi;".
Und was wenn alles nichts genützt hat? Wenn die Daten weg oder verschlüsselt sind? Die „bösen Buben“ ausfindig zu machen sei so gut wie unmöglich, zumindest im privaten Bereich, so Stein we";Redewendung
202447;boesenBuben;www.tvmovie.de;Drei Engel für Charlie: 1. Trailer des Remakes mit Kristen Stewart!;ingen die bösen Buben hinter Gi;"mi Scott.
Über 40 Jahre sorgen Charlies Engel nun schon für Gerechtigkeit und bringen die bösen Buben hinter Gitter - in den 1970ern in der Serie ""Drei Engel für Charlie"", um die Jahrtausendw";Redewendung
202179;boesenBuben;kurdistan-report.de;Kurdistan Report - Die »bösen Buben« in strategischen Untiefen;"itik
Die »bösen Buben« in strat";"Über die Hintergründe der aktuellen türkischen Außenpolitik
Die »bösen Buben« in strategischen Untiefen
Murat Çakır, Dezember 2014
Am 1. Dezember 2014 titelte das Han";Redewendung
149070;boesenBuben;vereins.fandom.com;Uwe Klimaschefski | VereinsWiki | Fandom;kett der „bösen Buben vom Betze;"ruar 1967 gegen 1860 München ausgesprochen. Nicht von ungefähr geisterte das Etikett der „bösen Buben vom Betzenberg“ durch die Gazetten.
Eine komplizierte Meniskusoperation, die das Ende der";Redewendung
64296;boesenBuben;www.abitimatrimonio.xyz;Warum Frauen immer ein gutes schwarzes Abendkleid lieben werden - Abitimatrimonio.xyz;l für den bösen Buben gesorgt h;" wir auch nicht, dass die meisten von uns Frauen einmal oder zu einem anderen Mal für den bösen Buben gesorgt haben.
Das schwarze Abendkleid hat für Frauen von den zwanziger Jahren bis heute ";Redewendung
81315;boesenBuben;gegenstandpunkt.com;Amerikanische Energiepolitik 2006 | GegenStandpunkt;l-reichen bösen Buben geht es a;Thomas Friedmann fasst diese Diagnose schlicht, aber prägnant zusammen: „Allen öl-reichen bösen Buben geht es anscheinend zur Zeit großartig… Da ist ein Prinzip am Werk.. In dem Maße, wie die;Redewendung
