;kurz;source_domain;title;match;match_long;type
80600;undSolcheDieEsWerdenWollen;www.cottbus.de;Aus dem Bericht von Oberbürgermeister Frank Szymanski auf der 5. Tagung der Stadtverordnetenversammlung am 28. Januar 2009 - Stadt Cottbus/Chóśebuz;"
Sportler und solche, die es werden wollen, finden h";"ischen Rathaus, Karl-Marx- Straße 67, und beim CottbusService an der Stadthalle.
Sportler und solche, die es werden wollen, finden hier Adressen, Übungszeiten sowie kleine und große Wettkämpfe. Ob Senioren, Kinde";Redewendung
8734;undSolcheDieEsWerdenWollen;www.sub-mission.de;*** Sub-Mission - Die passive Seite des BDSM ***;"
für Subs und solche, die es werden wollen
Diese Sei";"Informationen, Gedanken und Antworten über die passive Seite des BDSM
für Subs und solche, die es werden wollen
Diese Seite beschäftigt sich mit allem, was Sub Spaß, Freude, Sorgen und Probleme macht. ";Redewendung
86818;undSolcheDieEsWerdenWollen;dewiki.academic.ru;Hans Weigel;" Anfänger und solche die es werden wollen"". Steingr";"I. Klasse.
""O du mein Österreich. Versuch des Fragmentes einer Improvisation für Anfänger und solche die es werden wollen"". Steingruber Verlag Stuttgart 1956
Lern dieses Volk der Hirten kennen. Versuch einer fre";Redewendung
118552;undSolcheDieEsWerdenWollen;www.contextxxi.at;Context XXI: Hans Weigel; Anfänger und solche die es werden wollen. Steingru;"ruck 1951
""O du mein Österreich!"" Versuch des Fragmentes einer Improvisation für Anfänger und solche die es werden wollen. Steingruber, Stuttgart 1956
""Lern dieses Volk der Hirten kennen!"" Versuch einer freundli";double
136530;undSolcheDieEsWerdenWollen;www.akrizo.com;Tschechische Republik CZ: Hotels und Pensionen; Anfänger und solche, die es werden wollen, geeignet;"Skiorte wie Mladkov, Bartosovice, Orlické Záhorí und Zdobnice sind vor allem für Anfänger und solche, die es werden wollen, geeignet.
Auch Familien mit kleinen Kindern können hier ihren Urlaubsort finden.
Auch La";Redewendung
167121;undSolcheDieEsWerdenWollen;grossbritannien-news.de;Großbritannien News & Großbritannien Infos & Großbritannien Tipps !; Angler - und solche, die es werden wollen: von rust;"g ""NOVASOL Fishing"". Für 2017 bietet er mehr als 1.500 Ferienhäuser speziell für Angler - und solche, die es werden wollen: von rustikalen Hütten bis zu luxuriösen Strandvillen an Nord- und Ostsee, in Skandinavie";Redewendung
70679;undSolcheDieEsWerdenWollen;summ-it.net;Marktübersicht Output Management - summ-it; Anwender und solche, die es werden wollen, kommt si;räsentiert den Großteil der Mitglieder der Arbeitsgruppe. Durch den Nutzwert für Anwender und solche, die es werden wollen, kommt sie auch einer dringenden Einladung an weitere Anbieter gleich, sich der Arbeitsgr;Redewendung
112325;undSolcheDieEsWerdenWollen;faranuka.de;Aktuelles | Zirkus-Schule Faranuka; Artisten und solche, die es werden wollen …;Uhr im Hort der Johannesschule in der Monumentenstr. 13a und freuen uns auf neue Artisten und solche, die es werden wollen …;Redewendung
202915;undSolcheDieEsWerdenWollen;www.berlinboxx.de;Gesundheit Archives | Seite 3 von 9 | BERLINboxx; Berliner und solche die es werden wollen auf ihre ;"m Leben. Im Restaurant an der Alten Schönhauser Straße können ernährungsbewusste Berliner und solche die es werden wollen auf ihre Kosten kommen.
Besonderheit im L.A. Poke sind sogenannte Poke Bowls, ein hawaiia";Redewendung
29057;undSolcheDieEsWerdenWollen;kulturexpresso.de;Schlagwort: Lange Nacht der Museen - Kulturexpresso.de; Berliner und solche, die es werden wollen, von Muse;burg-Wilmersdorf sowie Friedrichshain/Lichtenberg. Auch auf sieben Routen können Berliner und solche, die es werden wollen, von Museum zu Museum, von Veranstaltung zu Veranstaltung reisen. Für Cineasten gibt es e;Redewendung
157452;undSolcheDieEsWerdenWollen;magnetum.de;Magnetum Design Studio | Impuls Bauhaus - Das Festival der Folkwang Universität der Künste;" Besucher und solche die es werden wollen.
tryagain";"in.de gestalteten wir die offizielle Festivalseite als digitale Anlaufstelle für Besucher und solche die es werden wollen.
tryagainfailagain.de
Genau wie das Festival ist auch die Webseite den vier elementaren G";Redewendung
95053;undSolcheDieEsWerdenWollen;www.bs-live.de;Navigatoren in der „smarten neuen Arbeitswelt“; Betriebe und solche, die es werden wollen. Zum Beis;"ldung“ übernimmt vielfältige Aufgaben:
Sie ist Ansprechpartnerin für ausbildende Betriebe und solche, die es werden wollen. Zum Beispiel überprüfen wir die Eignung von Betrieben, die ausbilden wollen und sorgen f";Redewendung
199563;undSolcheDieEsWerdenWollen;www.drk-frankenberg.de;Suche - DRK Kreisverband Frankenberg e.V.; Bewohner und solche die es werden wollen beschäfti;"nformiert und berät Sie gerne. Mit viel Zeit können alle Fragen, die Angehörige, Bewohner und solche die es werden wollen beschäftigen, besprochen werden. Als Ansprechpartner...
Preisliste ACHTUNG! Mit Inkrafttr";Redewendung
108398;undSolcheDieEsWerdenWollen;markt-nordheim.de;Markt Markt Nordheim: Ulsenheim; Bewohner und solche, die es werden wollen, wohl füh;"ufenden Dorferneuerung zeigt sich das Dorf im ""Sonntagskleid"", in dem sich seine Bewohner und solche, die es werden wollen, wohl fühlen können.";Redewendung
78932;undSolcheDieEsWerdenWollen;mobilevolunteering.co.uk;[Joni Eareckson Tada] ✓ Spiel mir das Lied vom Himmel: Was die Bibel über den Himmel sagt [Art Book] PDF ☆ Read Online eBook or Kindle ePUB; Christen und solche, die es werden wollen. Gott läs;längeren Zeitraum und in Etappen immer wieder gelesen. Ein mutmachendes Buch für Christen und solche, die es werden wollen. Gott lässt sich nicht in allem, was wir hier auf der Erde sehen und erleben, begreifen. ;Redewendung
3941;undSolcheDieEsWerdenWollen;www.elki.at;68. Fortbildung – „Orientierungslauf“ | Eltern-Kind-Turnen Dornbirn; ELKI/KKT und solche, die es werden wollen, sowie Pä;alle mit der Thematik „Bewegung für Kinder“ befassten Personen (Übungsleiter für ELKI/KKT und solche, die es werden wollen, sowie PädagogInnen, Übungsleiter der verschiedenen Sportfachverbände, interessierte Elte;Redewendung
1800;undSolcheDieEsWerdenWollen;www.hit-personal.de;Erzieher; Erzieher und solche, die es werden wollen, gefächer;ialeinrichtungen Chancen auf einen Arbeitsplatz. Wie breit das Berufsangebot für Erzieher und solche, die es werden wollen, gefächert ist, dokumentiert auch unsere Jobbörse, in der deutschlandweit regelmäßig die ;Redewendung
34399;undSolcheDieEsWerdenWollen;bistummainz.de;Nachrichten | Kindertagesstätten Bistum Mainz;" Erzieher und solche, die es werden wollen.
Der Fach";"n der Kita - Mediale Lebensrealität 0- bis 6-jähriger
Fachtag für Erzieherinnen, Erzieher und solche, die es werden wollen.
Der Fachtag am 20. November hat sich mit der Thematik der medialen Lebensrealität von Kl";Redewendung
62509;undSolcheDieEsWerdenWollen;lenau.net;Aktuelles | L E N A U – G r u n d s c h u l e | Berlin Kreuzberg;" Erzähler und solche, die es werden wollen
Bilderbuc";"Januar 2019 von Bibliothek Lesewelt
Bilderbuchkino-Seminar
für Erzählerinnen und Erzähler und solche, die es werden wollen
Bilderbuchkino in der Schulbibliothek – vielleicht einer der beliebtesten Programmpunkte ";Redewendung
84409;undSolcheDieEsWerdenWollen;www.unesco.de;Welterbe vermitteln | Deutsche UNESCO-Kommission; Experten und solche, die es werden wollen, von Inte;"gestalten
Auf das Lernen folgt das Mitgestalten. Dies ist insbesondere für junge Experten und solche, die es werden wollen, von Interesse, da sie einen Beitrag zum langfristigen Schutz und Erhalt und insbesondere";Redewendung
184654;undSolcheDieEsWerdenWollen;engelhornjournal.com;LVS-Geräte: die beste Überlebensversicherung bei einem Lawinenunfall; Experten und solche, die es werden wollen. Hier kan;" zuverlässig gelöst werden.
Das MAMMUT Pulse Barryvox ist das passende Gerät für Experten und solche, die es werden wollen. Hier kann vom Basic-Profil mit einfacher Benutzerführung in das Advanced-Profil mit viel";Redewendung
204591;undSolcheDieEsWerdenWollen;gbsschulen.de;Saver Internet Day: Live Hacking in der Technikerschule der GBS | GBS Schulen München; Experten und solche, die es werden wollen. Um Anmel;" Daten Dritter zu gelangen.
Eingeladen sind Eltern, Lehrer, Jugendliche, Kinder, Experten und solche, die es werden wollen. Um Anmeldung unter gbs-schulen@sabel.com wird gebeten.
Der Workshop findet statt in den ";Redewendung
200753;undSolcheDieEsWerdenWollen;www.wunschkinder.net;Gesundheit allgemein - Service & Interaktives; Familien und solche, die es werden wollen, alles zu;" – informativ, sachlich, anschaulich, einfach erklärt.
Bei Urbia.de finden junge Familien und solche, die es werden wollen, alles zu den Themen Kinderwunsch, Schwangerschaft, Baby, Erziehung, Gesundheit, Freizeit";Redewendung
86420;undSolcheDieEsWerdenWollen;www.brendow-verlag.de;Brendow Verlag Lebensmutig;" Frauen – und solche, die es werden wollen.
Was mach";"Tamara Hinz
Ein starkes Buch für lebensmutige Frauen – und solche, die es werden wollen.
Was macht unser Leben wertvoll? Wie können wir leben, um die Möglichkeiten voll auszusch";Redewendung
207709;undSolcheDieEsWerdenWollen;www.dvd-forum.at;Im Rausch der Tiefe - Extended Version - Review - DVD-Forum.at; Für Fans und solche die es werden wollen ein Pflic;"nmal ausgenommen. Jetzt gibt es den Film in der längeren Director's Cut Fassung. Für Fans und solche die es werden wollen ein Pflichttermin auf DVD.
Die DVD kann, was die Bild- und Tonqualität anbelangt, durchau";Redewendung
180785;undSolcheDieEsWerdenWollen;urlaub-in-kaernten-oesterreich.de;Urlaub in Kärnten ist Erholung pur! | Urlaub in Kärnten Österreich | Seite 2; GTI-Fans und solche, die es werden wollen. Und währ;den natürlich jede Menge private Feiern statt. Hier vergnügen sich Jung und Alt, GTI-Fans und solche, die es werden wollen. Und während sich der VW-Konzern selber inszeniert, tummeln sich neben den offiziellen Bü;Redewendung
15316;undSolcheDieEsWerdenWollen;www.cigarworld.de;La Casa del Habano - Zigarren & Zubehör kaufen | Cigarworld.de; Genießer und solche, die es werden wollen, bei alle;ls dazu. Vervollkommnet wird dieses Konzept durch ausgesuchtes Fachpersonal, das Genießer und solche, die es werden wollen, bei allen Fragen und Anliegen bestens berät, sei es bei der richtigen Wahl der Marke und;Redewendung
66197;undSolcheDieEsWerdenWollen;www.wanderfit.de;Weihnachtsmärkte in der Pfalz mit viel Herz; Genießer und solche, die es werden wollen, ein Fest;"inary Heritage-Erzeuger sowie Hersteller von Spezialitäten aus ganz Europa - für Genießer und solche, die es werden wollen, ein Fest für Augen und Gaumen.
Traditioneller Weihnachtsmarkt: 25. November bis 22. Deze";Redewendung
10612;undSolcheDieEsWerdenWollen;www.wn.de;Julia Puls und Viktor Soos konzertieren im Rathaus: Musikalisches Menü für Feinschmecker - Senden - Westfälische Nachrichten; Genüsse, und solche, die es werden wollen, zusammen;n Zutaten hat das Duo „Jilo“ ein köstliches Menü für Feinschmecker „klassischer“ Genüsse, und solche, die es werden wollen, zusammengestellt. Julia Puls (Klarinette) und Viktor Soos (Klavier) interpretieren Werke;Redewendung
192304;undSolcheDieEsWerdenWollen;www.abflugjetzt.de;ssm10; Gourmets und solche die es werden wollen vor. Auch;ekehrt. Ob Internationale Küche oder nationale Köstlichkeiten, dass alles finden Gourmets und solche die es werden wollen vor. Auch in Sachen Übernachtung ist das Land auf International Hohem Niveau. Ob Luxushot;Redewendung
89282;undSolcheDieEsWerdenWollen;www.angespielt.de;angespielt: Tipi von Schmidt Spiele (Rezension) - Die neuesten Spiele im Test; Indianer und solche, die es werden wollen. Es sorgt;"ompakten Box jedoch völlig unangemessen.
Tipi ist ein schnelles Spiel für kleine Indianer und solche, die es werden wollen. Es sorgt für Aufmerksamkeit und Konzentration und ist günstig zu erwerben.
12.10.2010 re";Redewendung
2725;undSolcheDieEsWerdenWollen;justiz-und-recht.de;﻿ Methodenlehre – Justiz-und-Recht; Juristen und solche, die es werden wollen. Denn: Wi;im Format und vollgepackt mit wertvollen Inhalten. Und er ist Pflichtlektüre für Juristen und solche, die es werden wollen. Denn: Wie sollen wir Juristen verantwortungsvoll unser Handwerk betreiben, wenn wir nich;Redewendung
169209;undSolcheDieEsWerdenWollen;www.villa-viktoria.de;Startseite - Villa Viktoria / Kölpinsee; Kapitäne und solche die es werden wollen, bietet d;"er ehemals ""Königlich Preußischen Dünenmeisterei"" im Ostseebad Koserow.
Für alle Kapitäne und solche die es werden wollen, bietet die ""Segelschule Rückenwind"" ein vielfältiges Angebot an Kursen. Vom Sportbootfüh";Redewendung
52;undSolcheDieEsWerdenWollen;www.ionos.at;Digitalisierung - IONOS; Kreative und solche, die es werden wollen, gehören ;"imple Online-Tools können dabei...
Kostenlose Alternativen zu Adobe InDesign
Für Kreative und solche, die es werden wollen, gehören viele Programme von Adobe zur Standard-Ausrüstung. Auch InDesign ist ein beliebt";Redewendung
32251;undSolcheDieEsWerdenWollen;www.ionos.de;Welche Picasa-Alternativen gibt es? - IONOS; Kreative und solche, die es werden wollen, gehören ;"indows S, Android, Mac und Windows
Kostenlose Alternativen zu Adobe InDesign
Für Kreative und solche, die es werden wollen, gehören viele Programme von Adobe zur Standard-Ausrüstung. Auch InDesign ist ein beliebt";double
207966;undSolcheDieEsWerdenWollen;www.thomas-wiser-haus.de;Tom's Cafe & Bühne | Thomas Wiser Haus;" Künstler und solche, die es werden wollen
Organisie";"Toms`s Bühne
Die Bühne für Künstler und solche, die es werden wollen
Organisiert von Kindern und Jugendlichen des Thomas Wiser Hauses. Wir versuchen mit einem";Redewendung
83688;undSolcheDieEsWerdenWollen;www.erfurt.de;Aktuelle Meldungen der Landeshauptstadt Erfurt | Erfurt.de; Künstler und solche, die es werden wollen, die Mögl;Schule sowie eine Fläche im nördlichen Bereich der Magdeburger Allee. Hier haben Künstler und solche, die es werden wollen, die Möglichkeit, jederzeit legal ihre Graffitikunstwerke aufbringen. Diese können danach;Redewendung
90505;undSolcheDieEsWerdenWollen;www.augsburgwiki.de;Annapam in Augsburg;" Künstler und solche, die es werden wollen.
Fr - Sa:";"ind nur ein kleiner Ausschnitt aus dem Programm. Die Open Stage ist ein Muss für Künstler und solche, die es werden wollen.
Fr - Sa: 10:00 - 01:00
Email: info(@)annapam.de
Homepage des Annapam in Augsburg";Redewendung
121235;undSolcheDieEsWerdenWollen;regia-verlag.de;REGIA Verlag; Künstler und solche, die es werden wollen. Der in M;n und Fühlen – mit wenig Text und großen Bildern – genau das Richtige für kleine Künstler und solche, die es werden wollen. Der in Meuro, bei ...;Redewendung
106281;undSolcheDieEsWerdenWollen;www.kassel-online.de;Ergebnisse zu: Lang | Kassel-Online.de; Künstler und solche, die es werden wollen. Die halb;" Bibel-Bilder zum Weitermalen
Weitermalbilder sind genau das Richtige für kleine Künstler und solche, die es werden wollen. Die halbfertigen Illustrationen regen die Fantasie an und fördern die Kreativität. So we";Redewendung
35790;undSolcheDieEsWerdenWollen;www.seinswelten.com;Antwort des letzten Einhorns – Lydia Proschinger – Seinswelten.com;" Maharaj
…und solche, die es werden wollen. Neben Ra";"n. Dieses hier tut dies auf eine klare und in […]
„Ich bin“ (I) von Nisargadatta Maharaj
…und solche, die es werden wollen. Neben Ramana Maharshi ist dieser indische Meister der bedeutendste, auf den sich noch he";Redewendung
67714;undSolcheDieEsWerdenWollen;muskelfarm.de;L-Arginin | Muskelfarm; Menschen und solche, die es werden wollen! Wir biet;Du unsere aktuellen Sportnahrung Angebote für Kraftsport- und ernährungsbewusste Menschen und solche, die es werden wollen! Wir bieten Dir unterschiedliche stark reduzierte Produkte zu besten Preisen an. Die Ange;Redewendung
155101;undSolcheDieEsWerdenWollen;contextxxi.org;Context XXI: Die Linke unter austrofaschistischer Herrschaft; Menschen und solche, die es werden wollen, Nr. 2/98;"dolins befreiung, Zeitschrift für Antimilitarismus und Gewaltfreiheit, für freie Menschen und solche, die es werden wollen, Nr. 2/98, S 4 - 15, Graz 1998
NEUGEBAUER, Wolfgang: Der „Austrofaschismus“ in der Sicht ";Redewendung
154728;undSolcheDieEsWerdenWollen;schreiblust-leselust.de;Ada Dorian: Die Zähmung der Tiere | SL Leselust;" Menschen und solche, die es werden wollen.
Ada Dori";"ich noch lange beschäftigen werden.
Klare Empfehlung für politisch interessierte Menschen und solche, die es werden wollen.
Ada Dorian: Die Zähmung der Tiere.
← David Sedaris: Calypso
Juli Zeh: Neujahr →";Redewendung
56612;undSolcheDieEsWerdenWollen;www.deutsche-biographie.de;Deutsche Biographie - Oppenheim, Heinrich Bernhard; Minister und solche, die es werden wollen“ (auch in; die Kunst, mit einer Verfassung zu regieren. Ein Vademecum für constitutionelle Minister und solche, die es werden wollen“ (auch in „Demokr. Studien“ von Walesrode, Hamb. 1861). Darin läßt er einen deutschen Dip;Redewendung
1955;undSolcheDieEsWerdenWollen;de.wikisource.org;ADB:Oppenheim, Heinrich Bernhard – Wikisource; Minister und solche, die es werden wollen“ (auch in; die Kunst, mit einer Verfassung zu regieren. Ein Vademecum für constitutionelle Minister und solche, die es werden wollen“ (auch in „Demokr. Studien“ von Walesrode, Hamburg 1861). Darin läßt er einen deutschen D;double
68017;undSolcheDieEsWerdenWollen;books.apple.com;‎Sagen Sie doch, was Sie wollen! i Apple Books;" Männer … und solche, die es werden wollen!
Oesch Ve";"ze dargestellt. Ein wunderbar hilfreiches Handbuch für selbstbewusste Frauen und Männer … und solche, die es werden wollen!
Oesch Verlag";Redewendung
147443;undSolcheDieEsWerdenWollen;www.lokalkompass.de;Dorfschule Ginderich in Wesel - Thema; Nachbarn und solche, die es werden wollen, ein. Kur;e Weseler Demografie Gesellschaft, am 20. März zu einem Netzwerktreffen für gute Nachbarn und solche, die es werden wollen, ein. Kurz zur WDG selbst: Der Verein hat sich zum Vorsatz genommen, sich mit den vielfäl;Redewendung
15345;undSolcheDieEsWerdenWollen;asbh.de;ASBH Young Point 2020: Freizeit, Kontakte, Austausch - ASBH;" Pointler und solche, die es werden wollen!
In diese";"20. März 2020, die Teilnehmerzahl ist auf max. 14 Personen begrenzt.
Liebe Young Pointler und solche, die es werden wollen!
In diesem Jahr geht es zur Manfred-Sauer-Stiftung nach Lobbach im Odenwald. Vor Ort gibt";Redewendung
117281;undSolcheDieEsWerdenWollen;www.netzwerk-iq.de;Editorial - netzwerk-iq;" Profis – und solche, die es werden wollen
Selbst Ex";"ge Arbeitsmarkt längst mit Migrations- und Integrationsthemen verknüpft ist.
Für Profis – und solche, die es werden wollen
Selbst Expertinnen und Experten im Bereich der Arbeitsmarktintegration vom Menschen mit M";Redewendung
36016;undSolcheDieEsWerdenWollen;www.ihk-trier.de;IHK Trier - Baugeräteführer; Profis – und solche, die es werden wollen – ans Ste;Hier dürfen nur Profis – und solche, die es werden wollen – ans Steuer. Für viele ist es ein Kindheitstraum, Bagger zu fahren. Baugeräteführer tun ;Redewendung
124710;undSolcheDieEsWerdenWollen;www2.e-control.at;Selbst Ökostrom erzeugen - E-Control;" Prosumer und solche, die es werden wollen.
Die Eins";"n vier Wänden.
Prosumer - Strom selbst erzeugen. (1,9 MB)
Die Übersicht für alle Prosumer und solche, die es werden wollen.
Die Einspeisetarife für erstmalige Neuanträge auf Kontrahierung finden Sie in der Ökostr";Redewendung
152990;undSolcheDieEsWerdenWollen;www.kroener-verlag.de;Gesamtverzeichnis - Kröner Verlag; Quijote‹ und solche, die es werden wollen, für Lite;"denn wer hier wen geprägt hat, ist alles andere als klar.
Für Liebhaber des ›Don Quijote‹ und solche, die es werden wollen, für Literaturwissenschaftler und Literaturstudenten, aber auch für Freunde Spaniens, die";Redewendung
169886;undSolcheDieEsWerdenWollen;www.rockingletters.com;Rocking Letters - Jessica Wittmann-Naun | Veranstaltungstipp: Worldrecords by Kai Schäfer meets Mannheim – Vernissage; Sammlern und solche, die es werden wollen zum Erwer;usstellungseröffnung. Ein Großteil der ausgestellten Bilder steht Kunstfreunden, Sammlern und solche, die es werden wollen zum Erwerb bereit. Organisiert wird die Ausstellung von einer studentischen Projektgruppe;Redewendung
152388;undSolcheDieEsWerdenWollen;www.edition-temmen.de;Edition Temmen | Seemannsgeschichten | online kaufen; Seebären und solche, die es werden wollen, erzählt ;"Autor: Hermann Gutmann
Abbildungen: -
Geschichten über Seebären und solche, die es werden wollen, erzählt von Hermann Gutmann, gewürzt mit dem ihm eigenen feinsinnigen Humor und einer Pr";Redewendung
172739;undSolcheDieEsWerdenWollen;www.glaktuell.net;2. Kulturwoche für Senioren und solche, die es werden wollen;" Senioren und solche, die es werden wollen
Nach dem ";"2. Kulturwoche für Senioren und solche, die es werden wollen
Nach dem großen Erfolg im vergangenen Jahr startet am Samstag, dem 13. September 2014 die";Redewendung
70454;undSolcheDieEsWerdenWollen;www.glaktuell.net;August 28, 2014 - GL Aktuell Nachrichten aus Bergisch Gladbach;" Senioren und solche, die es werden wollen
Nach dem ";"und zwei Stunden voll gesperrt. Der Verkehr wurde umgeleitet.
2. Kulturwoche für Senioren und solche, die es werden wollen
Nach dem großen Erfolg im vergangenen Jahr startet am Samstag, dem 13. September 2014 die";double
194578;undSolcheDieEsWerdenWollen;www.praxis-pietruska.de;Gebissschutz für Sportler und solche, die es werden wollen;" Sportler und solche, die es werden wollen
Nicht nur";"Gebissschutz für Sportler und solche, die es werden wollen
Nicht nur Profiboxer sollten einen Mundschutz tragen. Gerade in der Freizeit ist ein Spor";Redewendung
181547;undSolcheDieEsWerdenWollen;www.tv-heggen.de;Home;" Sportler und solche, die es werden wollen, an.
In d";" Uhr bietet der TV Heggen mit dem Kurs „Full Body Workout“ ein neues Angebot für Sportler und solche, die es werden wollen, an.
In dem Kurs unter Leitung von Anne Pongartz wird das eigene Körpergewicht genutzt um";Redewendung
40920;undSolcheDieEsWerdenWollen;www.ratinger-sportaerzte.de;Sport? Einfach die beste Medizin! - Ratinger Sportärzte; Sportler und solche, die es werden wollen, ist Spor;"Sport? Einfach die beste Medizin!
Für Sportler und solche, die es werden wollen, ist Sport ideal als Ausgleich zu einer sitzenden Tätigkeit oder zur Stressbewältigung – ";Redewendung
166985;undSolcheDieEsWerdenWollen;www.onetz.de;Krafttraining im Stadtpark | Onetz; Sportler und solche, die es werden wollen, können n;"Krafttraining im Stadtpark
Raus aus dem Haus und ran an die Klimmzugstangen. Sportler und solche, die es werden wollen, können nun im Waldershofer Stadtpark an frischer Luft im Grünen trainieren. Die neue Cal";Redewendung
5531;undSolcheDieEsWerdenWollen;www.indiaperspectives.gov.in;Sport Archives - India Perspectives;" Sportler und solche, die es werden wollen.
Ein Tick";" indischen Sports, auf die das ganze Land stolz ist, sowie alles über prominente Sportler und solche, die es werden wollen.
Ein Ticket für die Olympischen Spiele in Tokio
Heft 05, 2019 Sport
Es ist allgemein beka";Redewendung
135192;undSolcheDieEsWerdenWollen;biotech-verbund.de;biotechnologieverbund berlin-brandenburg | Life Sciences Oberhavel;" Standort und solche, die es werden wollen.
Wir verm";"sen von derzeit 60 Unternehmen der Life Sciences. Wir stärken die Unternehmen am Standort und solche, die es werden wollen.
Wir vermarkten den Life Science Standort Oberhavel in der Metropolregion Berlin-Brandenb";Redewendung
171438;undSolcheDieEsWerdenWollen;www.stadtmarketing.eu;10 gute Möglichkeiten, Startups in Ihrer Stadt zu fördern - Stadtmarketing Austria; Startups und solche, die es werden wollen, von neue;haffen Sie als Stadt/Gemeinde mehr Plattformen und Beratungsmöglichkeiten, damit Startups und solche, die es werden wollen, von neuen Finanzierungsmöglichkeiten erfahren. Auch eine eigene Plattform für interessie;Redewendung
197384;undSolcheDieEsWerdenWollen;www.unisg.ch;«HSG Spin-Off Barometer 2019» – 150 Millionen Franken Umsatz erzielt und mehr als 3500 Jobs geschaffen | Wissen | Universität St.Gallen; Startups und solche, die es werden wollen. Seit 201;Startup@HSG gehören Coaching, Büroräume, Veranstaltungen und vieles mehr für HSG Startups und solche, die es werden wollen. Seit 2018 gibt es auch den St.Galler Startup Navigator. Die an der Universität St.Gallen;Redewendung
172762;undSolcheDieEsWerdenWollen;www.theaterpolitik.de;Schaukasten; Theaters und solche, die es werden wollen, sind her;"ammenarbeit mit dem Landesverband freier Theater statt. Interessierte des freien Theaters und solche, die es werden wollen, sind herzlich eingeladen.
Dienstag, 16. Mai 2017, 20 Uhr
""Schlechte Nachrichten"" von der";Redewendung
7079;undSolcheDieEsWerdenWollen;pflumm.de;Tübingen Archive — Pflumm.de; Tübinger und solche, die es werden wollen, hat Frie;"karfront, Zwingelmauer, Hölderlinturm, Stiftskirche
Kusterdingen, 28.10.2015
Für Tübinger und solche, die es werden wollen, hat Friedrich Linnemann ein bildschönes Buch herausgebracht. Es ist eine Hommage für Tüb";Redewendung
76823;undSolcheDieEsWerdenWollen;vereint-mehr-bewegen.fwal.de;Vereint mehr bewegen;" Vereinen und solche, die es werden wollen
aus Leipz";"wollen,
• Schatzmeister*innen und Vorstandsmitglieder von kleinen gemeinnützigen Vereinen und solche, die es werden wollen
aus Leipzig.
Rico Knorr ist studierter Mathematiker und Wirtschaftswissenschaftler. Mit z";Redewendung
