;kurz;source_domain;title;match;match_long;type
155612;undSolcheDieEsWerdenWollen;wd.ljr.de;Landesjugendring Niedersachsen e.V. : Handbücher;"penleiter und solche, die es werden wollen..
Der Dau";"nn wissen sollte
Rechtliche Hinweise für Jugendgruppenleiterinnen und Jugendgruppenleiter und solche, die es werden wollen..
Der Dauerbrenner zum JugendgruppenleiterInnen Lehrgang!
Die Teilnahme an Jugendfreizeit";double
2807;undSolcheDieEsWerdenWollen;www.hagen-58.de;Sportplätze in Hagen gesperrt;portfans, und solche, die es werden wollen, bietet d;"gungs.Räume
[22.07.2010 - Allgemeines] Bunt, aktiv und international: Für alle Sportfans, und solche, die es werden wollen, bietet der Tag des Sports am Donnerstag, 22. Juli, im und rund um das Westfalenbad viele";Redewendung
33043;undSolcheDieEsWerdenWollen;scstetten.de;Winter-Fitness – Ski Club Stetten a.k.M.;"portliche und solche, die es werden wollen,
zur Skig";"Bock auf Winter-Fitness?
Es treffen sich Alte, Junge, Dicke, Dünne,
Sportliche und solche, die es werden wollen,
zur Skigymnastik.
Unter gezielter, fachlicher Anleitung wird ein buntes Sportprogramm an";Redewendung
64889;undSolcheDieEsWerdenWollen;www.submission.de;Aktuelle News | Submissions-Anzeiger;praktiker und solche, die es werden wollen Im neu ge;"Bau GmbH Heidelberg,... ... mehr
VDBUM auf der NordBau 2014
Anlaufstelle für Baupraktiker und solche, die es werden wollen Im neu gebauten Forum in Halle 1 präsentiert der Verband der Baubranche, Umwelt- und Masc";Redewendung
124388;undSolcheDieEsWerdenWollen;www.loewenstern-verlag.de;LöwenStern Verlag - Anleitung zum Unglücklichsein (Autor: Paul Watzlawick);ptimisten und solche, die es werden wollen, eine kla;"teht Ihnen jedoch auch frei, die Tipps umzudrehen. Daher ist das Buch auch für Optimisten und solche, die es werden wollen, eine klare Empfehlung.
Wo kaufen? https://amzn.to/36z9yIR";Redewendung
3459;undSolcheDieEsWerdenWollen;www.hqmedia.de;Das große Buch der Lesefreuden - LangenMüller Herbig | bei HQMEDIA;ptimisten und solche, die es werden wollen. Geschrie;Satiren, Humoresken, Geschichten voller Witz und treffender Lebensklugheit für Optimisten und solche, die es werden wollen. Geschrieben von namhaften Autoren, die durch die ganze Vielfalt der Erzählkunst unseres ;Redewendung
204638;undSolcheDieEsWerdenWollen;fyyd.de;fyyd: Der Selfpublisher-Podcast : SPP 118: Mit Evi Goldbrunner über die Software Dramaqueen;publisher und solche, die es werden wollen. Interess;Der Podcast für Selfpublisher und solche, die es werden wollen. Interessante Interviews mit Autoren, Verlegern und Experten zum Thema Selfpublishing, re;Redewendung
209113;undSolcheDieEsWerdenWollen;fyyd.de;fyyd: Der Selfpublisher-Podcast : Mehr Leser erreichen: Interview mit dem Geschäftsführer von Buchdeals.de Alexander Ivanov;publisher und solche, die es werden wollen. Interess;"Der Selfpublisher-Podcast
Der Podcast für Selfpublisher und solche, die es werden wollen. Interessante Interviews mit Autoren, Verlegern und Experten zum Thema Selfpublishing, re";Redewendung
31163;undSolcheDieEsWerdenWollen;www.jagdverband.de;Lernort Natur | Deutscher Jagdverband;r Aktiven und solche, die es werden wollen, hatten i;ul in Hessen fand vom 28.- 30. März im Knüllwald statt. Die zwanzig Lernort Natur Aktiven und solche, die es werden wollen, hatten ideales Wetter mitgebracht und gute Laune. Wie in den Jahren zuvor gab es ein kom;Redewendung
61247;undSolcheDieEsWerdenWollen;www.beeskow.de;Kreisstadt Beeskow mobil;r Autoren und solche, die es werden wollen, ein Male;e wird zu einem Atelierhaus umgebaut. Eine Töpferwerkstatt, eine Schreibstube für Autoren und solche, die es werden wollen, ein Maleratelier und eine Bildhauerwerkstatt laden zu künstlerischer Arbeit ein. Im Burg;Redewendung
203850;undSolcheDieEsWerdenWollen;frauen.oldenburg.de;Veranstaltungen;"r Gründer und solche, die es werden wollen
brancheno";"nderzentrums Oldenburg (TGO).
Oldenburger Gründerforum »
informatives Treffen für Gründer und solche, die es werden wollen
branchenoffen, kostenfrei, Anmeldung erbeten
Termin: Mittwoch, 26. Februar 2020, 18 Uhr
5";Redewendung
41983;undSolcheDieEsWerdenWollen;netzwerkrecherche.org;Malte Werner – Seite 7 – Wegweiser Nonprofitjournalismus;r Gründer und solche, die es werden wollen, bietet d;"s von mehr als 80 Vereinen und Stiftungen, fordert deshalb klarer Regelungen.
Für Gründer und solche, die es werden wollen, bietet die Studie aber auch ganz praktische Informationen: Auf den Seiten 9 bis 13 werde";Redewendung
110995;undSolcheDieEsWerdenWollen;www.companies24.com;10 Jahre UG (haftungsbeschränkt) - Wir feiern Geburtstag;r Gründer und solche, die es werden wollen, es ist a;" Anlässlich des
1. Für wen ist das überhaupt interessant?
Interessant ist das für Gründer und solche, die es werden wollen, es ist aber auch für Investoren zur Steueroptimierung interessant.
2. Warum ist das neu?";Redewendung
187460;undSolcheDieEsWerdenWollen;www.deal-magazin.com;DEAL - Magazine | Real Estate | Investment | Finance;r Gründer und solche, die es werden wollen, um ihre ;e Innovation Campus bietet genügend Raum für Start-Ups und junge Unternehmen, für Gründer und solche, die es werden wollen, um ihre Geschäftsidee voranzutreiben“, sagte Fuchs anlässlich der Vertragsunterzeichnung;Redewendung
188255;undSolcheDieEsWerdenWollen;www.wirtschaft-regional.net;Startup Weekend Paderborn in der garage33 vom 12. bis 14. Mai › WIR | WIRTSCHAFT REGIONAL;"r Gründer und solche, die es werden wollen.
Dass das";"er der Universität Paderborn (TecUP), ist das Startup Weekend ein Tummelplatz für Gründer und solche, die es werden wollen.
Dass das Veranstaltungsformat erfolgsversprechend ist, zeigt u. a. das Gewinnerteam aus ";Redewendung
106215;undSolcheDieEsWerdenWollen;www.wirtschaft-regional.net;Existenzgründungs-Center › WIR | WIRTSCHAFT REGIONAL;"r Gründer und solche, die es werden wollen.
Startup ";"er der Universität Paderborn (TecUP), ist das Startup Weekend ein Tummelplatz für Gründer und solche, die es werden wollen.
Startup Weekend Paderborn in der garage33 vom 12. bis 14. Mai weiterlesen
Veröffentlicht";double
144304;undSolcheDieEsWerdenWollen;www.horizont.net;Start-up Safari: Wie Rhein-Main Gründer pushen will;r Gründer und solche, die es werden wollen. Um das P;rt-up-Mekka Deutschlands – aber auch das Rhein-Main-Gebiet hat viel zu bieten für Gründer und solche, die es werden wollen. Um das Potential der Region, die bisher vor allem als Fintech-Standort galt, noch besser;Redewendung
79237;undSolcheDieEsWerdenWollen;www.biopress.de;Erntefrisches Bio-Gemüse für den LEH;r Insider und solche, die es werden wollen am 25. Fe;"Nachfrage im Obst- und Gemüsemarkt bietet das Markt Seminar Obst und Gemüse – für Insider und solche, die es werden wollen am 25. Februar 2015 in Bonn.
www.biovollsortiment.de mit >20.000 Bio-Artikeln
Im Internet";Redewendung
74880;undSolcheDieEsWerdenWollen;www.metropolis-verlag.de;Karl Hackstette: Individualistische Unternehmensführung;r Insider und solche, die es werden wollen: lesenswe;"ortungs-, Individualitäts- und Erfolgspostulats. ... Dieses Buch ist ein Muss für Insider und solche, die es werden wollen: lesenswert, unterhaltsam, nachdenkenswert!
Dr. Karl Hackstette
studierte Philosophie und";Redewendung
37432;undSolcheDieEsWerdenWollen;www.phil.uni-passau.de;30 Jahre Kulturwirtschaft an der Universität Passau - Universität Passau;r Insider und solche, die es werden wollen“ schreibt;wurden zu Bestsellern ihres Genres. In ihrem Buch „Grand Paris - Savoir-vivre für Insider und solche, die es werden wollen“ schreibt sie über ihre Wahlheimat Frankreich. Stefanie von Wietersheim geht als Autorin ;Redewendung
79037;undSolcheDieEsWerdenWollen;luebeck-ferienhaus.de;Christa – Hanse-Häuser;r Klassik und solche, die es werden wollen machen im;" die kleine Schwester der
Das Festival zwischen den beiden Meeren. Weltstarts der Klassik und solche, die es werden wollen machen im Sommer sieben Wochen
WeinSommer Lübeck Rathaus-Markt
Fünfzehn Winzer aus den Re";Redewendung
62943;undSolcheDieEsWerdenWollen;meine.rheinische-anzeigenblaetter.de;Partnerschaftsgesellschaft Weilerswist in Euskirchen - Thema;"r Lieder (und solche, die es werden wollen):
Chanson";"ie Besucherinnen und Besucher, die am dem 15....
Für alle Liebhaber französischer Lieder (und solche, die es werden wollen):
Chansonabend mit Myriam Jabaly
Am Freitag, dem 15. November um 20:00 wird es in der Rem";Redewendung
174688;undSolcheDieEsWerdenWollen;www.suchebar.com;Rheinland-Pfalz - suche Pirmasens - 1;"r Piloten und solche die es werden wollen.
http://w";"ftflotte (Motorflug, Segelflug, Motorsegler, UL) vor und bietet Informationen für Piloten und solche die es werden wollen.
http://www.aero-club-pirmasens.de/
5- Alt Pirmasens
Das Hotel und Restaurant informiert ";Redewendung
170225;undSolcheDieEsWerdenWollen;www.ac-trier-konz.de;Vereinsheim - Aero-Club Trier & Konz;"r Piloten und solche, die es werden wollen!
Neben un";" Sprechen Sie uns an: persönlich, per Email oder telefonisch. Wir freuen uns!
Für Piloten und solche, die es werden wollen!
Neben unserm Gastraum befinden sich die Flugleitung und der Raum zur Flugvorbereitung, s";Redewendung
89082;undSolcheDieEsWerdenWollen;www.dein-niedersachsen.de;Unterkünfte, Hotels und Ferienhäuser in Niedersachsen;r Piraten und solche, die es werden wollen, öffnen s;Auch für Hochzeitspaare ist das genau der richtige Ort für die Flitterwochen. Für Piraten und solche, die es werden wollen, öffnen sich die Türen des Port Royal im Heidepark Soltau. Das Themenhotel steht ganz im ;Redewendung
176970;undSolcheDieEsWerdenWollen;www.bundesverband-finanzplaner.de;Altersrente Artikel zum Thema;"r Rentner und solche, die es werden wollen
Rentner l";"eld, Erwerbsunfähigkeitsrente und Altersrente gehen verloren...
Informationen für Rentner und solche, die es werden wollen
Rentner lassen sich in der gesetzlichen Krankenversicherung grundsätzlich in die Gruppen ";Redewendung
178375;undSolcheDieEsWerdenWollen;www.bigbluetours.com;Reisemagazin Malediven, Mauritius, Seychellen, Sri Lanka;r Taucher und solche, die es werden wollen. Auch wen;"iven Tauchen - Mit Nemo schnorcheln Die Malediven gelten seit je als Paradies für Taucher und solche, die es werden wollen. Auch wenn überall [...]
Badeferien im Indischen Ozean Es ist wohl kein Geheimnis, dass g";Redewendung
101888;undSolcheDieEsWerdenWollen;www.hisolutions.com;HiSolutions Cybersecurity Digest Dezember 2019 veröffentlicht;r Techies und solche, die es werden wollen: Man muss;"Mitte
Apropos links (unser Top Thema): Zum Schluss etwas fast Philosophisches für Techies und solche, die es werden wollen: Man muss nicht die Meinung teilen, dass Security Engineering die lichte Zukunft ist, abe";Redewendung
117705;undSolcheDieEsWerdenWollen;www.unicater.de;Ernährung;r Veganer und solche, die es werden wollen: Am Samst;"Schlagwort: Ernährung
“Vegan heißt Finden von Alternativen”
Ein Fest für Veganer und solche, die es werden wollen: Am Samstag fand auf dem Marienplatz in München die 16. Veganmania statt. Den ganzen Tag ";Redewendung
18510;undSolcheDieEsWerdenWollen;www.unicater.de;Tierschutz;r Veganer und solche, die es werden wollen: Am Samst;"Schlagwort: Tierschutz
“Vegan heißt Finden von Alternativen”
Ein Fest für Veganer und solche, die es werden wollen: Am Samstag fand auf dem Marienplatz in München die 16. Veganmania statt. Den ganzen Tag ";double
2194;undSolcheDieEsWerdenWollen;ziege.ch;Wissen für Nutzungsorientierte;r abzielt und solche, die es werden wollen, so biete;wertungen intensiv behandelt. [...] Wenn auch das Buch vorrangig auf Ziegenhalter abzielt und solche, die es werden wollen, so bietet es doch wertvolle Informationen für alle, die sich beruflich oder nebenberufli;Redewendung
102571;undSolcheDieEsWerdenWollen;www.dmg-home.org;Deutsche Mineralogische Gesellschaft: AMiTU- und CPKM-Sektionstreffen 2016;r der DMG und solche, die es werden wollen, erhalten;tragen bei Übernachtung im EZ 230 € bzw. bei Übernachtung im DZ 157 €. Mitglieder der DMG und solche, die es werden wollen, erhalten als Studierende, Diplomanden, Master- und Doktoranden einen Zuschuss von 50 € z;Redewendung
177516;undSolcheDieEsWerdenWollen;drstefangeorg.de;Veröffentlichungen – Prof. Dr. Stefan Georg;r wendet (und solche, die es werden wollen). Auf run;am 1. Mai 2016 mein Buch zum Kostenmanagement, das sich ausdrücklich an Praktiker wendet (und solche, die es werden wollen). Auf rund 180 Seiten wird Ihnen anwendungsorientiert vorgestellt, wie es Ihnen wirklich ;Redewendung
41959;undSolcheDieEsWerdenWollen;www.grundrechtekomitee.de;Seebrücke Bonn - Stoppt das Sterben im Mittelmeer;"r*innen“, und solche, die es werden wollen,
wie schö";"ich zugänglich machen:
Liebe „Anti-Abschiebe-Industrie“, liebe „Abschiebesaboteur*innen“, und solche, die es werden wollen,
wie schön, so viele von Euch hier zu sehen, wie zynisch und grotesk der Anlass!
Deutschl";Redewendung
215663;undSolcheDieEsWerdenWollen;www.malchen.eu;Dorfgemeinschaft Malchen e. V.: Mehr für Malchen;r, Könner und solche, die es werden wollen, jeden er;von ländlich rustikal bis flippig hochmodern treffen sich Interessierte, Anfänger, Könner und solche, die es werden wollen, jeden ersten Freitag im Monat von 19:00 bis 21:00 Uhr in der Bürgerhalle Malchen (Bespre;Redewendung
4289;undSolcheDieEsWerdenWollen;www.vdgg.de;VDGG » RUNDSCHREIBEN – 4/2015 vom 16.11.2015 » Drucken;"r- steher und solche, die es werden wollen.
Ein weiß";"nissen, Rezepten zum Nachkochen und Genießen. Ein Urlaubsbuch für Griechenlandver- steher und solche, die es werden wollen.
Ein weißer Wal im Rhein
Gedichte von Andreas Arnakis, aus dem Griechischen von Artemis A";Redewendung
102475;undSolcheDieEsWerdenWollen;www.auto-medienportal.net;Auto-Medienportal.Net;radfahrer und solche, die es werden wollen, ein umfa;"holt Einsteiger und Wiedereinsteiger ab
ampnet – 18. Mai 2018. BMW hat für Motorradfahrer und solche, die es werden wollen, ein umfangreiches Programm-Paket geschnürt, das sich vor allem an Einstieger und Wiedere";Redewendung
124937;undSolcheDieEsWerdenWollen;blog.diealternative.org;Gewerkschaften, Wahlen und AK Archive | Seite 53 von 68 | Die Alternative Blog - Alternative, Grüne und Unabhängige GewerkschafterInnen;raetInnen und solche, die es werden wollen“ Zielgrup;e BR-Grundschulung am Samstag den 13. März 2010: AUGE-Grundschulung für BetriebsraetInnen und solche, die es werden wollen“ Zielgruppe: BetriebsrätInnen, ErsatzbetriebsrätInnen, an einer Betriebsratsgründung Inte;Redewendung
148998;undSolcheDieEsWerdenWollen;www.comicdealer.de;home;"raft-Fans und solche, die es werden wollen dar!
Im N";" beiden Bücher zusammen mit der Chronik eine lohnende Anschaffung für alle Lovecraft-Fans und solche, die es werden wollen dar!
Im November folgt dann wieder das Sternengezücht um den Großen Cthulhu. Passend zum ";Redewendung
178294;undSolcheDieEsWerdenWollen;katja-dombrowski.info;Katja Dombrowski - freie Journalistin - Social Business bildet Internet-Programmierer in Kambodscha aus#Schweizer wollen sich selbst überflüssig machen;rammierer und solche, die es werden wollen, austausc;ür ein TYPO3-User-Group-Treffen zur Verfügung, bei dem sich 50 bis 60 TYPO3-Programmierer und solche, die es werden wollen, austauschen. „Unser Ziel ist es, auch einen Unterschied im Land zu machen“, fasst die Ch;Redewendung
186004;undSolcheDieEsWerdenWollen;www.heikewolff.info;Startseite;ratungen) und solche die es werden wollen (Unterric; Elternabende, -seminare), Erzieherinnen und Erzieher (Teamfortbildungen und -beratungen) und solche die es werden wollen (Unterrichtseinheiten an berufsbildenden Schulen), Lehrerinnen und Lehrer (individuelle B;Redewendung
37254;undSolcheDieEsWerdenWollen;www.zeltverleih.de;Zelte und Leichtbauhallen von LeuBe - Hochzeit feiern im Zelt;rautpaare und solche, die es werden wollen, ihre Ang;"im Zelt
Hochzeit feiern im Zelt
Die Hochzeitsmesse in Weinheim richtet sich an Brautpaare und solche, die es werden wollen, ihre Angehörigen und alle, die sich mit der Planung einer Hochzeit befassen. Die Ausstel";Redewendung
48916;undSolcheDieEsWerdenWollen;www.dj-acki.de;Hochzeitsmesse Neuenhagen mit DJ Acki;rautpaare und solche, die es werden wollen, ihre Ang;"sse „Lieben, Leben. Heiraten“
Die Hochzeitsmesse in Neuenhagen richtet sich an Brautpaare und solche, die es werden wollen, ihre Angehörigen und alle, die sich mit der Planung einer Hochzeit befassen. Die Ausstel";Redewendung
134470;undSolcheDieEsWerdenWollen;www.kkjd.de;Evangelischer Jugenddienst Nienburg – Mitarbeitende;rbeitende und solche, die es werden wollen, bieten w;e in z.B. Kindergottesdiensten, Freizeiten einsetzen. Für Mitarbeitende und Mitarbeitende und solche, die es werden wollen, bieten wir die verschiedensten Seminare an: Tagesfortbildungen im Bereich Arbeit mit Kin;Redewendung
6514;undSolcheDieEsWerdenWollen;www.zukunftsinitiative.org;Socialbar 2012 zur documenta - Zukunftsinitiative - Nachhaltigkeit - Klimawandel - Ressourceneffizienz - Industrielle Ökologie;rbesserer und solche die es werden wollen zusammen ;"er Umweltbildung. Geplant ist eine Fortführung des Formats um Idealisten, Weltverbesserer und solche die es werden wollen zusammen zu bringen.
2. Hessischer Nachhaltigkeitstag 2012
Den Anlass des Hessischen Nach";Redewendung
192945;undSolcheDieEsWerdenWollen;rollenspielverein-biberach.de;Midgard – Das Brettspiel | Rollenspielverein Biberach e.V. Palaver;rdspieler und solche, die es werden wollen, können o;"ln tun dem Spielspass jedenfalls keinen Abbruch.
7 von 10 Mörderpinguinen (Migdardspieler und solche, die es werden wollen, können ohne Bedenken nochmal einen Punkt dazuzählen)
Phantastische Spielewelten, offizie";Redewendung
13749;undSolcheDieEsWerdenWollen;lsms.info;Ketogene und moderne Steinzeit Ernährung (Paleo);re Frauen und solche, die es werden wollen, sollten ;"n vom Arzt begleitet werden.
Eine weitere Risikogruppe sind Schwangere. Schwangere Frauen und solche, die es werden wollen, sollten keine ketogene Ernährung umsetzen, da der Stoffwechselzustand der Ketose dem Hun";Redewendung
81357;undSolcheDieEsWerdenWollen;de.wikipedia.org;Quitte – Wikipedia;re Kinder und solche, die es werden wollen. Wilhelm-;"ch: Münchener Bilderbogen Nro. 405/406 – Naturgeschichtliches Alphabet für größere Kinder und solche, die es werden wollen. Wilhelm-Busch-Seiten, 28. Januar 2006, abgerufen am 30. Oktober 2018.
↑ Astheimer Quitte";Redewendung
98436;undSolcheDieEsWerdenWollen;www.scope-online.de;ERP im Anlagenbau - SCOPE ONLINE;re Kunden und solche, die es werden wollen, suchen e;"ehmen. Wo drückt bei Ihren potenziellen Kunden der Schuh?
Maximilian Moser: Unsere Kunden und solche, die es werden wollen, suchen eine ERP-Lösung, mit der sie alle wesentlichen betriebswirtschaftlichen Arbeitsab";Redewendung
39350;undSolcheDieEsWerdenWollen;www.werkswelt.de;Wohnen » Studentenwerk Erlangen-Nürnberg;re Mieter und solche, die es werden wollen. Alles wi;in den Wohnanlagen des Studentenwerks Erlangen-Nürnberg und viele Infos für unsere Mieter und solche, die es werden wollen. Alles wichtige zur Wohndauer in unseren Wohnheimen können Sie hier ebenfalls erfahren. B;Redewendung
40656;undSolcheDieEsWerdenWollen;www.rumohr.de;Kurzvorstellung neuer XING-Gruppen 08-08 | Joachim Rumohr - Akademie für digitale Kundengewinnung;rer/Innen und solche die es werden wollen, die bege;"Harley Davidson – The Legend lives!
Diese Gruppe richtet sich an alle Harley Fahrer/Innen und solche die es werden wollen, die begeistert sind von der Harley Davidson Philosophie, die etwas zu sagen haben, sich ";Redewendung
632;undSolcheDieEsWerdenWollen;www.bayreuth.de;Theater in Bayreuth - Bayreuth.de;ressierte und solche die es werden wollen sind eing;"ührungen gezählt. Schülerinnen und Schüler aller Bayreuther Schulen, Theaterinteressierte und solche die es werden wollen sind eingeladen, an den drei Tagen die Aufführungen im Europasaal zu besuchen. | mehr
Die";Redewendung
40820;undSolcheDieEsWerdenWollen;www.jesus-folgen.net;Wir - jesus-folgen.net;ressierte und solche, die es werden wollen sowie Fam;ag um 10:30 Uhr unseren Gottesdienst in einem Wohnhaus in Hamburg-Niendorf. Interessierte und solche, die es werden wollen sowie Familien mit Kindern sind dazu ganz herzlich eingeladen. Wir freuen uns über jeden ;Redewendung
31446;undSolcheDieEsWerdenWollen;www.pafunddu.de;Noch freie Plätze im Programmierworkshop - Pfaffenhofen;ressierte und solche, die es werden wollen, aufgepas;"lege Pfaffenhofen a.d.Ilm
Teilnehmer designen ihr eigenes 3D-Spiel
Junge IT-Interessierte und solche, die es werden wollen, aufgepasst: Es gibt noch freie Plätze für den am 6. und 7. September stattfindenden Work";Redewendung
81959;undSolcheDieEsWerdenWollen;web5.karlsruhe.de;Willkommen | Literarische Gesellschaft Karlsruhe | Museum für Literatur am Oberrhein;ressierte und solche, die es werden wollen, durchfor;"lturszene Karlsruhe auf spannende (und lehrreiche) Angebote für junge Kulturinteressierte und solche, die es werden wollen, durchforstet.
Das Ergebnis in der Form des ""Karlsruher Coolturführers für Kinder und Jug";Redewendung
158511;undSolcheDieEsWerdenWollen;wwwtest.dwa-nrw.de;Junge Wasserwirtschaftler - Landesverband Nordrhein-Westfalen - DWA - Deutsche Vereinigung für Wasserwirtschaft, Abwasser und Abfall e.V.;rexperten und solche, die es werden wollen oder für ;"edsbeitrag.
Computerspiele - ""Mit Hochwasser spielen - und lernen""
Für Hochwasserexperten und solche, die es werden wollen oder für Hauseigentümer, die sich schützen wollen. Bewältigen die den Katastrophenschutz ";Redewendung
90377;undSolcheDieEsWerdenWollen;vorsprung-online.de;Vorsprung Online - Reihe Kultour startet: Kleine Kunst ganz groß;rfenmusik und solche, die es werden wollen, ein Konz;"che Einheit mit den farbenreichen Klängen ihrer Harfe. Für Freunde keltischer Harfenmusik und solche, die es werden wollen, ein Konzert, das sie sich nicht entgehen lassen sollten.
Er ist neben Max Uthoff Gastgeb";Redewendung
138814;undSolcheDieEsWerdenWollen;steffen-verlag.de;Feldberg, Geschichte und Geschichten | Archiv | Bücher | Steffen Verlag;rg-Kenner und solche, die es werden wollen. Ob... me;"
Feldberg, Geschichte und Geschichten
Dieses Buch ist ein ""Muss"" für alle Feldberg-Kenner und solche, die es werden wollen. Ob... mehr
Dieses Buch ist ein ""Muss"" für alle Feldberg-Kenner und solche, die es werden";Redewendung
114923;undSolcheDieEsWerdenWollen;galerie.die-fischers-online.eu;Impressionen aus der Sächsischen Schweiz - Bielatal - Blick in das Tal von der Johanniswacht - Fotogalerie;rgsteiger und solche, die es werden wollen. Einige F;"al von der Johanniswacht
Im Bielatal befinden sich über 200 Kletterfelsen für Bergsteiger und solche, die es werden wollen. Einige Felsen sind auch für den Wanderer zugänglich.";Redewendung
204936;undSolcheDieEsWerdenWollen;www.heise.de;Fernkurs: Betrügen für Dummies | heise online;riminelle und solche, die es werden wollen, gestoßen;ema. Der US-Blogger Brian Krebs ist jetzt über eine Art Fernlehrgänge für Cyberkriminelle und solche, die es werden wollen, gestoßen. In kostenpflichtigen, aufeinander aufbauenden Kursen soll den Teilnehmern verm;Redewendung
54823;undSolcheDieEsWerdenWollen;www.paraplan.com;Über uns - Internetagentur PARAPLAN - Webdesign, Marketing und Consulting aus Thüringen;"rktführer und solche, die es werden wollen.
PARAPLAN";"Die Agentur für Marktführer und solche, die es werden wollen.
PARAPLAN - Ihre Full-Service Agentur aus Thüringen
Als Full Service Agentur bieten wir u";Redewendung
12171;undSolcheDieEsWerdenWollen;taunus.info;Jugendherberge Grävenwiesbach, Grävenwiesbach, Weitere Unterkünfte im Taunus | Taunus.info;rmenschen und solche, die es werden wollen. Das Ange;sikgruppen und Familien. Direkt am Wald gelegen ist sie das ideale Ziel für Naturmenschen und solche, die es werden wollen. Das Angebot ist vielfältig: Erlebnispädagogik im Niedrig- und Hochseilgarten, begleitete;Redewendung
113952;undSolcheDieEsWerdenWollen;dickerturm.com;News zum Dicken Turm Esslingen;rmwächter und solche, die es werden wollen… Die Init;"ja Schrecklein zum Dicken Turm und der Initiative Turmwächter
Liebe Esslinger Turmwächter und solche, die es werden wollen… Die Initiative Turmwächter finde ich ganz persönlich ein starkes Stück! Ein starkes Stüc";Redewendung
174928;undSolcheDieEsWerdenWollen;www.dr-mutschler-stiftung.de;Satzung – Dr Mutschler Stiftung;rnalisten und solche die es werden wollen, um polit;sveranstaltungen (Vorträge, Tagungen, Seminare, Lesungen, Ausstellungen) für Journalisten und solche die es werden wollen, um politische Bildung mit dem unmittelbaren Nutzen für die journalistische Arbeit zu ver;Redewendung
75931;undSolcheDieEsWerdenWollen;www.journalismus-online.de;Journalismus online: Termine;"rnalisten und solche, die es werden wollen.
Kongress";"Startseite >> Aktuelles >> Termine
Alle wichtigen Termine für Journalisten und solche, die es werden wollen.
Kongresse, Messen und Tagungen
Preisausschreibungen";Redewendung
20777;undSolcheDieEsWerdenWollen;www.pressebox.de;Ausbildung / Jobs – Aktuelle Pressemitteilungen – PresseBox;rnehmer - und solche, die es werden wollen - haben j;"r Pressemitteilung
Grenzenlos Geschäfte machen
Deutsche und niederländische Unternehmer - und solche, die es werden wollen - haben jetzt Gelegenheit, sich in einem persönlichen Gespräch über grenzübergreifende Ge";Redewendung
