;kurz;source_domain;title;match;match_long;type
30884;undSolcheDieEsWerdenWollen;www.hilfefuermich.de;| HILFE FÜR MICH;htraucher und solche, die es werden wollen. Die Regi; Aufklärung (BZgA) bietet auf Ihrem Rauchfrei Portal ein lebhaftes Forum für Nichtraucher und solche, die es werden wollen. Die Registrierung ist simpel und kostenfrei. In der Community sind neben anderen Mitglie;Redewendung
22143;undSolcheDieEsWerdenWollen;bensheim-schoenberg.de;Interessengemeinschaft Schönberger Vereine: Die Stadtteil-Dokumentation Bensheim-Schönberg;hönberger und solche, die es werden wollen“ sowie ei;tschreiben. Weiter ist ein Bildvortrag in Arbeit mit dem Titel „Schönberg für Schönberger und solche, die es werden wollen“ sowie ein Vortrag „Die Schönberger anhand der Kirchenbuch-Einträge – familiäre Zusammenh;Redewendung
189452;undSolcheDieEsWerdenWollen;www.lesenblog.de;Lauter Lesenswertes » Blog Archiv » Namibia Spezial: Alles außer Reiseführern;"ibia-Fans und solche, die es werden wollen.
Gerhard ";"ungen zur DDR, die Landreform und den Karneval.
Dieses Buch ist ein Muss für Namibia-Fans und solche, die es werden wollen.
Gerhard Seyfried, „Herero“, 603 Seiten, 29,90 €, Eichborn-Verlag, ISBN: 978-3821808734 (";Redewendung
8439;undSolcheDieEsWerdenWollen;www.infodas.de;CYBERWOMEN - Das Event für Frauen der IT-Sicherheit - infodas - infodas;icherheit und solche die es werden wollen. Es geht ;N ist ein Event für den fachlichen Austausch von, mit und für Frauen in der IT-Sicherheit und solche die es werden wollen. Es geht nicht um die Darstellung von Firmen oder Produkten, sondern den Austausch über I;Redewendung
48197;undSolcheDieEsWerdenWollen;sued-it.de;Weiterbildung ISB für EVU;"icherheit und solche, die es werden wollen
Interesse";" ISO 27002- drehen.
Verantwortliche und deren Vertreter im Bereich Informationssicherheit und solche, die es werden wollen
Interessenten an der ISO27001 als einbettendes Managementsystem
In der Schulung werden kl";Redewendung
137388;undSolcheDieEsWerdenWollen;www.traunsteiner-tagblatt.de;Umfassende Werkschau des Münchner Zeichners, Malers und Illustrators Reinhard Michl im Kloster Seeon;ichl-Fans und solche, die es werden wollen. Eine Aug;der legendären Briefumschläge und Kunst-Post-Karten. Eine Schatzkiste für alle Michl-Fans und solche, die es werden wollen. Eine Augenweide, die viele Blicke ermöglicht. Eine unerschöpfliche Spielwiese für kleine;Redewendung
107283;undSolcheDieEsWerdenWollen;wb-hessen.de;Ihre Erfahrung ist gefragt - Weiterbildung Hessen e.V.;ichtungen und solche, die es werden wollen, die Qual;"chtige für Sie!
Als Repräsentant/in des Vereins überprüfen Sie, ob Mitgliedseinrichtungen und solche, die es werden wollen, die Qualitätskriterien zur Zertifizierung einhalten. Die Begutachtung findet im Rahmen e";Redewendung
61201;undSolcheDieEsWerdenWollen;funkhundd.wordpress.com;necronomicon – geträumte sünden (jess franco, deutschland 1968) | Remember it for later;icionados und solche, die es werden wollen, ist der ;t und anstrengend. Zum jetzigen Zeitpunkt not quite my cup of tea. Für Franco-Aficionados und solche, die es werden wollen, ist der Film aber dennoch bedeutsam: Es war der erste Film, den der Spanier komplett auß;Redewendung
105904;undSolcheDieEsWerdenWollen;ufind.univie.ac.at;u:find - Klassische Archäologie;"idatInnen und solche, die es werden wollen
Meyer, Do";"e (18 ECTS)
090098 PV 4 ECTS Privatissimum - Institutskolloquium für ExamenskandidatInnen und solche, die es werden wollen
Meyer, Do 14:00-16:00 (14×)
Alternatives Pflichtmodul Exkursion (12 ECTS)
Alternatives Pf";Redewendung
199360;undSolcheDieEsWerdenWollen;www.stadtmagazin-neumuenster.de;Stadtmagazin Neumünster - Mega-Wochenende in Neumünster;iderinnen und solche, die es werden wollen, sollten ;"€ Mega-Wochenende in Neumünster
Neumünster (em/sw) Hobby-Schneider und -Schneiderinnen und solche, die es werden wollen, sollten sich diesen Termin im Kalender markieren: Schleswig-Holsteins größter Stoffmarkt";Redewendung
51401;undSolcheDieEsWerdenWollen;www.digital-park.de;Digital Park | neue medien: Relaunch Stadt Lage – große Bilder;"ie Bürger und solche, die es werden wollen.
Wir habe";"seiten veröffentlicht, zeitgemäß responsiv gestaltet, mit viel Information für die Bürger und solche, die es werden wollen.
Wir haben über viele Monate das Bildmaterial u.a. für die vielen Titelbilder der Webseit";Redewendung
162852;undSolcheDieEsWerdenWollen;medizinischespersonal.de;CareLounge - Pflegeberufe/Expertenthema;ie Kunden und solche, die es werden wollen auf sich ;"n zur besseren Auslastung von Alten- und Pflegeheimen.
Mit gezielter PR können Sie Kunden und solche, die es werden wollen auf sich aufmerksam mache, Vertrauen gewinnen und so langfristig die Belegung Ihres Hause";Redewendung
153852;undSolcheDieEsWerdenWollen;www.nur-schwimmen-ist-schoener.de;für Erwachsene;ie Profis und solche, die es werden wollen, schwimme;"und religiös unabhängig und jeder kann bei uns Mitglied werden.
Übrigens: Auch die Profis und solche, die es werden wollen, schwimmen bei uns. Rettungsschwimmer, Taucher, Bademeister und Lehrer.
Alles, was Sie da";Redewendung
115387;undSolcheDieEsWerdenWollen;www.friedenauer-bruecke.de;Entlang der Rheinstraße 1945-1963 - friedenauer-bruecke-verlags Webseite!;"iedenauer
und solche, die es werden wollen
Es ist di";"3"" |
""Friedenau erzählt 1945-1963""
Zwei in einem: Bilderbuch und Lesebuch für Friedenauer
und solche, die es werden wollen
Es ist dies nicht irgendein beliebiges Heimat- oder Vorortbuch, sondern ein verlegerische";Redewendung
36313;undSolcheDieEsWerdenWollen;rz-leserreisen.de;rz-leserreisen;"ienkenner und solche, die es werden wollen!
RANKFURT";"n Anspruch auf Kondition, lockern einzelne Tagesetappen auf. Eine Reise für Spanienkenner und solche, die es werden wollen!
RANKFURT – BILBAO – PAMPLONA
Am Morgen gemeinsamer Linienflug mit Lufthansa von Frankfur";Redewendung
1279;undSolcheDieEsWerdenWollen;familie.pr-gateway.de;"""Macht uns stark! - Familien kommen an"" - Familie und Kinder, Kinder Info, Familie & Co » Familie und Kinder, Kinder Info, Familie & Co";"ienmakler und solche, die es werden wollen
Know How!";"04.-05. September 2013
Abi geschafft, Schulzeit vorbei!
« Geheimtipp für Immobilienmakler und solche, die es werden wollen
Know How! AG relauncht Website – Strategische Neuausrichtung und optimierte Usability »";Redewendung
176769;undSolcheDieEsWerdenWollen;www.aurachsmuehle.de;Kurse - Aurachsmühle;"ierhalter und solche die es werden wollen.
Wir besc";"EN KLINIK DR. ELLER
Unsere Veranstaltungen richten sich an alle interessierten Tierhalter und solche die es werden wollen.
Wir beschäftigen uns mit verschiedenen Fragestellungen der Tiergesundheit, betrachten di";Redewendung
36377;undSolcheDieEsWerdenWollen;degupedia.de;Willkommen bei Degupedia.de (Wichtige Infos) - Kleinsäugerforum (Degupedia.de);ierhalter und solche die es werden wollen. Wir woll;"ungen.
Mit unserem Forum wenden wir uns bewusst an interessierte und erfahrene Tierhalter und solche die es werden wollen. Wir wollen mit unserem Forum ein angenehmes Klima bieten für tiefgründige Themen, den ar";Redewendung
124681;undSolcheDieEsWerdenWollen;www.weissbierzirkel.de;WBZ - Herzlich Willkommen beim Weissbierzirkel;ierkenner und solche, die es werden wollen gibt es n;ezialität in der nostalgisch-wertigen 0,5 Liter Bügel-Flasche ist da. Für alle Bierkenner und solche, die es werden wollen gibt es nun die ganz besondere Bierspezialität wie in der guten alten Zeit. Ob in geselli;Redewendung
160740;undSolcheDieEsWerdenWollen;gegenstandpunkt.com;Trump und Putins Russland | GegenStandpunkt;ifizierte und solche, die es werden wollen, aus Russ;" Sowjetunion, in: Le Monde Diplomatique, 10.11.11)
Seit Jahren wandern hoch Qualifizierte und solche, die es werden wollen, aus Russland ab. Vor allem Richtung Westen. Nun versucht Moskau einmal mehr sie zurückzu";Redewendung
32299;undSolcheDieEsWerdenWollen;wmweiss.com;Venedig - Walter M. Weiss;ig-Kenner und solche, die es werden wollen, oder als;" Lubenow (Fotos)
Egal, ob als Einstimmung auf eine Reise, als Geschenk für Venedig-Kenner und solche, die es werden wollen, oder als Erinnerung an einen charmanten Kurztrip - der DuMont Bildband Venedig fängt das";Redewendung
189791;undSolcheDieEsWerdenWollen;wmweiss.com;Venedig - Walter M. Weiss;ig-Kenner und solche, die es werden wollen, oder als;"rlag, Ostfildern
Egal, ob als Einstimmung auf eine Reise, als Geschenk für Venedig-Kenner und solche, die es werden wollen, oder als Erinnerung an einen charmanten Kurztrip - der DuMont Bildband Venedig fängt das";double
38470;undSolcheDieEsWerdenWollen;www.thalia.de;DuMont Bildband Venedig - Buch | Thalia;ig-Kenner und solche, die es werden wollen, oder als;"und Impressionen
Egal, ob als Einstimmung auf eine Reise, als Geschenk für Venedig-Kenner und solche, die es werden wollen, oder als Erinnerung an einen charmanten Kurztrip - der DuMont Bildband Venedig fängt das";double
81643;undSolcheDieEsWerdenWollen;www.wohnen-im-eigentum.de;Umfrage 2016: Henner Schmidt (FDP);igentümer und solche, die es werden wollen, passiert;".B. durch die Verschärfung der ENEV, die Kosten des Wohnens weiter erhöht. Für Eigentümer und solche, die es werden wollen, passierte nichts. Es wurde immer unattraktiver gemacht, Wohneigentum zu bilden.
Henner S";Redewendung
138758;undSolcheDieEsWerdenWollen;www.baselland.ch;Rückblick auf ein Jahr Baselbieter Energiepaket: 67 Eisenbahnwaggons Heizöl gespart — baselland.ch;igentümer und solche, die es werden wollen, schaffe.;"reits bestehenden Bauspar-Modell äusserst attraktive Rahmenbedingungen für Hauseigentümer und solche, die es werden wollen, schaffe.
Landrat Christoph Buser , Geschäftsleitungsmitglied und Leiter KMU-Förderung de";Redewendung
198680;undSolcheDieEsWerdenWollen;www.vdgn.de;VDGN: VDGN-Journal 1-2020;igentümer und solche, die es werden wollen. Was sind;"s Fachanwalt für das Miet- und Wohnungseigentumsrecht suchen besonders Wohnungseigentümer und solche, die es werden wollen. Was sind auf diesem Gebiet typische Fallkonstellationen?
In Erfurt und ganz Thüringen si";Redewendung
105924;undSolcheDieEsWerdenWollen;www.aldilife.com;Zwei Koffer in New York (eBook) | ALDI life;ikerinnen und solche, die es werden wollen. (Dieser ;lbst kräftig aufs Korn. Witzig und voller interessanter Details: für Stadtneurotikerinnen und solche, die es werden wollen. (Dieser Text bezieht sich auf eine frühere Ausgabe.) Anna Radulescu, im täglichen Leben ;Redewendung
17844;undSolcheDieEsWerdenWollen;www.ghb-online.de;Linken-Parteitag in Berlin-Adlershof Linke will nach Mietendeckel auch an die Böden - Gesellschaft Historisches Berlin e.V.;iktatoren und solche, die es werden wollen.“;erbriefte Koalitionsfreiheit anzugreifen. Kretschmer erklärte: „So handeln nur Diktatoren und solche, die es werden wollen.“;Redewendung
45102;undSolcheDieEsWerdenWollen;www.kaernten.at;Urlaub mit dem Fahrrad | Radfahren in Kärnten;inbiker - und solche, die es werden wollen, finden h;"nnt. Zahlreiche Most- und Weinschenken laden hier zum Pausieren ein.
Auch Mountainbiker - und solche, die es werden wollen, finden hier in Kärnten ein reiches Betätigungsfeld. In der Region Bad Kleinkirchheim etw";Redewendung
173021;undSolcheDieEsWerdenWollen;www.dueren.de;Stadt Düren: Kultur Stadt Düren: Kultur;"ine Leser und solche, die es werden wollen. mehr
""Ta";"e Kinderbücherei der Stadt Düren wieder ein abwechslungsreiches Programm für kleine Leser und solche, die es werden wollen. mehr
""Tartuffe“ frei nach Moliere auf Schloss Burgau
Düren. Wie bereits angekündigt ist ";Redewendung
129805;undSolcheDieEsWerdenWollen;portugalforum.org;Linkverzeichnis | Das PortugalForum;infreunde und solche die es werden wollen DIE Seite;ische Portweininstitut (sowas gibt es!) präsentiert sich im Internet. Für Portweinfreunde und solche die es werden wollen DIE Seite! Viele Infos übers Anbaugebiet, den Portwein, die Geschichte und vieles mehr. M;Redewendung
110041;undSolcheDieEsWerdenWollen;www.deutscheweine.de;Meldungen - Seite 9 von 54;infreunde und solche die es werden wollen, können s;"WeinEntdecker-Wochen 2019 gestartet
Weinfreunde und solche die es werden wollen, können sich vom 6. bis 22. September auf spannende Weinerlebnisse im Rahmen der WeinEntd";Redewendung
216611;undSolcheDieEsWerdenWollen;www.zeitpunkt-magazin.de;Zeitpunkt-Magazin - News: WeinEntdecker-Wochen 2016mit über 200 Aktionen erfolgreich;inkundige und solche, die es werden wollen, erlebbar;usgefallenen Menüs und vielen weiteren Ideen auf, um die heimischen Weine für Weinkundige und solche, die es werden wollen, erlebbar zu machen.;Redewendung
13976;undSolcheDieEsWerdenWollen;www.battenberg-gietl.de;Battenberg Gietl Verlag;insammler und solche, die es werden wollen – Tipps, ;"en | Hans-Ludwig Grabowski
Handbuch Geldscheinsammeln
Ein Leitfaden für Geldscheinsammler und solche, die es werden wollen – Tipps, Tricks und Infos vom Fachmann
Abbildungen: komplett farbig bebildert
Das Papierg";Redewendung
169339;undSolcheDieEsWerdenWollen;de.linkfang.org;﻿﻿﻿ Notgeld - de.LinkFang.org;insammler und solche, die es werden wollen. 1. Aufla;" Wolfgang J. Mehlhausen: Handbuch Geldscheinsammeln – Ein Leitfaden für Geldscheinsammler und solche, die es werden wollen. 1. Auflage. Gietl, Regenstauf 2004, ISBN 3-924861-90-0.
Hans Hagen Hottenroth: Notgeld i";double
170727;undSolcheDieEsWerdenWollen;www.apfelwiki.de;Hermstedt – apfelwiki.de;io-Kunden und solche, die es werden wollen, werden b;"te Web- und NetShuttle, findet man unter http://mitglied.lycos.de/naegli
Hifidelio-Kunden und solche, die es werden wollen, werden bei der Firma Ebert Multi Media GmbH in Heidelberg, Tel. 06221 / 7297 153, E-Mail";Redewendung
163537;undSolcheDieEsWerdenWollen;www.gartenverband-wedding.de;Aktuelles - Bezirksverband Wedding der Kleingärtner e. V.;iogärtner und solche, die es werden wollen. Der Eint;en, Workshops und Informationsständen richtet sich an alle Biogärtnerinnen und Biogärtner und solche, die es werden wollen. Der Eintritt ist frei. Der Aktionstag ist eine Veranstaltung des Forschungsinstituts für;Redewendung
203837;undSolcheDieEsWerdenWollen;www.oeynhausen-retten.de;Aktionstag Biogarten in der Domäne Dahlem - Bürgerinitiative Schmargendorf braucht Oeynhausen;iogärtner und solche, die es werden wollen. Der Eint;n, Work-shops und Informationsständen richtet sich an alle Biogärtnerinnen und Biogärtner und solche, die es werden wollen. Der Eintritt ist frei. Der Aktionstag ist eine Veranstaltung des Forschungsinstituts für;double
140929;undSolcheDieEsWerdenWollen;www.fachzeitungen.de;Akquisitionen und Selbstüberschätzung - PDF eBook kaufen | Ebooks Finanzierung - Bankwirtschaft - Kapital;irtschaft und solche, die es werden wollen. BANKMAGA;"des Jahres 2013. Unabhängig, kritisch, kompetent! Für Führungskräfte der Finanzwirtschaft und solche, die es werden wollen. BANKMAGAZIN ...
Bachelorarbeit aus dem Jahr 2013 im Fachbereich BWL - Investition und Fi";Redewendung
111809;undSolcheDieEsWerdenWollen;schattenblick.net;SCHATTENBLICK - STREIFZÜGE/037: Zeitschrift des Kritischen Kreises, Nr. 64, Sommer 2015;"ist*innen und solche, die es werden wollen.
Vorwärts";" Stirn zu bieten. Alles dies macht das Buch zu einer lohnenden Lektüre für Feminist*innen und solche, die es werden wollen.
Vorwärts, müssen wir zurück?
Eine radikale Kritik am Leben in der Marktwirtschaft als de";Redewendung
32434;undSolcheDieEsWerdenWollen;www.wenden.de;Veranstaltungskalender / Gemeinde Wenden;isterten, und solche die es werden wollen, für den ;"Flugplatzfest 2019 »
Die Flugplatzgemeinschaft Hünsborn lädt alle Flugbegeisterten, und solche die es werden wollen, für den 1. und 2. Juni 2019 zum Flugplatzfest nach Hünsborn ein. Geboten werden Rundflüg";Redewendung
94583;undSolcheDieEsWerdenWollen;www.wenden.de;Veranstaltungskalender / Gemeinde Wenden;isterten, und solche die es werden wollen, für den ;"lesen
Flugplatzfest 2019 »
Die Flugplatzgemeinschaft Hünsborn lädt alle Flugbegeisterten, und solche die es werden wollen, für den 1. und 2. Juni 2019 zum Flugplatzfest nach Hünsborn ein. Geboten werden Rundflüg";double
33307;undSolcheDieEsWerdenWollen;rotefalken.at;Service / Gruppenarbeit / Startseite Kinderfreunde Österreich - Kinderfreunde;iterInnen und solche, die es werden wollen, euch jed;"Service des Pädagogischen Büros
Im Servicebereich könnt ihr als GruppenleiterInnen und solche, die es werden wollen, euch jede Menge nützliche Sachen für die Gruppenarbeit besorgen. Jede Menge Spiele, Bast";Redewendung
65077;undSolcheDieEsWerdenWollen;www.kirche-koeln.de;Für Frauen: Beratungs- und Hilfsangebote - Evangelischer Kirchenverband Köln und Region;iterinnen und solche, die es werden wollen. Auch gem;inisch gehören Vorträge, Seminare und Gruppengespräche, Schulungen für Gruppenleiterinnen und solche, die es werden wollen. Auch gemeindeintern werden Schulungen und Beratung angeboten. Die Vernetzung der Frauena;Redewendung
19185;undSolcheDieEsWerdenWollen;sform.de;was man nicht nur… « sform;iterinnen und solche, die es werden wollen. die arbe;"
die 30-seitige broschüre gibt rechtliche hinweise für jugendleiter und jugendleiterinnen und solche, die es werden wollen. die arbeitshilfe des landesjugendringes niedersachsen erscheint in der 47. auflage mit e";Redewendung
156318;undSolcheDieEsWerdenWollen;empfangsanlage.de;Day night sports Frankfurt mit neuer Getränketheke im Gym für Fitness und Spass;itglieder und solche die es werden wollen mit einem;dernen Studiotheke wird mit LED- Beleuchtung in Szene gesetzt und empfängt die Mitglieder und solche die es werden wollen mit einem Strahlen das nur noch durch die freundlichen Mitarbeiter und die tolle Ambiente;Redewendung
216073;undSolcheDieEsWerdenWollen;sv-remshalden.de;Herzlich Willkomen bei der SV Remshalden;itglieder und solche die es werden wollen steht zud;en oder sich einfach nur durch Echtzeit-Nachrichten informieren zu lassen. Für Mitglieder und solche die es werden wollen steht zudem ein umfassender Frage/Antwort-Bereich zur Verfügung. Ergänzt wird die App dur;Redewendung
27717;undSolcheDieEsWerdenWollen;germanblogs.de;Die 10 besten Tennisclubs in Deutschland - Germanblogs.de;itglieder und solche die es werden wollen, stehen i;"e Mannschaftsmeisterschaften und 3 Vize-Mannschaftsmeisterschaften feiern. Für Mitglieder und solche die es werden wollen, stehen insgesamt 18 Freiplätze, 3 Hallenplätze und ein Freibad zur Verfügung.
Tennis-Clu";Redewendung
136216;undSolcheDieEsWerdenWollen;st-johannes-mgh.drs.de;Ansicht - Kath. Kirchengemeinde St. Johannes Baptist Bad Mergentheim;"itglieder und solche, die es werden wollen
Der Kirch";"Information zur Kirchengemeinderatswahl
Begegnungsabend für KGR- Mitglieder und solche, die es werden wollen
Der Kirchengemeinderat der katholischen Kirchengemeinde St. Johannes-Baptist lädt ein zu ";Redewendung
100799;undSolcheDieEsWerdenWollen;www.philaseiten.de;Philaseiten.de: Anträge der BDPh Einzelmitglieder zur Hauptversammlung am 28.09.2019;"itglieder und solche, die es werden wollen
Wie nicht";"äge der BDPh Einzelmitglieder zur Hauptversammlung am 28.09.2019
An alle Einzelmitglieder und solche, die es werden wollen
Wie nicht zuletzt der Umgang mit dem Vorschlag der Strukturkommission gezeigt hat, wird d";Redewendung
208751;undSolcheDieEsWerdenWollen;www.vsrn.de;VSRN - Verein - Geschäftstelle;itglieder und solche, die es werden wollen (Online-M;enden Geschäften und ist insbesondere Ansprechpartner und Anlaufstelle für die Mitglieder und solche, die es werden wollen (Online-Mitgliedsantrag). Eine wesentliche Aufgabe der Geschäftsstelle besteht im Bemühen;Redewendung
134063;undSolcheDieEsWerdenWollen;kulturfoerderverein-hirschberg.de;Kalender | Kulturförderverein Hirschberg e.V.;itglieder und solche, die es werden wollen _________;"achten zu können. Wir laden Sie herzlich ein.
11:00 Jahresabschlusstreffen für Mitglieder und solche, die es werden wollen __________________________ Künstlergespräch bei Sekt und Brezel
Heute haben Sie bei der F";Redewendung
192842;undSolcheDieEsWerdenWollen;opticundvision.de;ZVA-Branchenzahlen auf der opti vorgestellt Allgemein - OpticUndVision;itglieder und solche, die es werden wollen bereit. U;nnungen und Landesinnungsverbände sowie des ZVA als Ansprechpartner für Innungsmitglieder und solche, die es werden wollen bereit. Und auch der mittlerweile legendäre Henry versorgte die Besucher am ZVA-Stand wie;Redewendung
148704;undSolcheDieEsWerdenWollen;grundschule-uersfeld.de;Grundschule Uersfeld - Schule;itglieder und solche, die es werden wollen eine geme;ete und viele Pausenspiele angeschafft. Jedes Jahr bietet der Förderverein für Mitglieder und solche, die es werden wollen eine gemeinsame Veranstaltung an. Zum Beispiel fand im März 2013 eine geführte Wanderung ;Redewendung
190067;undSolcheDieEsWerdenWollen;www.gdp.de;In der Ausgabe des Landesteils der Deutschen Polizei Juli 2006 sind u.a. folgende Themen zu finden... - Gewerkschaft der Polizei;itglieder und solche, die es werden wollen nutzen di;"rnet oder durch die abgebende Versandapotheke ist nicht erlaubt.
Übrigens: GdP-Mitglieder und solche, die es werden wollen nutzen die Internetapotheke unter www.gdp-sachsen-anhalt.de.";Redewendung
38352;undSolcheDieEsWerdenWollen;www.sensor-wiesbaden.de;Bereit zum Durchstarten - Die Wiesbadener Gründerszene nimmt Fahrt auf - sensor Magazin - Wiesbaden - Fühle deine Stadt;itglieder und solche, die es werden wollen oder müss;iesbaden: http://heimathafen-wiesbaden.de. IHK Wiesbaden Die Einrichtung berät Mitglieder und solche, die es werden wollen oder müssen (Existengründer übrigens in der Regel beitragsfrei), über die Gründung eines ;Redewendung
163329;undSolcheDieEsWerdenWollen;www.zva.de;Der ZVA auf der Opti: Branchenzahlen und mehr | ZVA;itglieder und solche, die es werden wollen, bereitst;nnungen und Landesinnungsverbände sowie des ZVA als Ansprechpartner für Innungsmitglieder und solche, die es werden wollen, bereitstehen. Nicht zuletzt wird der mittlerweile legendäre Henry die Besucher am ZVA-St;Redewendung
154878;undSolcheDieEsWerdenWollen;www.vdk.de;Für ein schönes und barrierefreies Zuhause | Sozialverband VdK Bayern e.V.;itglieder und solche, die es werden wollen, gerne zu;ands VdK Bayern stehen die Mitarbeiterinnen und Mitarbeiter für die Fragen der Mitglieder und solche, die es werden wollen, gerne zur Verfügung. Auch Informationen zum Thema „Barrierefrei wohnen“ gehören zum Ange;Redewendung
64035;undSolcheDieEsWerdenWollen;www.vdk.de;VdK-Zeitung 2018 | Sozialverband VdK Bayern e.V.;itglieder und solche, die es werden wollen, herzlich;"tellen vom 18. bis 22. Juni in ganz Bayern. Zur VdK-Aktionswoche sind alle VdK-Mitglieder und solche, die es werden wollen, herzlich willkommen. | weiter
| bsc
Stark, bayerisch, VdK
Der Sozialverband VdK Bayern i";Redewendung
121566;undSolcheDieEsWerdenWollen;www.barockkirche-zwillbrock.de;Freundeskreis - Barockkirche Zwillbrock;itglieder und solche, die es werden wollen, sind her;" Barockkirche Zwillbrock e.V. und der Stichting Grenzen Verbinden (ANBI).
Alle Mitglieder und solche, die es werden wollen, sind herzlich eingeladen.
Am 8. April 2018 fand die jährliche Generalversammlung des Fre";Redewendung
189885;undSolcheDieEsWerdenWollen;www.siegerbrauckmann.de;Den »standpunkt« für »Sauerland Initiativ« markieren « siegerbrauckmann - Büro für Wirtschaftskommunikation;itglieder und solche, die es werden wollen, sowie za;v« produziert siegerbrauckmann regelmäßig den DIN A3- Newsletter »standpunkt«. Mitglieder und solche, die es werden wollen, sowie zahlreiche Tages- und Fachmedien erfahren darin Wissenswertes rund um die Unterneh;Redewendung
149265;undSolcheDieEsWerdenWollen;www.vahlen.de;Arbeitshandbuch für Vorstandsmitglieder | Semler / Peltzer | Verlag Vahlen München;itglieder und solche, die es werden wollen, werden d;"buch-Vorstandsmitglieder-9783800631889.pdf [136,95 KB]
„(…) Nicht nur Vorstandsmitglieder und solche, die es werden wollen, werden das Arbeitshandbuch mit Gewinn zur Hand nehmen, sondern auch der Berater des Vors";Redewendung
83529;undSolcheDieEsWerdenWollen;www.saechsische.de;Gewerbeverein sucht neue Wege | Sächsische.de;itglieder und solche, die es werden wollen: Sven Wol;einstimmig. Dabei sind die alten auch die neuen Ansprechpartner für die Vereinsmitglieder und solche, die es werden wollen: Sven Wolf als Vorsitzender, Mike Isendahl als Stellvertreter und Ronny Naumann als Schat;Redewendung
15964;undSolcheDieEsWerdenWollen;tonmeistertagung.com;tmt31 7. - 10. Oktober 2020 CCD - Düsseldorf;"itglieder und solche, die es werden wollen; die VDT-";"ustausch und Human Networking einlädt. Auf dem Stand 1-20 treffen sich die VDT-Mitglieder und solche, die es werden wollen; die VDT-Ehrenamtler sowie bekannte Größen der Branche. Mit dem frischen, neuen Konzept s";Redewendung
42698;undSolcheDieEsWerdenWollen;www.wiesbadenaktuell.de;Wiesbadenaktuell: Tag;itäninnen und solche, die es werden wollen, haben di;"STADTRADELN - Treffen der Teamkapitäne
STADTRADELN-Teamkapitäne und -kapitäninnen und solche, die es werden wollen, haben die Gelegenheit, sich an diesen beiden Terminen locker auszutauschen. Wie schaffe ";Redewendung
54097;undSolcheDieEsWerdenWollen;skoutz.de;Skoutz-Wiki: Crime - Kriminalgeschichten und Thriller - Skoutz;"ivs.
Fans und solche, die es werden wollen, sollten ";"
Im Bonuswissen bieten wir heute Reisetipps
Bild von der Homepage des Krimi-Archivs.
Fans und solche, die es werden wollen, sollten unbedingt im Deutschen Krimi-Archiv vorbeischauen, das aus einer Präsenzbiblioth";Redewendung
