;kurz;source_domain;title;match;match_long;type
107725;undSolcheDieEsWerdenWollen;udis.de;Seminar - DSGVO-Folgenabschätzung - udis - Ulmer Akademie für Datenschutz und IT-Sicherheit gGmbH;auftragte und solche, die es werden wollen, sowie ga;ionell und zeitsparend durchgeführt werden kann. Dazu gehören auch Datenschutzbeauftragte und solche, die es werden wollen, sowie ganz allgemein Mitarbeiterinnen und Mitarbeiter im Bereich Compliance, Datenschutz;Redewendung
133752;undSolcheDieEsWerdenWollen;www.blanke.com;Ausbildung zum Sicherheitsbeauftragten;"auftragte und solche, die es werden wollen.
Das Semi";"n Arbeitsschutzthemen? Solche und ähnliche Fragen stellen sich für Sicherheitsbeauftragte und solche, die es werden wollen.
Das Seminar vermittelt die grundlegenden Kenntnisse des staatlichen und berufsgenossensc";Redewendung
194721;undSolcheDieEsWerdenWollen;www.ra-heise.de;Kompaktseminar Datenschutz - Andreas Heise - Rechtsanwalt;auftragte und solche, die es werden wollen. Das Komp;Dieses Seminar richtet sich ausdrücklich nicht ausschließlich an Datenschutzbeauftragte und solche, die es werden wollen. Das Kompaktseminar hat bewusst nicht den Anspruch, eine vollständige Ausbildung eines be;Redewendung
81712;undSolcheDieEsWerdenWollen;oekoplus-freiburg.de;oekoplus - Freiburg :: Verschiedenes;"auherren, und solche die es werden wollen
Weitere p";" der Energieagentur Regio Freiburg noch möglich.
Aus der Praxis – Seminare für Bauherren, und solche die es werden wollen
Weitere praxisnahe Informationen zum energieeffizienten Haus und erneuerbaren Energien gi";Redewendung
92115;undSolcheDieEsWerdenWollen;www.fachzeitungen.de;.Kein Verlag bekannt oder erscheinen eingestellt | Fachzeitungen.de;auherren, und solche, die es werden wollen, interess;"enheim"" informiert über die wichtigstn Themen rund um die Immobilie. Alles was Bauherren, und solche, die es werden wollen, interessiert, steht in bauen + wohnen. j.
Newsletter: Frischlufttechnik im Wohnungsbau
D";Redewendung
110005;undSolcheDieEsWerdenWollen;issuu.com;Park Books, Frühjahr 2020 by Frank Niederländer - Issuu;auherren» und solche, die es werden wollen Enthält e;"rausragendes Beispiel zeitgemässer städtischer Wohnform Ein Lehrbuch für «gute Bauherren» und solche, die es werden wollen Enthält eine Checkliste für mögliche zukünftige Bauherrinnen und Bauherren
Gemeinschaft b";Redewendung
124943;undSolcheDieEsWerdenWollen;www.winzerla.com;Nachrichten - Jena Winzerla | Jena Winzerla;"auspieler und solche, die es werden wollen
Jena Winz";"Klein- und Kleinstunternehmer unterstützt. Für letzteren Part sind…
Gesucht: Schauspieler und solche, die es werden wollen
Jena Winzerla. Neruda Alkhalil und Hamed Hamayel sind Freunde, Hamed ist Nerudas Schwager";Redewendung
173670;undSolcheDieEsWerdenWollen;www.hinundweg.jetzt;hinundweg | Die Magie der Puppe;auspieler und solche, die es werden wollen, und für ;"nd Poesie in der Arbeit mit Figuren!
Ein Workshop für Figurentheaterfreunde, Schauspieler und solche, die es werden wollen, und für alle, die sich ausprobieren möchten, sich und ihr Alter Ego theatral zu finden!
";Redewendung
77319;undSolcheDieEsWerdenWollen;www.ancora-verlagsservice.de;Sinfonie G-dur Hob. I:88;aydn-Fans und solche, die es werden wollen.;ritischer Bericht machen die handliche Partitur zum idealen Begleiter für alle Haydn-Fans und solche, die es werden wollen.;Redewendung
171873;undSolcheDieEsWerdenWollen;www.henle.de;Detailseite / G. Henle Verlag;"aydn-Fans und solche, die es werden wollen.
Sinfonie";"ritischer Bericht machen die handliche Partitur zum idealen Begleiter für alle Haydn-Fans und solche, die es werden wollen.
Sinfonie (La Poule) g-moll Hob. I:83
Suche nach »Haydn Sinfonie g-moll Hob. I:83 (La Pou";double
183568;undSolcheDieEsWerdenWollen;www.henle.de;Detailseite / G. Henle Verlag;"aydn-Fans und solche, die es werden wollen.
Suche na";"ritischer Bericht machen die handliche Partitur zum idealen Begleiter für alle Haydn-Fans und solche, die es werden wollen.
Suche nach »Haydn Sinfonie F-dur Hob. I:89«
Die Sinfonie in F-dur Hob. I:89 schrieb Jose";double
185201;undSolcheDieEsWerdenWollen;widmoser.de;News - Joerg Widmoser;azzgeiger und solche die es werden wollen (2.-7. Fe;"ut. Das Konzert ist am 2. Februar, anschließend ein ausführlicher Workshop für Jazzgeiger und solche die es werden wollen (2.-7. Februar)“
Der internationale Violin Summit 2002 findet wieder in Philadelphia stat";Redewendung
164754;undSolcheDieEsWerdenWollen;www.channelpartner.de;CeBIT: Was hält Handball-Bundestrainer Brand von IT? - channelpartner.de;ball-Fans und solche, die es werden wollen, können s;"n einem Interview seine Einstellung zu neuen Computertechnologien verraten.
Handball-Fans und solche, die es werden wollen, können sich am 19. März um 12.30 auf dem FSC Stand in Halle 1/G51 ein Interview mit dem ";Redewendung
128394;undSolcheDieEsWerdenWollen;www.thalia.de;The Watch Book von Gisbert L. Brunner - Buch | Thalia;"banduhren und solche, die es werden wollen
The Watch";"1 000 Bildern umfassend gewürdigt
- Ein Muss für alle Sammler und Kenner von Armbanduhren und solche, die es werden wollen
The Watch Book I und II in einem Band vereint: Umfangreiches Fachwissen des renommierten ";Redewendung
168139;undSolcheDieEsWerdenWollen;www.rehadat-recht.de;Urteile zu Arbeits- und Gesundheitsschutz im Betrieb | REHADAT-Recht;"beitgeber und solche, die es werden wollen
Dazu Hinw";"Ratgeber für behinderte Arbeitgeberinnen und Arbeitgeber und solche, die es werden wollen
Dazu Hinweise und Beispiele rund um Verwaltung und Abrechnung von AssistentInnen
Bundesve";Redewendung
71008;undSolcheDieEsWerdenWollen;shop.oegbverlag.at;Familienfreundlichkeit im Betrieb;beitgeber und solche, die es werden wollen. Demograf;"ie!
Vereinbarkeit von Beruf und Familie ist ein Schlüsselthema für attraktive Arbeitgeber und solche, die es werden wollen. Demografische Veränderungen, komplexe rechtliche Rahmenbedingungen, aber auch eine neue ";Redewendung
213723;undSolcheDieEsWerdenWollen;literaturkritik.de;"Knigge für Rabenmütter - Die FDP-Europaabgeordnete Silvana Koch-Mehrin verfasst mit ihrem Buch ""Schwestern"" eine ""Streitschrift für einen neuen Feminismus"" : literaturkritik.de";"benmütter und solche, die es werden wollen"". Den lie";" am besten zusagt. Gegen eine solche Spezies hilft nichts als ein ""Knigge für Rabenmütter und solche, die es werden wollen"". Den liefert Koch-Mehrin, ornithologische Grundlagen inklusive: ""Den Vogelforschern sind";Redewendung
5043;undSolcheDieEsWerdenWollen;www.visum-support.de;Wie beantrage ich ein Visum?;benteurer und solche die es werden wollen. Neben de;bing, Paragliding oder eine ausgedehnte Bergtor: Russland ist ein Paradies für Abenteurer und solche die es werden wollen. Neben dem Radfahren über kurvige Gebirgspässe, können Sie natürlich auch eine unvergessl;Redewendung
142451;undSolcheDieEsWerdenWollen;www.tmc-reisen.de;Intrepid Travel Afrika | Alle Touren und Safaris bei TMC Reisen buchen;benteurer und solche, die es werden wollen. In Grupp;"äten unterscheiden:
Die BASIX-Touren in Afrika richten sich vor allem an echte Abenteurer und solche, die es werden wollen. In Gruppen von bis zu 22 Teilnehmern pro Gruppe bereisen Sie das Land. Ausgezeichnet wer";Redewendung
187267;undSolcheDieEsWerdenWollen;www.urlaub.de;Thailand Urlaub | jetzt günstig buchen mit urlaub.de;benteurer und solche, die es werden wollen. Zudem gi; der Karen oder der Meos in Nord-Thailand bei Chiang Mai ist ein Muss für alle Abenteurer und solche, die es werden wollen. Zudem gilt das Land als hervorragendes Tauchrevier, das Ihnen sowohl im Golf von Thailan;Redewendung
858;undSolcheDieEsWerdenWollen;www.freshdads.com;Männer sind im Job Einzelkämpfer, Frauen arbeiten lieber im Team | FRESHDADS Väter – Helden – Idole;ber Väter und solche, die es werden wollen, hat die ;"en Start - neue Broschüre für Männer erschienen
Eine neue kostenlose Broschüre über Väter und solche, die es werden wollen, hat die Stadt Ludwisgsburg in Zusammenarbeit mit dem Kreis Ludwisgsburg und der Ludwigsb";Redewendung
14351;undSolcheDieEsWerdenWollen;www.schiller-buch.de;London Calling. Als Deutsche auf der Brexit-Insel - Schillerbuch;ber*innen und solche die es werden wollen, aber auc;"lebendig und sehr gut zu lesen.
Fazit: Ein echtes Lesevegnügen für Englandliebhaber*innen und solche die es werden wollen, aber auch für alle, die verstehen wollen, warum viele für den Brexit gestimmt haben!
Wen";Redewendung
203198;undSolcheDieEsWerdenWollen;cvo6wiki.de;Quelltext der Seite Ratgeber – cvo6;ber*innen und solche, die es werden wollen. Dazu Hin;'''Dies ist mein privater Entwurf einer Überarbeitung. :für behinderte Arbeitgeber*innen und solche, die es werden wollen. Dazu Hinweise und Beispiele rund um Verwaltung und Abrechnung von Assistent*innen :Ausga;Redewendung
16515;undSolcheDieEsWerdenWollen;web395.campari.loswebos.de;Eine Übersetzergruppe finden;bersetzer und solche, die es werden wollen, ist http;" zum deutschen GNOME-Übersetzungsprojekt
Die Anlaufstelle für deutschsprachige Übersetzer und solche, die es werden wollen, ist http://www.gnome-de.org/ bzw. die Mailing-Liste gnome-de.
Sollte bereits eine entspr";Redewendung
141460;undSolcheDieEsWerdenWollen;www.logl-bw.de;CompetenzCentren für Obst & Garten;"besitzer"" und solche, die es werden wollen.";" um sie für die Zukunft zu rüsten, aber auch ihr Wissen weitergeben an ""Stücklesbesitzer"" und solche, die es werden wollen.";Redewendung
34091;undSolcheDieEsWerdenWollen;waz.immowelt.de;Haushaltsrechner – Einnahmen und Ausnahmen kalkulieren;besitzer, und solche die es werden wollen: An diese;" Haushalts werden hier Angaben zu Wohn- und Nebenkosten benötigt.
Für Immobilienbesitzer, und solche die es werden wollen: An dieser Stelle können Sie testen, wie es sich auf Ihre Finanzen auswirkt, wenn Sie nac";Redewendung
101237;undSolcheDieEsWerdenWollen;blfd.bayern.de;Montagsvorträge 2020;"bestätten und solche, die es werden wollen
2. März 2";" Haimhausen
17. Februar 2020: Auf dem Weg zum UNESCO-Welterbe. Bayerische Welterbestätten und solche, die es werden wollen
2. März 2020: Autobahnen, Gastrassen, Hochwasserschutz. Archäologische Ausgrabungen in li";Redewendung
156543;undSolcheDieEsWerdenWollen;gesellschaft-fuer-archaeologie.de;Gesellschaft für Archäologie in Bayern e.V.;"bestätten und solche, die es werden wollen
Dozentin:";". Christian Later
17. Feb. 20 Auf dem Weg zum UNESCO-Welterbe. Bayerische Welterbestätten und solche, die es werden wollen
Dozentin: Katharina Arnold M. A.
02. Mrz. 20 Autobahnen, Gastrassen, Hochwasserschutz. Ar";double
111004;undSolcheDieEsWerdenWollen;blfd.bayern.de;Montagsvortrag;"bestätten und solche, die es werden wollen
Katharina";"- und Informationsamt München
Auf dem Weg zum UNESCO-Welterbe. Bayerische Welterbestätten und solche, die es werden wollen
Katharina Arnold M. A.
Jedes Jahr nimmt das UNESCO-Welterbekomitee neue Kultur- und Natur";double
151889;undSolcheDieEsWerdenWollen;www.kompost-biogas.info;Kompost-Biogas | Ausbildungskurs für Erlaubniswerber nach §24a AWG und Kurs zur Jahresabfallbilanz-Meldung 2018;betreiber und solche die es werden wollen, sich wei;"usbildung findet am 30. Jänner statt.
Dieser Kurs richtet sich an Kompostanlagenbetreiber und solche die es werden wollen, sich weiterbilden wollen oder einen Nachweis für den Gesetzgeber brauchen. Wie Erlaubnis";Redewendung
71889;undSolcheDieEsWerdenWollen;www.klaerwerk.info;Klärwerk.info - Meldungen zu Biogas 2009;"betreiber und solche, die es werden wollen.
Programm";"s Beratung, Planung, Wissenschaft, Verwaltung und Politik sowie an Biogasanlagenbetreiber und solche, die es werden wollen.
Programm, weitere Informationen und Anmeldungsmöglichkeiten finden Sie auf
www.fnr.de/bi";Redewendung
214119;undSolcheDieEsWerdenWollen;www.st-antonius-chemnitz.de;Jugendhaus - Umgebung;bewohner (und solche, die es werden wollen) für ihre;"engeflogen kommen, auch sie leben im Wasserwerkspark.
Ich hoffe, dass Jugendhausbewohner (und solche, die es werden wollen) für ihren Aufenthalt einige Infos bekommen haben, was man zu Fuß und in nächster Umgebun";Redewendung
15776;undSolcheDieEsWerdenWollen;vhs.soest.de;VHS Soest: Es war einmal...Rotkäppchen und der böse Wolf, nur ein Märchen?;"bhaber
...und solche die es werden wollen.
Treffpun";" nicht geeignet.
- Wolfsliebhaber
- Hundeliebhaber
- Naturliebhaber
- Märchenliebhaber
...und solche die es werden wollen.
Treffpunkt: Wanderparkplatz
59519 Möhnesee-Neuhaus gegenüber Landgasthof ""Zum Takeberg"".";Redewendung
65471;undSolcheDieEsWerdenWollen;kress.de;OVK Online-Report 2013/02: Mobile-Werbung 76% im Plus: kress.de;bilisten (und solche, die es werden wollen) in Marke;em Hause Haymarket Media richtet sich an leidenschaftliche und professionelle Mobilisten (und solche, die es werden wollen) in Marketing und Vertrieb, in Unternehmen und Agenturen sowie deren Entwickler und Diens;Redewendung
35854;undSolcheDieEsWerdenWollen;www.cineman.ch;Cineman - David Hugh Jones - Cineman;bliophile und solche, die es werden wollen.;"ut geht. Mit Robert De Niro und Ed Harris.
Eine Art verfilmter Briefroman für Bibliophile und solche, die es werden wollen.";Redewendung
131910;undSolcheDieEsWerdenWollen;www.cineman.ch;Cineman - Ian McNeice - Cineman;"bliophile und solche, die es werden wollen.
Politisc";"y und Michelle Pfeiffer
The Raggedy Rawney
Eine Art verfilmter Briefroman für Bibliophile und solche, die es werden wollen.
Politisches Drama von Richard Attenborough. Ein Schwarzer und ein Weisser kämpfen zusamm";double
127767;undSolcheDieEsWerdenWollen;wmi.messe.at;Ihr Browser unterstüzt kein Javascript, leider kann es dadurch zu Problemem bei der Ansicht der Website kommen;byflieger und solche, die es werden wollen. Ausreich;die „Action Arena“. Dort warten rund 12.700 Kubikmeter Flugfläche auf aktive Hobbyflieger und solche, die es werden wollen. Ausreichend Platz also, um alle gängigen Modellflugzeugtypen und -marken sowie auch etwa;Redewendung
132449;undSolcheDieEsWerdenWollen;www.bhb.org;HELLWEG und BayWa Bau & Garten neue Mitglieder der DIY Academy;bygärtner und solche, die es werden wollen, aus. Im ;cademy mit Sitz in Köln bildet bundesweit kreative Selbermacher, Heimwerker, Hobbygärtner und solche, die es werden wollen, aus. Im Vordergrund steht dabei die neutrale und professionelle Vermittlung von Theorie ;Redewendung
181738;undSolcheDieEsWerdenWollen;www.bhb.org;Partner;bygärtner und solche, die es werden wollen, aus. Im ;et und bildet seitdem bundesweit viele kreative Selbermacher, Heimwerker und Hobbygärtner und solche, die es werden wollen, aus. Im Vordergrund steht dabei die neutrale und professionelle Vermittlung von Theorie ;double
86621;undSolcheDieEsWerdenWollen;www.bankenonline.org;﻿ Consorsbank Depot » Trader-Konto » Bewertungen & Test;"ch
Trader und solche, die es werden wollen, sollten ";"ichere Online-Trading.
Ein Depotwechsel zum günstigen Consorsbank Depot lohnt sich
Trader und solche, die es werden wollen, sollten sich die Konditionen zum Trader-Konto bei der Consorsbank genauer ansehen. Nicht";Redewendung
58400;undSolcheDieEsWerdenWollen;www.krankenkassen.de;SBK - Siemens Betriebskrankenkasse Chemnitz - Krankenkassen.de;ch Aktive und solche, die es werden wollen, beim Err;icherten, den inneren Schweinehund zu überwinden. Mit dem Online-Coach können sich Aktive und solche, die es werden wollen, beim Erreichen ihrer ganz persönlichen Gesundheitsziele unterstützen lassen. Über den On;Redewendung
167841;undSolcheDieEsWerdenWollen;vaeternotruf.de;Amtsgericht Miltenberg;ch Kranke und solche die es werden wollen oder sich;"gsstelle dringend abraten, Sexualberatung, Partnerberatung, Beratung für psychisch Kranke und solche die es werden wollen oder sich dafür halten, Telefonische Beratung, Krisenintervention
Amt für Kinder, Jugend ";Redewendung
58641;undSolcheDieEsWerdenWollen;vaeternotruf.de;Amtsgericht Bad Waldsee;ch Kranke und solche, die es werden wollen oder sich; und getrennt erziehender Mütter und Väter, Sexualberatung, Beratung für psychisch Kranke und solche, die es werden wollen oder sich dafür halten, Vermittlung von Selbsthilfegruppen, Gruppenarbeit, Kriseninterven;Redewendung
111335;undSolcheDieEsWerdenWollen;duesseldorfer-lifestyle.de;News - Seite 2 von 3 - LiD - Lifestyle in Düsseldorf;ch Mütter und solche, die es werden wollen, zuweilen;er eigentlich ein Kinderspielplatz mit angrenzenden Grundschulen ist, treffen sich Mütter und solche, die es werden wollen, zuweilen auch zu Prosecco und Pizza, während die Männer am Handy ihre Läden am Laufen ha;Redewendung
179654;undSolcheDieEsWerdenWollen;www.filmszene.de;The Player | Filmszene.de;chautoren und solche, die es werden wollen. In einer;t zu geben. Er ist lediglich eine Zwischenstation, erste Anlaufstelle für Drehbuchautoren und solche, die es werden wollen. In einer kongenialen, achtminütigen Kamerafahrt zu Beginn des Films veranschaulicht Altm;Redewendung
28492;undSolcheDieEsWerdenWollen;dpg.hamburg;Steffen Möller LIVE – Weronika Dein Mann ist da – Deutsch-Polnische Gesellschaft Hamburg e.V.;"che Paare und solche, die es werden wollen.
Steffen ";"teffen Möller
Steffen Möller präsentiert einen Glücksratgeber für deutsch-polnische Paare und solche, die es werden wollen.
Steffen Möller – Weronika Dein Mann ist da
https://www.eventim.de/event/steffen-moeller-";Redewendung
39007;undSolcheDieEsWerdenWollen;www.no-mads.de;Kraftort Archive - mamiwata;chitekten und solche, die es werden wollen, können O;ere, dann lässt sich ein solcher auch von Menschenhand erschaffen. Landschaftsarchitekten und solche, die es werden wollen, können Orte kreieren, in denen die Erdenergien frei fließen und die Menschen, Tiere und ;Redewendung
158022;undSolcheDieEsWerdenWollen;www.hansapark.de;Dr. Livingstone's Safari-Flug - Deutschlands einziger Erlebnispark am Meer;chpiloten und solche, die es werden wollen. Die Trom;"Hansapark Park > Attraktionen > Dr. Livingstone's Safari-Flug
Einsatz für Buschpiloten und solche, die es werden wollen. Die Trommel ruft.
Eine ganz besondere Attraktion auf dem „Alten Jahrmarkt“ für alle Kind";Redewendung
91563;undSolcheDieEsWerdenWollen;www.hansapark.de;Dr. Livingstone's Safari-Flug - Deutschlands einziger Erlebnispark am Meer;chpiloten und solche, die es werden wollen. Die Trom;"ug
Hansapark Park > Attraktionen > Dr. Livingstone's Safari-Flug
Einsatz für Buschpiloten und solche, die es werden wollen. Die Trommel ruft.
Eine ganz besondere Attraktion auf dem „Alten Jahrmarkt“ für alle Kind";double
99202;undSolcheDieEsWerdenWollen;www.randomhouse.de;Walter Moers: Zamonien. Knaus Verlag (eBook);"chrittene und solche, die es werden wollen!
Millione";"ent - Von A wie Anagrom Ataf bis Z wie Zamomin
Zamonien für Anfänger und Fortgeschrittene und solche, die es werden wollen!
Millionen Leser weltweit folgen Buch für Buch den Helden von Walter Moers und Hildegunst";Redewendung
141315;undSolcheDieEsWerdenWollen;www.campus.de;Foucault - Die Philosophie im Archiv, ein Buch von Petra Gehring - Campus Verlag;"chrittene und solche, die es werden wollen.
Petra Ge";"liefert eine anregende, überraschende Einführung in Foucaults Denken für Fortgeschrittene und solche, die es werden wollen.
Petra Gehring.";Redewendung
4154;undSolcheDieEsWerdenWollen;biogartenversand.de;Dengelamboss mit Auflagetisch;chrittene und solche, die es werden wollen. Herr Sch;wicklung von Ernst Schoiswohl im Hause Schröckenfux und gut geeignet für Fortgeschrittene und solche, die es werden wollen. Herr Schoiswohl empfiehlt einen normalen, harten Schlosserhammer mit 800 g Gewicht.;Redewendung
21037;undSolcheDieEsWerdenWollen;reinhard-doehl.de;Reinhard Döhl | Borchert, Wolfgang: Die traurigen Geranien und andere üeschichten aus dem Nachlaß;chstapler und solche die es werden wollen. - Berlin;"Januar 1966, S. 100 ff.
Serner, Walter: Letzte Lockerung. Ein Handbrevier für Hochstapler und solche die es werden wollen. - Berlin: Gerhardt (1964)
Zu den Autoren, denen im Zusammenhang einer Dadaismus-Forschun";Redewendung
1934;undSolcheDieEsWerdenWollen;culturmag.de;Roland Oßwald über Walter Serner - CulturMag;chstapler und solche, die es werden wollen besteht a;rnstlich böse, wenn du es nicht tust.“ Letzte Lockerung – Ein Handbrevier für Hochstapler und solche, die es werden wollen besteht aus zwei Teilen. Der erste Teil entsteht 1918 in Lugano mit dem Untertitel manife;double
16728;undSolcheDieEsWerdenWollen;www.dandy-club.com;Snob, Dandy und Gentleman » DANDY-CLUB;chstapler und solche, die es werden wollen und Henry;"re Bücher gehen, wie um Walter Serners Letzte Lockerung – Ein Handbrevier für Hochstapler und solche, die es werden wollen und Henry James´ Benvolio.
Literaturhandlung Moths
Eintritt 12 Euro.
Telephon (089) 29 16";double
103569;undSolcheDieEsWerdenWollen;stazol.net;Rezensionen zu kultur und gespenster – Harald Nicolas Stazol since 1970;chstapler und solche, die es werden wollen, einem Bu;n beginnt das Heft mit einem Auszug aus Letzte Lockerung. Ein Handbrevier für Hochstapler und solche, die es werden wollen, einem Buch der Tricks und Finten, aber auch des Handwerksstolzes und des aufrechten Gang;double
7820;undSolcheDieEsWerdenWollen;shop.jungle-world.com;jungle.world - Für Hochstapler;chstapler und solche, die es werden wollen«, das bei;derte Walter Serner in seinem Manifest »Letzte Lockerung. Ein Handbrevier für Hochstapler und solche, die es werden wollen«, das beim ersten Vortrag 1918 während einer Dada-Soirée zu Tumulten führte. »Weltanschau;double
27723;undSolcheDieEsWerdenWollen;www.literaturhaus-stuttgart.de;Hochstapeln - Ein Literaturfestival über Inszenierung und Täuschung | Freitag, 23.09.16 - Sonntag, 25.09.16 | Literaturhaus Stuttgart;chstapler und solche, die es werden wollen«. Serners;änen Bürgers und die 591 Lockerungsübungen des Breviers zur Pflicht für alle »Hochstapler und solche, die es werden wollen«. Serners dadaistisches Spiel mit Schein und Sein ist von bestechender Aktualität, seine ;double
125478;undSolcheDieEsWerdenWollen;www.deutsche-biographie.de;Deutsche Biographie - Serner, Walter;chstapler und solche, die es werden wollen“ (neu hg.;"ngreich und publizierte es unter dem Titel „Letzte Lockerung, Handbrevier für Hochstapler und solche, die es werden wollen“ (neu hg. u. komm. v. A. Puff-Trojan, 2007).
In der Nachkriegszeit konnte und wollte S. i";double
127852;undSolcheDieEsWerdenWollen;volkslesen.tv;Dadaisten lesen. ~ volkslesen.tv;chstapler und solche, die es werden wollen“ von Walt;"er ganzen Welt.
Adrian Notz liest aus „Letzte Lockerung – Ein Handbrevier für Hochstapler und solche, die es werden wollen“ von Walter Serner. Bis heute gilt die «Letzte Lockerung» als elementarer Leitfaden für a";double
123330;undSolcheDieEsWerdenWollen;walter-serner.de;Gedenktafel für Serner in Berlin (2016) - Walter Serner;chstapler und solche, die es werden wollen“. In dem ;te zweite Auflage der „Letzten Lockerung“ mit dem Zusatz „Ein Handbrevier für Hochstapler und solche, die es werden wollen“. In dem Handbrevier verarbeitet Serner seine Erfahrungen mit Reisen, Hotels, Menschen un;double
197892;undSolcheDieEsWerdenWollen;opc-ratgeber.de;OPC (Traubenkernextrakt): Nebenwirkungen und Empfehlungen;chwangere und solche die es werden wollen sollten d;"er allergisch auf Trauben reagiert sollte auf die Einnahme von OPC verzichten.
Schwangere und solche die es werden wollen sollten die Einnahme von Traubenkernextrakt vermeiden, da dieses Nahrungsergänzungsmittel";Redewendung
153844;undSolcheDieEsWerdenWollen;www.patchwork-kurse.ch;Kurse – Patchwork-Kurse;chworker (und solche, die es werden wollen) – ich bi;Liebe Patchworkerinnen und Patchworker (und solche, die es werden wollen) – ich biete laufend Kurse für Anfängerinnen und Fortgeschrittene in kleinen Gruppen in g;Redewendung
127624;undSolcheDieEsWerdenWollen;www.varta-guide.de;Das Altmühltal: Naturparadies mit bewegter Vergangenheit;chäologen und solche, die es werden wollen: Fossilie;" Bauwerke über das Tal der Altmühl.
Das Altmühltal ist ein besonderer Ort für Archäologen und solche, die es werden wollen: Fossilien des Urvogels Archaeopteryx wurden an keiner anderen Ausgrabungsstätte weltweit";Redewendung
123617;undSolcheDieEsWerdenWollen;wp.neue-impulse-verlag.de;Der Reclam Verlag (kartoniertes Buch) | Neue Impulse Verlag GmbH;clam-Fans und solche, die es werden wollen.;dert hat und zu welchen Kontinuitäten er sich nach wie vor bekennt - für alle Reclam-Fans und solche, die es werden wollen.;Redewendung
126468;undSolcheDieEsWerdenWollen;www.reclam.shop;Der Reclam Verlag | Reclam Verlag;"clam-Fans und solche, die es werden wollen.
Der Recl";"dert hat und zu welchen Kontinuitäten er sich nach wie vor bekennt – für alle Reclam-Fans und solche, die es werden wollen.
Der Reclam Verlag (EPUB)";double
19837;undSolcheDieEsWerdenWollen;webserver.x-technik.com;Härte-Wissen - webserver.x-technik.com;"co-Test – und solche, die es werden wollen.
Das „Här";"t.com ist multimedial nutzbar und ein kostenloser Service für alle Kunden von Emco-Test – und solche, die es werden wollen.
Das „Härte-Wissen“ auf www.emcotest.com ist multimedial nutzbar und ein...
Der Härteprüf";Redewendung
87515;undSolcheDieEsWerdenWollen;www.xn--nachwuchsfrderung-8zb.de;Ergebnisse zu: Eine | Nachwuchsförderung.de;czeichner und solche, die es werden wollen oder einf;"k"". In seinem Internetforum www.comiczeichenkurs.de tummeln sich jede Menge Comiczeichner und solche, die es werden wollen oder einfach Spaß am Zeichnen haben.Wegner, StefanieStefanie Wegner studierte nach dem Ab";Redewendung
