;kurz;source_domain;title;match;match_long;type
30506;boesenBuben;www.textatelier.com;Textatelier Hess von Biberstein;" Dich die bösen Buben locken,
D";" vom Lyriker und Aphoristiker Hans-Jürgen Murer wie folgt besungen worden:
„Wenn Dich die bösen Buben locken,
Dann bleib auf Deiner Stuben hocken!
Tritt nicht ans Fenster! schau nicht raus!
U";Redewendung
163497;boesenBuben;www.bod.ch;Heiraten! Oder besser doch nicht?; Ecke des bösen Buben gerückt, ;r aber ist ein entwaffneter Gegner, der, mit allen Tricks und Winkelzügen in die Ecke des bösen Buben gerückt, weder bei der Justiz noch bei seinem eigenen Anwalt Gehör findet. Ein ungleicher;Redewendung
82128;boesenBuben;www.kultur-vollzug.de;Christian Wulff ist weg - und sagt beim Rücktritt, Berichte hätten ihn verletzt: Ein Blick auf die Medienpolitik der CSU vor 30 Jahren aus gegebenem Anlass - Kulturvollzug; Lang die bösen Buben Polt und ;t hatte. Seinerseits satirisch aufgeladen, schlug der Fraktionsvorsitzende Gustl Lang die bösen Buben Polt und Hildebrandt für Robert Lembkes Berufsratespiel als „professionelle Rufmörder“ vo;Redewendung
206791;boesenBuben;www.neues-deutschland.de;Heiko Maas: Guter Glaube reicht nicht (neues-deutschland.de); Maas den bösen Buben in der EU;"Vorschlag zur Seenotrettung
Das Bündnis der Hilfsbereiten, mit dem Außenminister Maas den bösen Buben in der EU ein wenig Menschlichkeit in den Weg schieben will, erinnert ein klein wenig an ";Redewendung
76500;boesenBuben;meinemeinungmeineseite.com;April | 2018 | meinemeinungmeineseite | Seite 2; Nur die „bösen Buben“ werden d; flächendeckenden biometrischen Überwachung. Da ist wieder einmal Feuer am Dach. Nur die „bösen Buben“ werden den Brüsseler Edeldemokraten weiterhin eine lange Nase drehen, mehrere Identitäte;Redewendung
177644;boesenBuben;www.stadtteilarbeit.de;Bewohner ermutigen, aktivieren, organisieren. | stadtteilarbeit.de; Part des bösen Buben innehat. ;" grundsätzlich die heile Welt, ebenso wie die Verwaltung nicht grundsätzlich den Part des bösen Buben innehat. Nichts ist fein sortiert nach Gut und Böse. Denn es gibt weder ""die Verwaltung"" ";Redewendung
210153;boesenBuben;ulmerecho.de;Der „offene Vollzug” - Regelvollzug? ... oder Gefährdung der Bürger?; Zahl der bösen Buben erheblich;trafgefangenen (ca. 11.000 von 56.000) ein, in einigen Bundesländern scheint die Zahl der bösen Buben erheblich größer und somit das Häuflein der sieben Aufrechten erheblich kleiner zu sein. ;Redewendung
86047;boesenBuben;www.kreiszeitung-wochenblatt.de;Dr. Astrid Hillebrenner - Thema;" als mit ""bösen Buben"" zu tun
b";"derner...
Die Wachtmeister am Amtsgericht Tostedt haben mit weitaus mehr Briefen als mit ""bösen Buben"" zu tun
bim. Tostedt. Sie kontrollieren am Eingang der Gerichte die Besucher, führen Gefa";Redewendung
30157;boesenBuben;deutschelobby.com;05/02/2014 – deutschelobby; als „die bösen Buben“ der Vork;sche Kriegsschuld bestreitet. So heißt es etwa, er bewerte „die Serben“ a priori als „die bösen Buben“ der Vorkriegszeit, während er offen seine Vorliebe für das österreichisch-ungarische Kai;Redewendung
205685;boesenBuben;de.internationalism.org;Irak-Krise: | Internationale Kommunistische Strömung; auf den “bösen Buben” USA, die;hränken würde. Gemeinsam mit Frankreich und Deutschland zeigt sie mit dem Finger auf den “bösen Buben” USA, die ihrer Rolle als Hüterin der Demokratie nicht mehr gerecht würden, sondern immer;Redewendung
205209;boesenBuben;www.gi-de.com;Sicherheit bei mobilen Apps | G+D; bei den „bösen Buben“ widerspi;nd zwar besonders im Hinblick darauf, dass ein Anstieg der App-Nutzung sich auch bei den „bösen Buben“ widerspiegelt, da die Bedrohungslandschaft im Bereich der mobilen Sicherheit derzeit mit;Redewendung
91963;boesenBuben;www.dergrenadier.de;deltaforceblackhawkdown; bei! Die bösen Buben mischen s;n sollte, tragen einen großen Teil zu dieser beklemmend realistischen Atmosphäre bei! Die bösen Buben mischen sich oft unter zivile Personen und eröffnen dann das Feuer. Nun heißt es einen kü;Redewendung
57889;boesenBuben;www.n-tv.de;Bravo, Frau Bundeskanzlerin, Chapeau!: Die bösen Kerle aus der Autoindustrie - n-tv.de; dass die bösen Buben von heute;"und Moritz bei Wilhelm Busch geht es jetzt der deutschen Automobilindustrie. Nur dass die bösen Buben von heute BMW, Daimler oder VDA heißen. Ihnen wird in der Öffentlichkeit vorgeworfen - ""…";Redewendung
202811;boesenBuben;www.suhrkamp.de;Suhrkamp Insel 18 Thema: Praktische Philosophie; dich die bösen Buben locken / ;"heit / Herr Doktor, das ist schön von Euch / Antithese / They, the people / Wenn dich die bösen Buben locken / Vor al ... mehr »
Probleme der Moralphilosophie
Adorno hat zu Lebzeiten keine pr";Redewendung
175506;boesenBuben;www.compact-online.de;Wirtschaft: China überholt die USA früher als gedacht › COMPACT; ein paar bösen Buben auf die F;insatz von militärischen Mitteln geregelt wird. In westlichen Augen gilt es nur, ein paar bösen Buben auf die Finger zu klopfen, und die friedliche „Eine Welt“ könne sich weiterentwickeln. Mi;Redewendung
54595;boesenBuben;nilles.heimat.eu;Politische Seite März/April 2009;" für den ""bösen Buben"" Israel, ";"or wem? Es ist, als wollten sich die Völker bei den Palästinensern entschuldigen für den ""bösen Buben"" Israel, der das alles kaputt gemacht hat.
Und so hört man aus dem Munde der Verantwortli";Redewendung
169474;boesenBuben;spd-suedstadt-bult.de;"""The Beat goes on"" oder: als ""Pretty Flamingo"" in den ""Strawberry Fields"" die Unschuld… - SPD-Ortsverein Südstadt-Bult"; für die „bösen Buben“ von der ;Beatles die überhaupt erste Doppel-A-Single. Dem Rezensenten war die Parteinahme für die „bösen Buben“ von der Themse oder die „netten Jungs“ aus Liverpool ziemlich einerlei. Er hatte sich fü;Redewendung
14195;boesenBuben;www.animal-health-online.de;Offener Brief an Land- und Fleischwirtschaft; jene die bösen Buben, die Tier; damit ist noch nicht geklärt, ob die Tierschützer die moralisch Guten sind, und jene die bösen Buben, die Tiere mästen, töten und verzehren. In diesem Zusammenhang sei daran erinnert, dass e;Redewendung
85726;boesenBuben;fantasyguide.de;Sternenstaub (Bd. 1) - Fantasyguide; noch die bösen Buben, die ihre;"estalt eines Hasen angenommen hat.
Dazu kommen auf der Gegenseite natürlich auch noch die bösen Buben, die ihre eigenen Pläe mit allem haben – und nicht zuletzt die Eltern und ihre Kinderfrau";Redewendung
123300;boesenBuben;research.uni-leipzig.de;AG Zeitzeugen; nun die „bösen Buben“ Silveste;tbar. Daraus leitet sich im Praktischen die ketzerische Frage ab, wer waren denn nun die „bösen Buben“ Silvester am Kölner Dom. Der einfach und simpel denkende Mensch hat da natürlich eine vo;Redewendung
115277;boesenBuben;de.qantara.de;"""Flucht wirkt lebensrettend""";" nur ""die bösen Buben"", den Ira";"t lässt Putin zum Riesen werden.
Wir sind an einem Punkt angelangt, wo man nicht nur ""die bösen Buben"", den Iran, Russland und China, benennen sollte, sondern auch nach dem Westen fragen muss";Redewendung
108210;boesenBuben;william-tell.com;3. Daß sich die Mächtigen der Welt verschwören, um ihre Macht zu festigen, liegt nahe. Warum fällt es schwer, solche Fakten glaubwürdig zu vermitteln?;" nur die ""bösen Buben"" und ihre";"Das ist bei so einem heißen Thema sicherlich eine Gradwanderung. Die Bücher, die nur die ""bösen Buben"" und ihre Taten beschreiben und keine Lösung aufzeigen, kreieren hauptsächlich Angst, Gro";Redewendung
14809;boesenBuben;www.frankfurter-hefte.de;Angriff der Algorithmen, Wie das Scoring die Solidarität untergräbt - Neue Gesellschaft Frankfurter Hefte; nur die »bösen Buben« identifi;ionskrieg zu begegnen. Mit dem Scoring zur Vertrauenswürdigkeit möchte man nicht nur die »bösen Buben« identifizieren, die Fake News verbreiten, sondern auch solche, die das Facebook-Anzeiges;Redewendung
152523;boesenBuben;www.drehpunktkultur.at;Glossen und Kommentare asdf;" nur vom ""bösen Buben"" und niem";"rbende Frau bestohlen. Und die Berichterstattung in den Medien: Warum reden alle nur vom ""bösen Buben"" und niemand von der jungen Frau, die sich positiv engagiert und Hilfe geholt hat? Gedank";Redewendung
150562;boesenBuben;www8.wsws.org;Eine Lügenregierung - World Socialist Web Site; oder den bösen Buben, den jede;" Er fuhr fort: ""Es geht nicht um Matt Cooper oder Judith Miller oder die Wilsons oder den bösen Buben, den jeder so gerne hasst, den Ex-CNN-Star Robert Novak. Bei diesem Skandal geht es letzt";Redewendung
4319;boesenBuben;dienachtderlebendentexte.wordpress.com;Jeder gegen Jeden – Jagd auf Schließfach 314 | Die Nacht der lebenden Texte; sich die bösen Buben als überr;t: Alle auf den Boden, Weg da, Spiel bloß nicht den Helden. Und dennoch erweisen sich die bösen Buben als überraschend höflich und erlauben etwa noch einen letzten Anruf an die Liebsten, bevo;Redewendung
22336;boesenBuben;www.sopos.org;Diverse, Bemerkungen; sie vor »bösen Buben der märki;"erheit der brandenburgischen Bürger kann offensichtlich erhöht werden, indem man sie vor »bösen Buben der märkischen Polizei« (Berliner Kurier) schützt.
Wie notwendig das ist, dokumentiert de";Redewendung
69748;boesenBuben;www.lingen.de;Stadt Lingen (Ems) - Lingen Aktuell - Newsmeldungen; sind die bösen Buben nicht gen;chönen Obstbäume jetzt schutzlos der Blutlaus ausgeliefert worden sind. (…). Das sind die bösen Buben nicht genug, daß mit Knüppeln die Aepfel heruntergeworfen werden, sondern diese Burschen ;Redewendung
48437;boesenBuben;filmecke.blogspot.com;Frankies Filmecke: Walking Tall - The Payback; sind die bösen Buben not amuse;nd der Deputy seines Dads selbst auf, für Recht und Ordnung zu sorgen. Natürlich sind die bösen Buben not amused und gibt es zu Beginn noch zünftige Barschlägereien, bekriegt man sich später ;Redewendung
184320;boesenBuben;www.fachverband-deutsch.de;Unterrichtspraxis - Fachverband Deutsch; von zwei bösen Buben bietet ei;eth hat eine Ballade von Robert Louis Stevenson in Szene gesetzt. Die Geschichte von zwei bösen Buben bietet ein breites Spektrum im Kampf zwischen Gut und Böse. Die Form der Moritat wird auf;Redewendung
182193;boesenBuben;www.horror-page.de;Bloodshed; von zwei bösen Buben und deren;"m Mitternacht"" (1974) funktioniert hat. Schlicht und einfach wird die Geschichte von zwei bösen Buben und deren brutalen Aussetzern gezeigt. Sogar mit leichten gesellschaftskritischen Einwürf";Redewendung
17697;boesenBuben;germancircle.blogspot.com;German Circle: Nichts für leichte Mädchen und schwere Jungs; wenn die bösen Buben nächtens ; gesichert und auch ein Wachdienst ist mit dem Schutz des Hauses beauftragt. Und wenn die bösen Buben nächtens zur Geisterstunde an das Haus herantreten, stoßen sie auf zwei Schilder, die sie;Redewendung
4994;boesenBuben;zeitgeschichte-online.de;Interessengeleitete Wissenschaftsgeschichte?; wird zum bösen Buben, der als ;Johannes Stark, der Anfang Mai 1933 zum Präsidenten der PTR ernannt wurde. Stark wird zum bösen Buben, der als fanatischer Antisemit und Nationalsozialist bekannt war, zum ‚schwarzen Schaf‘, ;Redewendung
22667;boesenBuben;www.cover-up-newsmagazine.de;Osama bin Laden wirklich tot?;", um die ""bösen Buben & Mädels""";"ieht man deutlich, wie die Massen-
medien versuchen, jede Gestik dafür zu nutzen, um die ""bösen Buben & Mädels"" als freundliche, nur das beste
wollende Personen vor der Weltöffentlichkeit dar";Redewendung
47995;boesenBuben;de.wikipedia.org;Struwwelpeter – Wikipedia;, und die bösen Buben sind weit;"gen, der Schlingel hat sich die Welt erobert, ganz friedlich, ohne Blutvergießen, und die bösen Buben sind weiter auf der Erde herumgekommen als ich; ich habe gehört, dass man ihnen in Nord- ";Redewendung
94071;boesenBuben;bnn.de;Jugendeinrichtung Schloss Stutensee: Ein Blick hinter die Kulissen;,Haus der bösen Buben’“, erzähl;"chen ist, sind ausschließlich Jungen untergebracht. „Früher hießen wir auch das ,Haus der bösen Buben’“, erzählt Brandt.
Fast Alle nutzen die gebotene Chance
40 Jungen sind in verschiedenen W";Redewendung
196905;boesenBuben;www.ddr-maerchen.de;Max und Moritz - Fipps der Affe (DDR) Audio CD;. Die von bösen Buben, die da M;"s enthält eine MP3 der CD Max und Moritz - Fipps der Affe.
Wer kennt sie nicht... Die von bösen Buben, die da Max und Moritz hießen. Eine Bubengeschichte in sieben Streichen ist eine Bilderge";meta
43976;boesenBuben;www.autobild.de;Toyota Prius als Polizeiauto (2012) - Bilder - autobild.de;5er macht bösen Buben das Rasen;"86-e2897f1e33e86165.jpg
In Kroatien geht nichts über ""made in Germany"". Ein BMW 5er macht bösen Buben das Rasen schwer.
https://i.auto-bild.de/ir_img/9/3/9/9/8/2/Toyota-Prius-als-Polizeiauto-";Redewendung
176677;boesenBuben;www.tele.at;"""Bound - Gefesselt"" - Film - Thriller - OnDemand - tele.at";Angst vor bösen Buben haben und;achowski ist die feinfühlige Vorgabe, dass die coolen Lebenskünstler, die keine Angst vor bösen Buben haben und die Mafia ums Eingemachte erleichtern, diesmal Damen sind. In Hollywood geschi;Redewendung
167003;boesenBuben;www.meine-kirchenzeitung.de;Trump in Weimar - Thema;Bad Guy« (bösen Buben). Doch vi;" auf eine verstärkte Präsenz seines Militärs im Pazifik. Russland mutierte zum »Bad Guy« (bösen Buben). Doch viel wirklich Superneues gibt es nicht in den USA: Zur Person...
Evangelikale Jeru";Redewendung
85755;boesenBuben;www.vinschgerwind.it;Die bösen Buben;"Die bösen Buben
Aus dem G";"Die bösen Buben
Aus dem Gerichtssaal - „Ach, was muss man oft von bösen / Buben hören oder lesen. / Wie z";fail
85335;boesenBuben;m.radiobremen.de;Die bösen Buben der SPD - Der Morgen - Bremen Zwei - Radio Bremen;"Die bösen Buben der SPD
W";"Die bösen Buben der SPD
Wem die SPD bisher nicht Leid getan hat – der ist wahrscheinlich spätestens jetzt";Redewendung
34609;boesenBuben;www.egmont-manga.de;Detektiv Conan 93 von Gosho Aoyama | Egmont Manga;Die bösen Buben gucken ge;Die bösen Buben gucken gewöhnlich in die Röhre, wenn der kleine Conan den Tatort betritt. Und seit dieser;Redewendung
167692;boesenBuben;www.tagesspiegel.de;Spektakuläre Verbrechen: Auch in Berlin gab es Schießereien wie bei Al Capone - Berlin - Tagesspiegel;Film. Von bösen Buben und sympa;" unrecht ist, ist auch schlecht. Mancher Coup bot schon Stoff für Literatur und Film. Von bösen Buben und sympathischen Outlaws.
Das war filmreif: Pistolen im Gürtel, Gummischuhe gegen Lärm, ";Redewendung
160581;boesenBuben;wessels-filmkritik.com;Rebellinnen | Wessels-Filmkritik.com;Haben die bösen Buben erstmal i;ne Rolle spielt, dass es sich bei Sandra, Nadine und Marilyn um Frauen handelt. Haben die bösen Buben erstmal ihre Spuren aufgenommen, gehen sie mit ihnen genauso hart ins Gericht wie mit jed;Redewendung
41472;boesenBuben;www.bereitsgetestet.de;BD Kritik: Logan - The Wolverine - Bereitsgetestet;Horde von bösen Buben metzelt -;s Mädchen namens Laura – welches sich, wenn es darauf ankommt, durch eine ganze Horde von bösen Buben metzelt - in das staubige Leben der ehemaligen Superheros platzt. Sie wird von den Scherg;Redewendung
36346;boesenBuben;www.ich-geh-wandern.de;Wandern rund um Butzbach | GPS Wanderatlas;Hölle und bösen Buben im Kloste;enberg genannt sein, eine weiterer WetterAusflug: Rockenberg - von Rosen in der Hölle und bösen Buben im Kloster. 10km misst der Rundweg, der in der Obergasse in Rockenberg seinen Anfang nimm;Redewendung
107765;boesenBuben;www.profi-artikel24.de;Sport & Freizeit | Artikelsammlung;Image des bösen Buben durchaus ;"cherheit ist Anis kein sanfter Teddybär, dabei ist jedoch zu erwähnen, dass das Image des bösen Buben durchaus zu seinem Rapper-Dasein passt und nahezu zwingend nötig ist.
Auch unter Fanfusio";Redewendung
132191;boesenBuben;beb-schweppe.de;Ninas Tipps der Woche | Barrierefreie Ernährungsberatung;Image des bösen Buben verloren ;ehr ausführlich erforschtes Lebensmittel. Festzuhalten ist, dass der Kaffee das Image des bösen Buben verloren hat. Kaffee galt als Gift und wurde für Zivilisationskrankheiten wie Bluthochdru;Redewendung
117826;boesenBuben;www.umfrageinstitute.de;Ergebnisse zu: Bernd | Umfrageinstitute.de;König den bösen Buben klarmacht;ichkeit ihres Tuns zu überzeugen versucht! Schnallen Sie ab, wenn Eva Elisabeth König den bösen Buben klarmacht, dass sie von ihrer geliebten SF-Serie keine Ahnung haben! Greifen Sie sich an ;Redewendung
191609;boesenBuben;www.stadtwikidd.de;Sophie von Brandenburg - Stadtwiki Dresden;Lager der bösen Buben. In: SZ 6;"rche genannt wurde.
DELAU, Reinhard: Colditz. Kurfürstinresidenz, Irrenhaus und Lager der bösen Buben. In: SZ 6.6.1998
Von „https://www.stadtwikidd.de/wiki/Sophie_von_Brandenburg“";Redewendung
218680;boesenBuben;www.computerwoche.de;PC & Peripherie: Energie sparen am Mac, iPhone und iPad - computerwoche.de;"Name des ""bösen Buben"" unter de";"er einen Mausklick auf das Batteriesymbol angezeigt. Hier erscheint im Menü der Name des ""bösen Buben"" unter dem Eintrag ""erheblicher Energieverbrauch"". Ist der Bildschirm zu hell eingestellt";Redewendung
101956;boesenBuben;cdn1.stuttgarter-nachrichten.de;Kinostart von Rambo: Last Blood: Arnold Schwarzenegger nimmt Sylvester Stallone auf den Arm - Unterhaltung - Stuttgarter Nachrichten;"Predator"" bösen Buben den Gar a";"yp - und das nicht nur weil er in Filmen wie ""Terminator"", ""Total Recall"" oder ""Predator"" bösen Buben den Gar ausmachte. Der Action-Star ist zudem für jeden Spaß zu haben, wie ein Video zeigt";Redewendung
7490;boesenBuben;www.aktiendaten.de;www.Aktiendaten.de;Putin die bösen Buben waren, so;der damalige russische Präsident Medwedew und schon gar nicht Ministerpräsident Putin die bösen Buben waren, sondern der vom Westen gesteuerte georgische Präsident Saakaschwili. Er war es, de;Redewendung
98388;boesenBuben;libralop.de;"Das Blog des Libralop Hulot | The Irishman "">";"Reich der bösen Buben.
Der einz";"meidlich wie banal war. Und Joe Pesci. Damals wie heute der ungekrönte König im Reich der bösen Buben.
Der einzige Vorwurf, den ich wage, ist, dass der Film dreieinhalb Stunden lang ist. Nur ";Redewendung
95675;boesenBuben;literaturkritik.de;Der Inhalt der Leere - Christina von Braun und Bettina Mathes schreiben in „Verschleierte Wirklichkeit“ über den ‚westlichen Blick‘ auf ‚die Muslima‘ : literaturkritik.de;Rolle des bösen Buben eindeutig;ine besondere Merkwürdigkeit des vorliegenden Buches angesprochen. Zwar ist die Rolle des bösen Buben eindeutig ‚dem Westen‘ zugedacht, doch kennen die Autorinnen auch böse Frauen. Und das Me;Redewendung
47186;boesenBuben;www.dasinvestment.com;„Die Probleme können jederzeit wieder auftreten“ | DAS INVESTMENT;Rolle des bösen Buben herauszuk;ben? In keiner Weise. Tatsächlich haben sie selbst gar nichts getan, um aus der Rolle des bösen Buben herauszukommen. Weder haben sie die Löhne stärker erhöht, noch haben sie sich von ihrer r;Redewendung
154476;boesenBuben;www.waltpolitik.powerbone.de;WALTPOLITIK Walter Kuhl *** Kapital - Verbrechen *** Hartz IV,2;Rolle des bösen Buben, der sich;er der Sache angenommen. Bundeswirtschaftsminister Wolfgang Clement spielte die Rolle des bösen Buben, der sich bis zum Schluß beharrlich geweigert hat, das neue Arbeitslosengeld II schon im ;Redewendung
154231;boesenBuben;www.spiegel.de;Jamaika-Streitthema Familiennachzug: Maximal aufgeladen - DER SPIEGEL;Tagen den bösen Buben, vor alle;"nwalt, ein Anwärter auf das Amt des künftigen Finanzministers, spielt in diesen Tagen den bösen Buben, vor allem gegenüber den Grünen. ""In diesem Klima kann nichts gedeihen"", sagte er, als di";Redewendung
154395;boesenBuben;www.geo.de;Peter Pan - Die Gewinner - [GEOLINO];"Welt.
Die bösen Buben
Hier tref";"Pan das Mädchen Wendy und ihre beiden jüngeren Brüder mit in diese fantastische Welt.
Die bösen Buben
Hier treffen sie auf die ""verlorenen Kinder"" und auf die kleine Fee Tinker Bell. Doch im ";Redewendung
108889;boesenBuben;www.stern.de;Pac-Man: Eine Ikone mit nur 25 Jahren | STERN.de;a vor den bösen Buben davon ran;"altfreien Einfachheit. Pac-Man ""war niedlich und so etwas wie ein Held, wie er da vor den bösen Buben davon rannte. Ob es die 80-jährige alte Dame oder ein Kind war, jeder konnte sich in der ";Redewendung
52681;boesenBuben;soundtrackadventures.blogspot.com;Soundtrack Adventures: Januar 2013;adine als bösen Buben Bill und ;nicht mehr so viel Action und Blut auf, bietet dafür mehr Präsenz von David Carradine als bösen Buben Bill und ausgefeiltere Dialoge. Nach zwei Streichungen auf ihrer Todesliste sinnt die Bra;Redewendung
123315;boesenBuben;infowars.wordpress.com;Pakistan | infowars-deutschland;affenen – bösen Buben zu ermord;"entsendet um den niemals enden wollenden Strom an – von den Geheimdiensten geschaffenen – bösen Buben zu ermorden.
Blackwater auch in Pakistan in tödlicher Mission tätig
Veröffentlicht: 8. Au";Redewendung
203833;boesenBuben;www.nahaufnahmen.ch;„Bad Lieutenant“ von Werner Herzog – nahaufnahmen.ch;"afung der bösen Buben.
Nur etwa";"ral? Ein zynischer Schlag gegen das übliche Happy-End in Hollywood und der Bestrafung der bösen Buben.
Nur etwas schafft Terrence McDonagh nicht: Mit sich selbst und der Welt ins Reinen zu ko";Redewendung
161186;boesenBuben;www.lkz.de;„Das Opfer trägt niemals die Schuld“ - Startseite - Ludwigsburger Kreiszeitung;ainer den bösen Buben, der grap;ch für den Workshop „Sicher. Unterwegs – Frauen im ÖPNV“ mimt der Gewaltschutztrainer den bösen Buben, der grapschen oder Schlimmeres will. Doch bevor er zeigt, welche Griffe richtig wehtun k;Redewendung
35298;boesenBuben;www.scifinews.de;Die Legende des Zorro - Reviews SciFi-Filme - Scifinews.DE;als einen bösen Buben, der nur ;S ZORRO, „als wir über unseren Schurken Armand redeten, wir ihn nicht unbedingt als einen bösen Buben, der nur hinter Geld her ist, haben wollten. Statt dessen fügten wir dieser Figur eine ne;Redewendung
134131;boesenBuben;www.webinformation.at;Aktuelles 2011;ambos und bösen Buben klingt, w;"ch Orwellsches Neusprech angewandt: Weil „Berufsheer"" irgendwie nach Söldnern, Rambos und bösen Buben klingt, wird lieber mit dem viel sympathischeren Begriff „Freiwilligenheer"" operiert. Kla";Redewendung
77691;boesenBuben;digitalmall.limbecker-platz.de;Detektiv Conan 96 | Limbecker Platz, Essen;"anga)
Die bösen Buben gucken ge";"Detektiv Conan 96 (Egmont Manga)
Die bösen Buben gucken gewöhnlich in die Röhre, wenn der kleine Conan den Tatort betritt. Und seit dieser";Redewendung
180997;boesenBuben;zombiac.blog;Mark Millar Collection | ZOMBIAC;anier die bösen Buben einer aku;Held in Form eines Geheimagenten zur Hilfe, der ganz in klassischer James Bond-Manier die bösen Buben einer akuten Bleivergiftung zuführt und zur Rettung ansetzt die, so viel sei vorausgenomm;Redewendung
32379;boesenBuben;www.mitreden.braunschweig.de;Laterne ergänzen | Mitreden - Braunschweig;"auch die ""bösen Buben"" aus dire";"r ist hier bereits ab 16:30 Finsternis...vielleicht verschreckt so ein Licht ja auch die ""bösen Buben"" aus direkter Citynähe.";Redewendung
115236;boesenBuben;www.romantikerhaus-jena.de;„Da bin ich“ - Geschichten für Kinder von Wilhelm Busch, F. K. Waechter, Volker Kriegel und Philip Waechter.;bekannten bösen Buben treffen d;angspunkt der Ausstellung mit Meisterwerken der Kinderbuchillustration. Die weltbekannten bösen Buben treffen dabei auf das Gespenst von Canterville, auf eine kleine Katze, die nur knapp eine;meta
39619;boesenBuben;ludwig-galerie.saarlouis.de;"﻿ Ludwig Galerie: öffentliche Führung durch die Ausstellung ""Da bin ich""";bekannten bösen Buben von Wilhe;"ch „Max und Moritz“ ist der Ausgangspunkt der Ausstellung „Da bin ich“.
Die weltbekannten bösen Buben von Wilhelm Busch treffen dabei auf das Gespenst von Canterville, auf eine kleine Katze, ";double
178799;boesenBuben;www.eiris.eu;﻿ EIRIS Equipe Interdisciplinaire de Recherche sur l’Image Satirique - Exposition Busch, Ungerer, Waechter à Hannovre;bekannten bösen Buben von Wilhe;ker Kriegel, F. K. Waechter, Tomi Ungerer und Philip Waechter zu sehen: Die weltbekannten bösen Buben von Wilhelm Busch treffen dabei auf das Gespenst von Canterville, auf eine kleine Katze, ;double
19462;boesenBuben;www.rosalux.de;Autoritärer Neoliberalismus und Islamisierung - RLS;"can)
Die »bösen Buben« in strat";"mezustand in der Türkei und internationale Solidarität (gemeinsam mit Errol Babacan)
Die »bösen Buben« in strategischen Untiefen – Über die Hintergründe der aktuellen türkischen Außenpolitik
";Redewendung
85276;boesenBuben;www.pflichtlektuere.com;Warum wir so gerne von Mördern lesen | pflichtlektüre;chern, an bösen Buben und dem B;schen bis heute ähnlich geht. Doch was fasziniert sie alle an Mördern und Verbrechern, an bösen Buben und dem Brechen des fünften der Zehn Gebote? „Ich glaube, das hat schon viel mit Eskapism;Redewendung
189822;boesenBuben;geordnete-lebensfreude.de;Winter in La Paz | Geordnete Lebensfreude;chirm vor bösen Buben und Hunde;h dem Weg gefragt habe, hat mich dann gleich begleitet und mich mit ihrem Stockschirm vor bösen Buben und Hunden beschützen wollen. Dank der Höhe bin ich nur mit Mühe und Not hinter ihr den B;Redewendung
191807;boesenBuben;www.god.co.at;god.co - Buch: Alles für Allah;choltenen bösen Buben mimt, der;in Wirklichkeit fremdes Eigentum ist und der andere, die Rolle des von allen gescholtenen bösen Buben mimt, der das zu verteilende beschaffen muss. Es ist ein sehr perfides Spiel, das weite T;Redewendung
