;kurz;source_domain;title;match;match_long;type
40761;boesenBuben;www.faktum-magazin.de;"Besser spät als nie: ""Die Emanzipation ist durch"" – Faktum Magazin";t unserem bösen Buben unterhalt;"gangenheit bringen, wenn es schon lange zu spät ist.
Als hätte sich der Autor mit unserem bösen Buben unterhalten, kommt er auf den folgenden Punkt zu sprechen:
Wer ein Beispiel für letztere ";Redewendung
41257;boesenBuben;www.4players.de;Catwoman: neue Filmlizenz für EA;t, um die bösen Buben zu besieg;werk führen, in denen ihr die speziellen Fähigkeiten von Catwoman ausnutzen könnt, um die bösen Buben zu besiegen. Produziert wird Catwoman vom gleichen Team, das sich bereits um die Harry Po;Redewendung
65300;boesenBuben;www.nzz.ch;Wo die Liebe wehen will | NZZ;tig einen bösen Buben zur Strec;erlebt, in dem Gangsterstück «Broadway», als keckes Girl des Namens Ruby, das mutig einen bösen Buben zur Strecke brachte. Dann kam Berlin. Frau Dietrich war gebürtige Berlinerin, und hier wu;Redewendung
178388;boesenBuben;pjournals.com;Wie aus „Schitt´s Creek“ eine großartige Fernsehkomödie wurde 2020 - Unterhaltung;tigt, den bösen Buben Mutt zu s;en. Alexis war in der ersten Staffel zu selbstgefällig und zu sehr damit beschäftigt, den bösen Buben Mutt zu schlagen, um sich um die Selbstsorge zu sorgen. Ihre Wachstumstabelle enthält ein;Redewendung
77291;boesenBuben;michael-kunze-studio.com;Radikale Revision der Moderne von ANNEGRET ERHARD;titelten „bösen Buben der Moder; Anselm Kiefer oder Matthew Barney einreiht. 2007 widmet er diesen von ihm so betitelten „bösen Buben der Moderne“ die Ausstellung „Les Messieurs d’Avignon“ im ZKM in Karlsruhe. Dort zeigt er;Redewendung
149981;boesenBuben;wahlomat.tagesschau.de;Umstrittene Äußerungen: Trumps Spiel mit dem Rassismus | tagesschau.de;ton - vom bösen Buben zum Rette;"liens Innenminister lässt Sinti und Roma erfassen, 16.07.2019
Alitalia und Benetton - vom bösen Buben zum Retter, 16.07.2019
Waldbrände in Feriengebieten: Urlauber flüchten vor Flammen, 16.07";Redewendung
191891;boesenBuben;www.volksliederarchiv.de;Obstbäume | Volkslieder-Archiv (10.000 Lieder);ttern die bösen Buben hinauf. U;"Warum vergleicht man kleine Mädchen mit Obstbäumen? — Wenn sie größer sind, klettern die bösen Buben hinauf. Unter Scherzfragen . in Lacht Euch Laune (1925)
Mehr zu ""Obstbäume"" im Archiv
Obs";Redewendung
43936;boesenBuben;dienachtderlebendentexte.wordpress.com;Full Moon | Die Nacht der lebenden Texte;ttern die bösen Buben vor dem k;"r Erde
10.000 Lichtjahre von der Erde entfernt liegt der Planet Arturos. Dort zittern die bösen Buben vor dem knallharten Cop Brick Bardo (Tim Thomerson), der allerdings aufgrund seiner fragw";Redewendung
15505;boesenBuben;www.spiegel.de;G20: Stunde der bösen Buben - Kommentar - DER SPIEGEL;tunde der bösen Buben - Komment;"G20: Stunde der bösen Buben - Kommentar
G20-Gipfel Die Stunde der bösen Buben
Beim G20-Gipfel in Buenos Aires zeigt sich, was Donald Trumps Politik in der Welt anricht";Redewendung
98054;boesenBuben;www.gutzitiert.de;Eltern erziehen gemeiniglich ihre Kinder nur so, daß sie in...;uch einem bösen Buben zu lange ;ellseher sein. Es genügt, die Geschichtsbücher zu lesen. In den 1930er hat man auch einem bösen Buben zu lange alles durchgehen lassen - bis es dann plötzlich zu spät war und die Welt einen h;Redewendung
172990;boesenBuben;www.ndz.de;Piekbuben trumpfen auf;umpfenden bösen Buben lieb.;en „Semperfidelis“ am Freitag freien Lauf. Schnell gewann das Publikum die auftrumpfenden bösen Buben lieb.;Redewendung
94421;boesenBuben;www.nzz.ch;Augenblicke aus Glas | NZZ;und einen bösen Buben mit Glasa;om Film «Peur sur la ville» mit Jean-Paul Belmondo, der einen Polizisten spielt und einen bösen Buben mit Glasauge jagt. Die Prothese fällt heraus und geht zu Bruch, worauf die Polizisten zwe;Redewendung
53864;boesenBuben;www.spiegel.de;"Ixi - ""Knutschfleck"": One-Hit-Wonder der NDW - DER SPIEGEL";waren die bösen Buben und Tabub;"2raumwohnung.
Die ewigen Provokateure: DAF (Deutsch Amerikanische Freundschaft) waren die bösen Buben und Tabubrecher der Szene. Während große Teile der Neuen Deutschen Welle unpolitisch und ";Redewendung
59535;boesenBuben;www.eurotransport.de;Pakt gegen das Sozialdumping: Die Konsequenzen betrachten - Eurotransport;wird, die bösen Buben zu erwisc;"ahe Ausland. Ich persönlich fürchte, dass das BAG hier noch mehr Probleme haben wird, die bösen Buben zu erwischen.
Freud`scher Versprecher
Das Bestreben des EU-Mobilitätspaketes ist klar zu ";Redewendung
202029;boesenBuben;www.schattenblick.de;SCHATTENBLICK - INTERVIEW/279: Meeresnutzung - Überfischung ... Francisco Marí im Gespräch (SB);"ß wir die bösen Buben sind.
Es ";" unfair behandelt, denn sie erhalten keine staatlichen Hilfen. Da wissen wir, daß wir die bösen Buben sind.
Es gibt natürlich Superoptimisten wie den WWF, die sagen, wenn sich alle an die Fan";Redewendung
56274;boesenBuben;www.zimmer101.de;"Alle Artikel und Spiele zum Stichwort ""auto""";ämpfe mit bösen Buben, ausgefoc;"ng: Im Flugzeug, Schlauchboot, Auto und zu Fuß begibt sich Indy auf die Suche. Kämpfe mit bösen Buben, ausgefochten mit Peitsche, Pistole und ...
... über den Bildschirm, wirkt allerdings ama";Redewendung
55493;boesenBuben;gam-online.de;GAM Aufklärung Religionskritik Islamkritik Islam Religion Islamanalyse Wissenschaft Gesellschaftstheorie Kapitalismuskritik;üblichen „bösen Buben“ wie „PI ;chen „Aufklärungsartikel“ der „Neuen Osnabrücker Zeitung“1. Zunächst werden die üblichen „bösen Buben“ wie „PI News“, der früh verstorbene Udo Ulfkotte, der Kopp-Verlag, „Compact“-Magazin, di;Redewendung
104715;boesenBuben;echinger-zeitung.de;‚Ball der bösen Buben‘ – echinger-zeitung.de;"‚Ball der bösen Buben‘
Am 22. F";"‚Ball der bösen Buben‘
Am 22. Februar steigt wieder der „Ball der bösen Buben“ des Burschenvereins Eching im Bürgerhaus. Los geht’s um 19:30 Uhr (Einlass 19 Uhr) mit d";Redewendung
135558;boesenBuben;echinger-zeitung.de;Veranstaltungen – echinger-zeitung.de;"„Ball der bösen Buben“
8:00 - 1";"19:00 Grüne: ""Eching auf ins PaRADies?""
19:30 „Ball der bösen Buben“
8:00 - 16:00 Rathaus heute ganztägig geschlossen";Redewendung
168070;boesenBuben;burschenverein-eching.de;Chronik – burschenverein-eching 2020;„Ball der bösen Buben“ und dem ;"t hatten. Man ergänzte diesen Gaudiwurm durch zwei weitere Veranstaltungen, dem „Ball der bösen Buben“ und dem Kehraus, die beide zu Hochfesten des Echinger Faschings geworden sind.
Etwa im J";Redewendung
137236;boesenBuben;tarnkappe-forum.info;Tages-Infos Februar - Tages-Infos - Tarnkappe.info Forum;„wirklich bösen Buben“ nicht au;PWs für die Dienste zu ändern, bei denen man sich so einloggt, auch wenn es die „wirklich bösen Buben“ nicht aufhalten dürfte. Allerdings brauch’s - ähnlich wie beim Mutter- oder Valentinstag;Redewendung
