;kurz;source_domain;title;match;match_long;type
22065;WasIchSchonImmerSagenWollte;www.blitzverlag.de;Warnstreik im öffentlichen Dienst - Leserbrief: Blitzverlag;" Schmidt
Was ich schon immer sagen wollte, zum Warn";"Warnstreik im öffentlichen Dienst
21.03.2012, Karlheinz Schmidt
Was ich schon immer sagen wollte, zum Warnstreik des öffentliches Dienstes: Ich bin diesbezüglich geteilter Meinung. Die A";Redewendung
89434;WasIchSchonImmerSagenWollte;www.brautschoen.de;Kontakt – BrautSchön;"Was ich schon immer sagen wollte…
Hier kan";"Was ich schon immer sagen wollte…
Hier kannst Du uns das sagen, was Du schon immer sagen wolltest.
Montags bis Freitags vo";Redewendung
